CVE-2001-1233	2002-05-03	n/a	Netware Enterprise Web Server 5.1 running GroupWise WebAccess 5.5 with Novell Directory Services (NDS) enabled allows remote attackers to enumerate user names, group names and other system information by accessing ndsobj.nlm.
CVE-2001-1234	2002-06-25	n/a	Bharat Mediratta Gallery PHP script before 1.2.1 allows remote attackers to execute arbitrary code by including files from remote web sites via an HTTP request that modifies the includedir variable.
CVE-2001-1235	2002-06-25	n/a	pSlash PHP script 0.7 and earlier allows remote attackers to execute arbitrary code by including files from remote web sites, using an HTTP request that modifies the includedir variable.
CVE-2001-1236	2002-06-25	n/a	myphpPagetool PHP script 0.4.3-1 and earlier allows remote attackers to execute arbitrary code by including files from remote web sites, using an HTTP request that modifies the includedir variable.
CVE-2001-1237	2002-06-25	n/a	Phormation PHP script 0.9.1 and earlier allows remote attackers to execute arbitrary code by including files from remote web sites, using an HTTP request that modifies the phormationdir variable.
CVE-2001-1238	2002-05-03	n/a	Task Manager in Windows 2000 does not allow local users to end processes with uppercase letters named (1) winlogon.exe, (2) csrss.exe, (3) smss.exe and (4) services.exe via the Process tab which could allow local users to install Trojan horses that cannot be stopped with the Task Manager.
CVE-2001-1239	2002-05-03	n/a	PowerNet IX allows remote attackers to cause a denial of service via a port scan.
CVE-2001-1240	2002-06-25	n/a	The default configuration of sudo in Engarde Secure Linux 1.0.1 allows any user in the admin group to run certain commands that could be leveraged to gain full root access.
CVE-2001-1241	2002-05-03	n/a	Un-CGI 1.9 and earlier does not verify that a CGI script has the execution bits set before executing it, which allows remote attackers to execute arbitrary commands by directing Un-CGI to a document that begins with "#!"  and the desired program name.
CVE-2001-1242	2002-05-03	n/a	Directory traversal vulnerability in Un-CGI 1.9 and earlier allows remote attackers to execute arbitrary code via a .. (dot dot) in an HTML form.
CVE-2001-1243	2002-05-03	n/a	Scripting.FileSystemObject in asp.dll for Microsoft IIS 4.0 and 5.0 allows local or remote attackers to cause a denial of service (crash) via (1) creating an ASP program that uses Scripting.FileSystemObject to open a file with an MS-DOS device name, or (2) remotely injecting the device name into ASP programs that internally use Scripting.FileSystemObject.
CVE-2001-1244	2002-05-03	n/a	Multiple TCP implementations could allow remote attackers to cause a denial of service (bandwidth and CPU exhaustion) by setting the maximum segment size (MSS) to a very small number and requesting large amounts of data, which generates more packets with less TCP-level data that amplify network traffic and consume more server CPU to process.
CVE-2001-1245	2002-05-03	n/a	Opera 5.0 for Linux does not properly handle malformed HTTP headers, which allows remote attackers to cause a denial of service, possibly with a header whose value is the same as a MIME header name.
CVE-2001-1246	2002-06-25	n/a	PHP 4.0.5 through 4.1.0 in safe mode does not properly cleanse the 5th parameter to the mail() function, which allows local users and possibly remote attackers to execute arbitrary commands via shell metacharacters.
CVE-2001-1247	2002-06-25	n/a	PHP 4.0.4pl1 and 4.0.5 in safe mode allows remote attackers to read and write files owned by the web server UID by uploading a PHP script that uses the error_log function to access the files.
CVE-2001-1248	2002-05-03	n/a	vWebServer 1.2.0 allows remote attackers to view arbitrary ASP scripts via a request for an ASP script that ends with a URL-encoded space character (%20).
CVE-2001-1249	2002-05-03	n/a	vWebServer 1.2.0 allows remote attackers to cause a denial of service via a URL that contains MS-DOS device names.
CVE-2001-1250	2002-05-03	n/a	vWebServer 1.2.0 allows remote attackers to cause a denial of service (hang) via a small number of long URL requests, possibly due to a buffer overflow.
CVE-2001-1251	2003-04-02	n/a	SmallHTTP 1.204 through 3.00 beta 8 allows remote attackers to cause a denial of service via multiple long URL requests.
CVE-2001-1252	2002-06-25	n/a	Network Associates PGP Keyserver 7.0 allows remote attackers to bypass authentication and access the administrative web interface via URLs that directly access cgi-bin instead of keyserver/cgi-bin for the programs (1) console, (2) cs, (3) multi_config and (4) directory.
CVE-2001-1253	2002-05-03	n/a	Alexis 2.0 and 2.1 in COM2001 InternetPBX stores voicemail passwords in plain text in the com2001.ini file, which could allow local users to make long distance calls as other users.
CVE-2001-1254	2002-05-03	n/a	Web Access component for COM2001 Alexis 2.0 and 2.1 in InternetPBX sends username and voice mail passwords in the clear via a Java applet that sends the information to port 8888 of the server, which could allow remote attackers to steal the passwords via sniffing.
CVE-2001-1255	2002-05-03	n/a	WinMySQLadmin 1.1 stores the MySQL password in plain text in the my.ini file, which allows local users to obtain unathorized access the MySQL database.
CVE-2001-1256	2002-05-03	n/a	kmmodreg in HP-UX 11.11, 11.04 and 11.00 allows local users to create arbitrary world-writeable files via a symlink attack on the (1) /tmp/.kmmodreg_lock and (2) /tmp/kmpath.tmp temporary files.
CVE-2001-1257	2002-05-03	n/a	Cross-site scripting vulnerability in Horde Internet Messaging Program (IMP) before 2.2.6 and 1.2.6 allows remote attackers to execute arbitrary Javascript embedded in an email.
CVE-2001-1258	2002-05-03	n/a	Horde Internet Messaging Program (IMP) before 2.2.6 allows local users to read IMP configuration files and steal the Horde database password by placing the prefs.lang file containing PHP code on the server.
CVE-2001-1259	2002-05-03	n/a	Avaya Argent Office allows remote attackers to cause a denial of service by sending UDP packets to port 53 with no payload.
CVE-2001-1260	2002-05-03	n/a	Avaya Argent Office uses weak encryption (trivial encoding) for passwords, which allows remote attackers to gain administrator privileges by sniffing and decrypting the sniffing the passwords during a system reboot.
CVE-2001-1261	2002-05-03	n/a	Avaya Argent Office 2.1 may allow remote attackers to change hold music by spoofing a legitimate server's response to a TFTP broadcast and providing an alternate HoldMusic file.
CVE-2001-1262	2002-05-03	n/a	Avaya Argent Office 2.1 compares a user-provided SNMP community string with the correct string only up to the length of the user-provided string, which allows remote attackers to bypass authentication with a 0 length community string.
CVE-2001-1263	2002-05-03	n/a	telnet95.exe in Pragma InterAccess 4.0 build 5 allows remote attackers to cause a denial of service (crash) via a large number of characters to port 23, possibly due to a buffer overflow.
CVE-2001-1264	2002-05-03	n/a	Vulnerability in mkacct in HP-UX 11.04 running Virtualvault Operating System (VVOS) 4.0 and 4.5 allows attackers to elevate privileges.
CVE-2001-1265	2002-05-03	n/a	Directory traversal vulnerability in IBM alphaWorks Java TFTP server 1.21 allows remote attackers to conduct unauthorized operations on arbitrary files via a .. (dot dot) attack.
CVE-2001-1266	2002-06-25	n/a	Directory traversal vulnerability in Doug Neal's HTTPD Daemon (DNHTTPD) before 0.4.1 allows remote attackers to view arbitrary files via a .. (dot dot) attack using the dot hex code '%2E'.
CVE-2001-1267	2004-09-01	n/a	Directory traversal vulnerability in GNU tar 1.13.19 and earlier allows local users to overwrite arbitrary files during archive extraction via a tar file whose filenames contain a .. (dot dot).
CVE-2001-1268	2002-05-03	n/a	Directory traversal vulnerability in Info-ZIP UnZip 5.42 and earlier allows attackers to overwrite arbitrary files during archive extraction via a .. (dot dot) in an extracted filename.
CVE-2001-1269	2002-05-03	n/a	Info-ZIP UnZip 5.42 and earlier allows attackers to overwrite arbitrary files during archive extraction via filenames in the archive that begin with the '/' (slash) character.
CVE-2001-1270	2002-05-03	n/a	Directory traversal vulnerability in the console version of PKZip (pkzipc) 4.00 and earlier allows attackers to overwrite arbitrary files during archive extraction with the -rec (recursive) option via a .. (dot dot) attack on the archived files.
CVE-2001-1271	2002-05-03	n/a	Directory traversal vulnerability in rar 2.02 and earlier allows attackers to overwrite arbitrary files during archive extraction via a ..  (dot dot) attack on archived filenames.
CVE-2001-1272	2002-05-03	n/a	wmtv 0.6.5 and earlier does not properly drop privileges, which allows local users to execute arbitrary commands via the -e (external command) option.
CVE-2001-1273	2002-05-03	n/a	The "mxcsr P4" vulnerability in the Linux kernel before 2.2.17-14, when running on certain Intel CPUs, allows local users to cause a denial of service (system halt).
CVE-2001-1274	2002-05-03	n/a	Buffer overflow in MySQL before 3.23.31 allows attackers to cause a denial of service and possibly gain privileges.
CVE-2001-1275	2002-05-03	n/a	MySQL before 3.23.31 allows users with a MySQL account to use the SHOW GRANTS command to obtain the encrypted administrator password from the mysql.user table and possibly gain privileges via password cracking.
CVE-2001-1276	2002-06-25	n/a	ispell before 3.1.20 allows local users to overwrite files of other users via a symlink attack on a temporary file.
CVE-2001-1277	2002-06-25	n/a	makewhatis in the man package before 1.5i2 allows an attacker in group man to overwrite arbitrary files via a man page whose name contains shell metacharacters.
CVE-2001-1278	2002-05-03	n/a	Zope before 2.2.4 allows partially trusted users to bypass security controls for certain methods by accessing the methods through the fmt attribute of dtml-var tags.
CVE-2001-1279	2004-09-01	n/a	Buffer overflow in print-rx.c of tcpdump 3.x (probably 3.6x) allows remote attackers to cause a denial of service and possibly execute arbitrary code via AFS RPC packets with invalid lengths that trigger an integer signedness error, a different vulnerability than CVE-2000-1026.
CVE-2001-1280	2002-05-03	n/a	POP3 Server for Ipswitch IMail 7.04 and earlier generates different responses to valid and invalid user names, which allows remote attackers to determine users on the system.
CVE-2001-1281	2002-05-03	n/a	Web Messaging Server for Ipswitch IMail 7.04 and earlier allows remote authenticated users to change information for other users by modifying the olduser parameter in the "Change User Information" web form.
CVE-2001-1282	2002-05-03	n/a	Ipswitch IMail 7.04 and earlier records the physical path of attachments in an e-mail message header, which could allow remote attackers to obtain potentially sensitive configuration information.
CVE-2001-1283	2002-05-03	n/a	The webmail interface for Ipswitch IMail 7.04 and earlier allows remote authenticated users to cause a denial of service (crash) via a mailbox name that contains a large number of . (dot) or other characters to programs such as (1) readmail.cgi or (2) printmail.cgi, possibly due to a buffer overflow that may allow execution of arbitrary code.
CVE-2001-1284	2002-05-03	n/a	Ipswitch IMail 7.04 and earlier uses predictable session IDs for authentication, which allows remote attackers to hijack sessions of other users.
CVE-2001-1285	2002-05-03	n/a	Directory traversal vulnerability in readmail.cgi for Ipswitch IMail 7.04 and earlier allows remote attackers to access the mailboxes of other users via a .. (dot dot) in the mbx parameter.
CVE-2001-1286	2002-05-03	n/a	Ipswitch IMail 7.04 and earlier stores a user's session ID in a URL, which could allow remote attackers to hijack sessions by obtaining the URL, e.g. via an HTML email that causes the Referrer to be sent to a URL under the attacker's control.
CVE-2001-1287	2002-05-03	n/a	Buffer overflow in Web Calendar in Ipswitch IMail 7.04 and earlier allows remote attackers to execute arbitrary code via a long HTTP GET request.
CVE-2001-1288	2002-05-03	n/a	Windows 2000 and Windows NT allows local users to cause a denial of service (reboot) by executing a command at the command prompt and pressing the F7 and enter keys several times while the command is executing, possibly related to an exception handling error in csrss.exe.
CVE-2001-1289	2002-05-03	n/a	Quake 3 arena 1.29f and 1.29g allows remote attackers to cause a denial of service (crash) via a malformed connection packet that begins with several char-255 characters.
CVE-2001-1290	2002-05-03	n/a	admin.cgi in Active Classifieds Free Edition 1.0, and possibly commercial versions, allows remote attackers to modify the configuration, gain privileges, and execute arbitrary Perl code via the table_width parameter.
CVE-2001-1291	2003-04-02	n/a	The telnet server for 3Com hardware such as PS40 SuperStack II does not delay or disconnect remote attackers who provide an incorrect username or password, which makes it easier to break into the server via brute force password guessing.
CVE-2001-1292	2002-05-03	n/a	Sambar Telnet Proxy/Server allows remote attackers to cause a denial of service and possibly execute arbitrary code via a long password.
CVE-2001-1293	2002-05-03	n/a	Buffer overflow in web server of 3com HomeConnect Cable Modem External with USB (#3CR29223) allows remote attackers to cause a denial of service (crash) via a long HTTP request.
CVE-2001-1294	2002-05-03	n/a	Buffer overflow in A-V Tronics Inetserv 3.2.1 and earlier allows remote attackers to cause a denial of service (crash) in the Webmail interface via a long username and password.
CVE-2001-1295	2002-06-25	n/a	Directory traversal vulnerability in Cerberus FTP Server 1.5 and earlier allows remote attackers to read arbitrary files via a .. (dot dot) in the CD command.
CVE-2001-1296	2003-04-02	n/a	More.groupware PHP script allows remote attackers to include arbitrary files from remote web sites via an HTTP request that sets the includedir variable.
CVE-2001-1297	2002-06-25	n/a	PHP remote file inclusion vulnerability in Actionpoll PHP script before 1.1.2 allows remote attackers to execute arbitrary PHP code via a URL in the includedir parameter.
CVE-2001-1298	2002-05-03	n/a	Webodex PHP script 1.0 and earlier allows remote attackers to include arbitrary files from remote web sites via an HTTP request that sets the includedir variable.
CVE-2001-1299	2002-06-25	n/a	Zorbat Zorbstats PHP script before 0.9 allows remote attackers to include arbitrary files from remote web sites via an HTTP request that sets the includedir variable.
CVE-2001-1300	2002-05-03	n/a	Directory traversal vulnerability in Dynu FTP server 1.05 and earlier allows remote attackers to read arbitrary files via a .. in the CD (CWD) command.
CVE-2001-1301	2003-04-02	n/a	rcs2log, as used in Emacs 20.4, xemacs 21.1.10 and other versions before 21.4, and possibly other packages, allows local users to modify files of other users via a symlink attack on a temporary file.
CVE-2001-1302	2004-09-01	n/a	The change password option in the Windows Security interface for Windows 2000 allows attackers to use the option to attempt to change passwords of other users on other systems or identify valid accounts by monitoring error messages, possibly due to a problem in the NetuserChangePassword function.
CVE-2001-1303	2003-04-02	n/a	The default configuration of SecuRemote for Check Point Firewall-1 allows remote attackers to obtain sensitive configuration information for the protected network without authentication.
CVE-2001-1304	2002-05-03	n/a	Buffer overflow in SHOUTcast Server 1.8.2 allows remote attackers to cause a denial of service (crash) via several HTTP requests with a long (1) user-agent or (2) host HTTP header.
CVE-2001-1305	2002-05-03	n/a	ICQ 2001a Alpha and earlier allows remote attackers to automatically add arbitrary UINs to an ICQ user's contact list via a URL to a web page with a Content-Type of application/x-icq, which is processed by Internet Explorer.
CVE-2001-1306	2002-05-03	n/a	iPlanet Directory Server 4.1.4 and earlier (LDAP) allows remote attackers to cause a denial of service (crash) and possibly execute arbitrary code via invalid BER length of length fields, as demonstrated by the PROTOS LDAPv3 test suite.
CVE-2001-1307	2002-05-03	n/a	Buffer overflows in iPlanet Directory Server 4.1.4 and earlier (LDAP) allow remote attackers to cause a denial of service (crash) and possibly execute arbitrary code, as demonstrated by the PROTOS LDAPv3 test suite.
CVE-2001-1308	2002-05-03	n/a	Format string vulnerabilities in iPlanet Directory Server 4.1.4 and earlier (LDAP) allow remote attackers to cause a denial of service (crash) and possibly execute arbitrary code, as demonstrated by the PROTOS LDAPv3 test suite.
CVE-2001-1309	2002-05-03	n/a	Buffer overflows in IBM SecureWay 3.2.1 allow remote attackers to cause a denial of service (crash) and possibly execute arbitrary code, as demonstrated by the PROTOS LDAPv3 test suite.
CVE-2001-1310	2002-05-03	n/a	IBM SecureWay 3.2.1 allow remote attackers to cause a denial of service (crash) and possibly execute arbitrary code, via invalid encodings for the L field of a BER encoding, as demonstrated by the PROTOS LDAPv3 test suite.
CVE-2001-1311	2002-05-03	n/a	Buffer overflows in Lotus Domino R5 before R5.0.7a allow remote attackers to cause a denial of service (crash) and possibly execute arbitrary code, as demonstrated by the PROTOS LDAPv3 test suite.
CVE-2001-1312	2002-05-03	n/a	Format string vulnerabilities in Lotus Domino R5 before R5.0.7a allow remote attackers to cause a denial of service (crash) and possibly execute arbitrary code, as demonstrated by the PROTOS LDAPv3 test suite.
CVE-2001-1313	2002-05-03	n/a	Lotus Domino R5 before R5.0.7a allows remote attackers to cause a denial of service (crash) and possibly execute arbitrary code via miscellaneous packets with semi-valid BER encodings, as demonstrated by the PROTOS LDAPv3 test suite.
CVE-2001-1314	2002-05-03	n/a	Buffer overflows in Critical Path (1) InJoin Directory Server or (2) LiveContent Directory allow remote attackers to cause a denial of service (crash) and possibly execute arbitrary code, as demonstrated by the PROTOS LDAPv3 test suite.
CVE-2001-1315	2002-05-03	n/a	Critical Path (1) InJoin Directory Server or (2) LiveContent Directory allow remote attackers to cause a denial of service (crash) and possibly execute arbitrary code via malformed BER encodings, as demonstrated by the PROTOS LDAPv3 test suite.
CVE-2001-1316	2002-05-03	n/a	Buffer overflows in Teamware Office Enterprise Directory allows remote attackers to cause a denial of service (crash) and possibly execute arbitrary code, as demonstrated by the PROTOS LDAPv3 test suite.
CVE-2001-1317	2002-05-03	n/a	Teamware Office Enterprise Directory allows remote attackers to cause a denial of service (crash) and possibly execute arbitrary code, via invalid encodings for certain BER object types, as demonstrated by the PROTOS LDAPv3 test suite.
CVE-2001-1318	2002-05-03	n/a	Vulnerabilities in Qualcomm Eudora WorldMail Server may allow remote attackers to cause a denial of service (crash) and possibly execute arbitrary code, as demonstrated by the PROTOS LDAPv3 test suite.
CVE-2001-1319	2002-05-03	n/a	Microsoft Exchange 5.5 2000 allows remote attackers to cause a denial of service (hang) via exceptional BER encodings for the LDAP filter type field, as demonstrated by the PROTOS LDAPv3 test suite.
CVE-2001-1320	2002-05-03	n/a	Network Associates PGP Keyserver 7.0 allows remote attackers to cause a denial of service (crash) and possibly execute arbitrary code via exceptional BER encodings (possibly buffer overflows), as demonstrated by the PROTOS LDAPv3 test suite.
CVE-2001-1321	2002-05-03	n/a	Oracle Internet Directory Server 2.1.1.x and 3.0.1 allows remote attackers to cause a denial of service (crash) and possibly execute arbitrary code via invalid encodings of BER OBJECT-IDENTIFIER values, as demonstrated by the PROTOS LDAPv3 test suite.
CVE-2001-1322	2002-06-25	n/a	xinetd 2.1.8 and earlier runs with a default umask of 0, which could allow local users to read or modify files that are created by an application that runs under xinetd but does not set its own safe umask.
CVE-2001-1323	2002-05-03	n/a	Buffer overflow in MIT Kerberos 5 (krb5) 1.2.2 and earlier allows remote attackers to cause a denial of service and possibly execute arbitrary code via base-64 encoded data, which is not properly handled when the radix_encode function processes file glob output from the ftpglob function.
CVE-2001-1324	2002-05-03	n/a	cvmlogin and statfile in Paul Jarc idtools before 2001.06.27 do not properly check the return value of a call to the pathexec_env function, which could cause the setstate utility to setuid to the UID environment variable and allow local users to gain privileges.
CVE-2001-1325	2002-05-03	n/a	Internet Explorer 5.0 and 5.5, and Outlook Express 5.0 and 5.5, allow remote attackers to execute scripts when Active Scripting is disabled by including the scripts in XML stylesheets (XSL) that are referenced using an IFRAME tag, possibly due to a vulnerability in Windows Scripting Host (WSH).
CVE-2001-1326	2002-05-03	n/a	Eudora 5.1 allows remote attackers to execute arbitrary code when the "Use Microsoft Viewer" option is enabled and the "allow executables in HTML content" option is disabled, via an HTML email with a form that is activated from an image that the attacker spoofs as a link, which causes the user to execute the form and access embedded attachments.
CVE-2001-1327	2003-04-02	n/a	pmake before 2.1.35 in Turbolinux 6.05 and earlier is installed with setuid root privileges, which could allow local users to gain privileges by exploiting vulnerabilities in pmake or programs that are used by pmake.
CVE-2001-1328	2004-09-01	n/a	Buffer overflow in ypbind daemon in Solaris 5.4 through 8 allows remote attackers to execute arbitrary code.
CVE-2001-1329	2002-05-03	n/a	Buffer overflow in rsh on AIX 4.2.0.0 may allow local users to gain root privileges via a long command line argument.
CVE-2001-1330	2002-05-03	n/a	Buffer overflow in rsh on AIX 4.2.0.0 may allow local users to gain root privileges via a long command line argument.
CVE-2001-1331	2002-05-03	n/a	mandb in the man-db package before 2.3.16-3 allows local users to overwrite arbitrary files via the command line options (1) -u or (2) -c, which do not drop privileges and follow symlinks.
CVE-2001-1332	2002-05-03	n/a	Buffer overflows in Linux CUPS before 1.1.6 may allow remote attackers to execute arbitrary code.
CVE-2001-1333	2002-05-03	n/a	Linux CUPS before 1.1.6 does not securely handle temporary files, possibly due to a symlink vulnerability that could allow local users to overwrite files.
CVE-2001-1334	2003-04-02	n/a	Block_render_url.class in PHPSlash 0.6.1 allows remote attackers with PHPSlash administrator privileges to read arbitrary files by creating a block and specifying the target file as the source URL.
CVE-2001-1335	2002-05-03	n/a	Directory traversal vulnerability in CesarFTP 0.98b and earlier allows remote authenticated users (such as anonymous) to read arbitrary files via a GET with a filename that contains a ...%5c (modified dot dot).
CVE-2001-1336	2002-05-03	n/a	CesarFTP 0.98b and earlier stores usernames and passwords in plaintext in the settings.ini file, which allows attackers to gain privileges.
CVE-2001-1337	2002-05-03	n/a	Beck IPC GmbH IPC@CHIP Embedded-Webserver allows remote attackers to cause a denial of service via a long HTTP request.
CVE-2001-1338	2002-05-03	n/a	Beck IPC GmbH IPC@CHIP TelnetD server generates different responses when given valid and invalid login names, which allows remote attackers to determine accounts on the system.
CVE-2001-1339	2002-05-03	n/a	Beck IPC GmbH IPC@CHIP telnet service does not delay or disconnect users from the service when bad passwords are entered, which makes it easier for remote attackers to conduct brute force password guessing attacks.
CVE-2001-1340	2002-05-03	n/a	Beck GmbH IPC@Chip TelnetD service supports only one connection and does not disconnect a user who does not complete the login process, which allows remote attackers to lock out the administrator account by connecting to the service.
CVE-2001-1341	2002-05-03	n/a	The Beck GmbH IPC@Chip embedded web server installs the chipcfg.cgi program by default, which allows remote attackers to obtain sensitive network information via a request to the program.
CVE-2001-1342	2002-06-25	n/a	Apache before 1.3.20 on Windows and OS/2 systems allows remote attackers to cause a denial of service (GPF) via an HTTP request for a URI that contains a large number of / (slash) or other characters, which causes certain functions to dereference a null pointer.
CVE-2001-1343	2002-05-03	n/a	ws_mail.cgi in WebStore 400/400CS 4.14 allows remote authenticated WebStore administrators to execute arbitrary code via shell metacharacters in the kill parameter.
CVE-2001-1344	2002-05-03	n/a	WSSecurity.pl in WebStore allows remote attackers to bypass authentication by providing the program with a filename that exists, which is made easier by (1) inserting a null character or (2) .. (dot dot).
CVE-2001-1345	2002-06-25	n/a	bctool in Jetico BestCrypt 0.7 and earlier trusts the user-supplied PATH to find and execute an fsck utility program, which allows local users to gain privileges by modifying the PATH to point to a Trojan horse program.
CVE-2001-1346	2002-05-03	n/a	Computer Associates ARCserveIT 6.61 and 6.63 (also called ARCservIT) allows local users to overwrite arbitrary files via a symlink attack on the temporary files (1) asagent.tmp or (2) inetd.tmp.
