CVE-2001-0001	2002-03-09	n/a	cookiedecode function in PHP-Nuke 4.4 allows users to bypass authentication and gain access to other user accounts by extracting the authentication information from a cookie.
CVE-2001-0002	2001-05-07	n/a	Internet Explorer 5.5 and earlier allows remote attackers to obtain the physical location of cached content and open the content in the Local Computer Zone, then use compiled HTML help (.chm) files to execute arbitrary programs.
CVE-2001-0003	2001-05-07	n/a	Web Extender Client (WEC) in Microsoft Office 2000, Windows 2000, and Windows Me does not properly process Internet Explorer security settings for NTLM authentication, which allows attackers to obtain NTLM credentials and possibly obtain the password, aka the "Web Client NTLM Authentication" vulnerability.
CVE-2001-0004	2001-09-18	n/a	IIS 5.0 and 4.0 allows remote attackers to read the source code for executable web server programs by appending "%3F+.htr" to the requested URL, which causes the files to be parsed by the .HTR ISAPI extension, aka a variant of the "File Fragment Reading via .HTR" vulnerability.
CVE-2001-0005	2001-05-07	n/a	Buffer overflow in the parsing mechanism of the file loader in Microsoft PowerPoint 2000 allows attackers to execute arbitrary commands.
CVE-2001-0006	2001-05-07	n/a	The Winsock2ProtocolCatalogMutex mutex in Windows NT 4.0 has inappropriate Everyone/Full Control permissions, which allows local users to modify the permissions to "No Access" and disable Winsock network connectivity to cause a denial of service, aka the "Winsock Mutex" vulnerability.
CVE-2001-0007	2002-03-09	n/a	Buffer overflow in NetScreen Firewall WebUI allows remote attackers to cause a denial of service via a long URL request to the web administration interface.
CVE-2001-0008	2001-05-07	n/a	Backdoor account in Interbase database server allows remote attackers to overwrite arbitrary files using stored procedures.
CVE-2001-0009	2001-05-07	n/a	Directory traversal vulnerability in Lotus Domino 5.0.5 web server allows remote attackers to read arbitrary files via a .. attack.
CVE-2001-0010	2001-05-07	n/a	Buffer overflow in transaction signature (TSIG) handling code in BIND 8 allows remote attackers to gain root privileges.
CVE-2001-0011	2001-05-07	n/a	Buffer overflow in nslookupComplain function in BIND 4 allows remote attackers to gain root privileges.
CVE-2001-0012	2001-05-07	n/a	BIND 4 and BIND 8 allow remote attackers to access sensitive information such as environment variables.
CVE-2001-0013	2001-05-07	n/a	Format string vulnerability in nslookupComplain function in BIND 4 allows remote attackers to gain root privileges.
CVE-2001-0014	2001-05-07	n/a	Remote Data Protocol (RDP) in Windows 2000 Terminal Service does not properly handle certain malformed packets, which allows remote attackers to cause a denial of service, aka the "Invalid RDP Data" vulnerability.
CVE-2001-0015	2001-05-07	n/a	Network Dynamic Data Exchange (DDE) in Windows 2000 allows local users to gain SYSTEM privileges via a "WM_COPYDATA" message to an invisible window that is running with the privileges of the WINLOGON process.
CVE-2001-0016	2001-05-07	n/a	NTLM Security Support Provider (NTLMSSP) service does not properly check the function number in an LPC request, which could allow local users to gain administrator level access.
CVE-2001-0017	2001-05-07	n/a	Memory leak in PPTP server in Windows NT 4.0 allows remote attackers to cause a denial of service via a malformed data packet, aka the "Malformed PPTP Packet Stream" vulnerability.
CVE-2001-0018	2002-03-09	n/a	Windows 2000 domain controller in Windows 2000 Server, Advanced Server, or Datacenter Server allows remote attackers to cause a denial of service via a flood of malformed service requests.
CVE-2001-0019	2001-02-02	n/a	Arrowpoint (aka Cisco Content Services, or CSS) allows local users to cause a denial of service via a long argument to the "show script," "clear script," "show archive," "clear archive," "show log," or "clear log" commands.
CVE-2001-0020	2001-09-18	n/a	Directory traversal vulnerability in Arrowpoint (aka Cisco Content Services, or CSS) allows local unprivileged users to read arbitrary files via a .. (dot dot) attack.
CVE-2001-0021	2001-05-07	n/a	MailMan Webmail 3.0.25 and earlier allows remote attackers to execute arbitrary commands via shell metacharacters in the alternate_template parameter.
CVE-2001-0022	2001-02-02	n/a	simplestguest.cgi CGI program by Leif Wright allows remote attackers to execute arbitrary commands via shell metacharacters in the guestbook parameter.
CVE-2001-0023	2001-02-02	n/a	everythingform.cgi CGI program by Leif Wright allows remote attackers to execute arbitrary commands via shell metacharacters in the config parameter.
CVE-2001-0024	2001-02-02	n/a	simplestmail.cgi CGI program by Leif Wright allows remote attackers to execute arbitrary commands via shell metacharacters in the MyEmail parameter.
CVE-2001-0025	2001-02-02	n/a	ad.cgi CGI program by Leif Wright allows remote attackers to execute arbitrary commands via shell metacharacters in the file parameter.
CVE-2001-0026	2001-05-07	n/a	rp-pppoe PPPoE client allows remote attackers to cause a denial of service via the Clamp MSS option and a TCP packet with a zero-length TCP option.
CVE-2001-0027	2001-02-02	n/a	mod_sqlpw module in ProFTPD does not reset a cached password when a user uses the "user" command to change accounts, which allows authenticated attackers to gain privileges of other users.
CVE-2001-0028	2001-05-07	n/a	Buffer overflow in the HTML parsing code in oops WWW proxy server 1.5.2 and earlier allows remote attackers to execute arbitrary commands via a large number of " (quotation) characters.
CVE-2001-0029	2001-02-02	n/a	Buffer overflow in oops WWW proxy server 1.4.6 (and possibly other versions) allows remote attackers to execute arbitrary commands via a long host or domain name that is obtained from a reverse DNS lookup.
CVE-2001-0030	2001-02-02	n/a	FoolProof 3.9 allows local users to bypass program execution restrictions by downloading the restricted executables from another source and renaming them.
CVE-2001-0031	2001-02-02	n/a	BroadVision One-To-One Enterprise allows remote attackers to determine the physical path of server files by requesting a .JSP file name that does not exist.
CVE-2001-0032	2001-02-02	n/a	Format string vulnerability in ssldump possibly allows remote attackers to cause a denial of service and possibly gain root privileges via malicious format string specifiers in a URL.
CVE-2001-0033	2001-05-07	n/a	KTH Kerberos IV allows local users to change the configuration of a Kerberos server running at an elevated privilege by specifying an alternate directory using with the KRBCONFDIR environmental variable, which allows the user to gain additional privileges.
CVE-2001-0034	2001-05-07	n/a	KTH Kerberos IV allows local users to specify an alternate proxy using the krb4_proxy variable, which allows the user to generate false proxy responses and possibly gain privileges.
CVE-2001-0035	2001-05-07	n/a	Buffer overflow in the kdc_reply_cipher function in KTH Kerberos IV allows remote attackers to cause a denial of service and possibly execute arbitrary commands via a long authentication request.
CVE-2001-0036	2001-05-07	n/a	KTH Kerberos IV allows local users to overwrite arbitrary files via a symlink attack on a ticket file.
CVE-2001-0037	2001-02-02	n/a	Directory traversal vulnerability in HomeSeer before 1.4.29 allows remote attackers to read arbitrary files via a URL containing .. (dot dot) specifiers.
CVE-2001-0038	2001-02-02	n/a	Offline Explorer 1.4 before Service Release 2 allows remote attackers to read arbitrary files by specifying the drive letter (e.g. C:) in the requested URL.
CVE-2001-0039	2001-05-07	n/a	IPSwitch IMail 6.0.5 allows remote attackers to cause a denial of service using the SMTP AUTH command by sending a base64-encoded user password whose length is between 80 and 136 bytes.
CVE-2001-0040	2001-05-07	n/a	APC UPS daemon, apcupsd, saves its process ID in a world-writable file, which allows local users to kill an arbitrary process by specifying the target process ID in the apcupsd.pid file.
CVE-2001-0041	2001-05-07	n/a	Memory leak in Cisco Catalyst 4000, 5000, and 6000 series switches allows remote attackers to cause a denial of service via a series of failed telnet authentication attempts.
CVE-2001-0042	2004-09-01	n/a	PHP 3.x (PHP3) on Apache 1.3.6 allows remote attackers to read arbitrary files via a modified .. (dot dot) attack containing "%5c" (encoded backslash) sequences.
CVE-2001-0043	2001-05-07	n/a	phpGroupWare before 0.9.7 allows remote attackers to execute arbitrary PHP commands by specifying a malicious include file in the phpgw_info parameter of the phpgw.inc.php program.
CVE-2001-0044	2001-02-02	n/a	Multiple buffer overflows in Lexmark MarkVision printer driver programs allows local users to gain privileges via long arguments to the cat_network, cat_paraller, and cat_serial commands.
CVE-2001-0045	2001-02-02	n/a	The default permissions for the RAS Administration key in Windows NT 4.0 allows local users to execute arbitrary commands by changing the value to point to a malicious DLL, aka one of the "Registry Permissions" vulnerabilities.
CVE-2001-0046	2001-02-02	n/a	The default permissions for the SNMP Parameters registry key in Windows NT 4.0 allows remote attackers to read and possibly modify the SNMP community strings to obtain sensitive information or modify network configuration, aka one of the "Registry Permissions" vulnerabilities.
CVE-2001-0047	2001-02-02	n/a	The default permissions for the MTS Package Administration registry key in Windows NT 4.0 allows local users to install or modify arbitrary Microsoft Transaction Server (MTS) packages and gain privileges, aka one of the "Registry Permissions" vulnerabilities.
CVE-2001-0048	2001-02-02	n/a	The "Configure Your Server" tool in Microsoft 2000 domain controllers installs a blank password for the Directory Service Restore Mode, which allows attackers with physical access to the controller to install malicious programs, aka the "Directory Service Restore Mode Password" vulnerability.
CVE-2001-0049	2001-02-02	n/a	WatchGuard SOHO FireWall 2.2.1 and earlier allows remote attackers to cause a denial of service via a large number of GET requests.
CVE-2001-0050	2001-05-07	n/a	Buffer overflow in BitchX IRC client allows remote attackers to cause a denial of service and possibly execute arbitrary commands via an IP address that resolves to a long DNS hostname or domain name.
CVE-2001-0051	2001-02-02	n/a	IBM DB2 Universal Database version 6.1 creates an account with a default user name and password, which allows remote attackers to gain access to the database.
CVE-2001-0052	2001-02-02	n/a	IBM DB2 Universal Database version 6.1 allows users to cause a denial of service via a malformed query.
CVE-2001-0053	2001-05-07	n/a	One-byte buffer overflow in replydirname function in BSD-based ftpd allows remote attackers to gain root privileges.
CVE-2001-0054	2001-05-07	n/a	Directory traversal vulnerability in FTP Serv-U before 2.5i allows remote attackers to escape the FTP root and read arbitrary files by appending a string such as "/..%20." to a CD command, a variant of a .. (dot dot) attack.
CVE-2001-0055	2001-05-07	n/a	CBOS 2.4.1 and earlier in Cisco 600 routers allows remote attackers to cause a denial of service via a slow stream of TCP SYN packets.
CVE-2001-0056	2001-05-07	n/a	The Cisco Web Management interface in routers running CBOS 2.4.1 and earlier does not log invalid logins, which allows remote attackers to guess passwords without detection.
CVE-2001-0057	2001-05-07	n/a	Cisco 600 routers running CBOS 2.4.1 and earlier allow remote attackers to cause a denial of service via a large ICMP echo (ping) packet.
CVE-2001-0058	2001-05-07	n/a	The Web interface to Cisco 600 routers running CBOS 2.4.1 and earlier allow remote attackers to cause a denial of service via a URL that does not end in a space character.
CVE-2001-0059	2001-05-07	n/a	patchadd in Solaris allows local users to overwrite arbitrary files via a symlink attack.
CVE-2001-0060	2001-05-07	n/a	Format string vulnerability in stunnel 3.8 and earlier allows attackers to execute arbitrary commands via a malformed ident username.
CVE-2001-0061	2001-05-07	n/a	procfs in FreeBSD and possibly other operating systems does not properly restrict access to per-process mem and ctl files, which allows local users to gain root privileges by forking a child process and executing a privileged process from the child, while the parent retains access to the child's address space.
CVE-2001-0062	2001-05-07	n/a	procfs in FreeBSD and possibly other operating systems allows local users to cause a denial of service by calling mmap on the process' own mem file, which causes the kernel to hang.
CVE-2001-0063	2001-05-07	n/a	procfs in FreeBSD and possibly other operating systems allows local users to bypass access control restrictions for a jail environment and gain additional privileges.
CVE-2001-0064	2001-02-02	n/a	Webconfig, IMAP, and other services in MDaemon 3.5.0 and earlier allows remote attackers to cause a denial of service via a long URL terminated by a "\r\n" string.
CVE-2001-0065	2001-02-02	n/a	Buffer overflow in bftpd 1.0.13 allows remote attackers to cause a denial of service and possibly execute arbitrary commands via a long SITE CHOWN command.
CVE-2001-0066	2001-05-07	n/a	Secure Locate (slocate) allows local users to corrupt memory via a malformed database file that specifies an offset value that accesses memory outside of the intended buffer.
CVE-2001-0067	2001-02-02	n/a	The installation of J-Pilot creates the .jpilot directory with the user's umask, which could allow local attackers to read other users' PalmOS backup information if their umasks are not securely set.
CVE-2001-0068	2001-02-02	n/a	Mac OS Runtime for Java (MRJ) 2.2.3 allows remote attackers to use malicious applets to read files outside of the CODEBASE context via the ARCHIVE applet parameter.
CVE-2001-0069	2001-05-07	n/a	dialog before 0.9a-20000118-3bis in Debian GNU/Linux allows local users to overwrite arbitrary files via a symlink attack.
CVE-2001-0070	2001-02-02	n/a	Buffer overflow in 1st Up Mail Server 4.1 allows remote attackers to cause a denial of service, and possibly execute arbitrary commands, via a long MAIL FROM command.
CVE-2001-0071	2001-05-07	n/a	gpg (aka GnuPG) 1.0.4 and other versions does not properly verify detached signatures, which allows attackers to modify the contents of a file without detection.
CVE-2001-0072	2001-05-07	n/a	gpg (aka GnuPG) 1.0.4 and other versions imports both public and private keys from public key servers without notifying the user about the private keys, which could allow an attacker to break the web of trust.
CVE-2001-0073	2001-02-02	n/a	Buffer overflow in the find_default_type function in libsecure in NSA Security-enhanced Linux, which may allow attackers to modify critical data in memory.
CVE-2001-0074	2001-02-02	n/a	Directory traversal vulnerability in print.cgi in Technote allows remote attackers to read arbitrary files via a .. (dot dot) attack in the board parameter.
CVE-2001-0075	2001-02-02	n/a	Directory traversal vulnerability in main.cgi in Technote allows remote attackers to read arbitrary files via a .. (dot dot) attack in the filename parameter.
CVE-2001-0076	2001-02-02	n/a	register.cgi in Ikonboard 2.1.7b and earlier allows remote attackers to execute arbitrary commands via the SEND_MAIL parameter, which overwrites an internal program variable that references a program to be executed.
CVE-2001-0077	2001-09-18	n/a	The clustmon service in Sun Cluster 2.x does not require authentication, which allows remote attackers to obtain sensitive information such as system logs and cluster configurations.
CVE-2001-0078	2001-09-18	n/a	in.mond in Sun Cluster 2.x allows local users to read arbitrary files via a symlink attack on the status file of a host running HA-NFS.
CVE-2001-0079	2001-02-02	n/a	Support Tools Manager (STM) A.22.00 for HP-UX allows local users to overwrite arbitrary files via a symlink attack on the tool_stat.txt log file.
CVE-2001-0080	2001-05-07	n/a	Cisco Catalyst 6000, 5000, or 4000 switches allow remote attackers to cause a denial of service by connecting to the SSH service with a non-SSH client, which generates a protocol mismatch error.
CVE-2001-0081	2001-05-07	n/a	swinit in nCipher does not properly disable the Operator Card Set recovery feature even when explicitly disabled by the user, which could allow attackers to gain access to application keys.
CVE-2001-0082	2001-02-02	n/a	Check Point VPN-1/FireWall-1 4.1 SP2 with Fastmode enabled allows remote attackers to bypass access restrictions via malformed, fragmented packets.
CVE-2001-0083	2001-05-07	n/a	Windows Media Unicast Service in Windows Media Services 4.0 and 4.1 does not properly shut down some types of connections, producing a memory leak that allows remote attackers to cause a denial of service via a series of severed connections, aka the "Severed Windows Media Server Connection" vulnerability.
CVE-2001-0084	2001-02-02	n/a	GTK+ library allows local users to specify arbitrary modules via the GTK_MODULES environmental variable, which could allow local users to gain privileges if GTK+ is used by a setuid/setgid program.
CVE-2001-0085	2001-05-07	n/a	Buffer overflow in Kermit communications software in HP-UX 11.0 and earlier allows local users to cause a denial of service and possibly execute arbitrary commands.
CVE-2001-0086	2001-02-02	n/a	CGI Script Center Subscribe Me LITE 2.0 and earlier allows remote attackers to delete arbitrary mailing list users without authentication by directly calling subscribe.pl with the target address as a parameter.
CVE-2001-0087	2001-02-02	n/a	itetris/xitetris 1.6.2 and earlier trusts the PATH environmental variable to find and execute the gunzip program, which allows local users to gain root privileges by changing their PATH so that it points to a malicious gunzip program.
CVE-2001-0088	2001-02-02	n/a	common.inc.php in phpWebLog 0.4.2 does not properly initialize the $CONF array, which inadvertently sets the password to a single character, allowing remote attackers to easily guess the SiteKey and gain administrative privileges to phpWebLog.
CVE-2001-0089	2001-05-07	n/a	Internet Explorer 5.0 through 5.5 allows remote attackers to read arbitrary files from the client via the INPUT TYPE element in an HTML form, aka the "File Upload via Form" vulnerability.
CVE-2001-0090	2001-05-07	n/a	The Print Templates feature in Internet Explorer 5.5 executes arbitrary custom print templates without prompting the user, which could allow an attacker to execute arbitrary ActiveX controls, aka the "Browser Print Template" vulnerability.
CVE-2001-0091	2001-05-07	n/a	The ActiveX control for invoking a scriptlet in Internet Explorer 5.0 through 5.5 renders arbitrary file types instead of HTML, which allows an attacker to read arbitrary files, aka a variant of the "Scriptlet Rendering" vulnerability.
CVE-2001-0092	2001-05-07	n/a	A function in Internet Explorer 5.0 through 5.5 does not properly verify the domain of a frame within a browser window, which allows a remote attacker to read client files, aka a new variant of the "Frame Domain Verification" vulnerability.
CVE-2001-0093	2001-02-02	n/a	Vulnerability in telnetd in FreeBSD 1.5 allows local users to gain root privileges by modifying critical environmental variables that affect the behavior of telnetd.
CVE-2001-0094	2002-03-09	n/a	Buffer overflow in kdc_reply_cipher of libkrb (Kerberos 4 authentication library) in NetBSD 1.5 and FreeBSD 4.2 and earlier, as used in Kerberised applications such as telnetd and login, allows local users to gain root privileges.
CVE-2001-0095	2001-09-18	n/a	catman in Solaris 2.7 and 2.8 allows local users to overwrite arbitrary files via a symlink attack on the sman_PID temporary file.
CVE-2001-0096	2001-05-07	n/a	FrontPage Server Extensions (FPSE) in IIS 4.0 and 5.0 allows remote attackers to cause a denial of service via a malformed form, aka the "Malformed Web Form Submission" vulnerability.
CVE-2001-0097	2001-02-02	n/a	The Web interface for Infinite Interchange 3.6.1 allows remote attackers to cause a denial of service (application crash) via a large POST request.
CVE-2001-0098	2001-02-02	n/a	Buffer overflow in Bea WebLogic Server before 5.1.0 allows remote attackers to execute arbitrary commands via a long URL that begins with a ".."  string.
CVE-2001-0099	2001-05-07	n/a	bsguest.cgi guestbook script allows remote attackers to execute arbitrary commands via shell metacharacters in the email address.
CVE-2001-0100	2001-05-07	n/a	bslist.cgi mailing list script allows remote attackers to execute arbitrary commands via shell metacharacters in the email address.
CVE-2001-0101	2001-02-02	n/a	Vulnerability in fetchmail 5.5.0-2 and earlier in the AUTHENTICATE GSSAPI command.
CVE-2001-0102	2001-02-02	n/a	"Multiple Users" Control Panel in Mac OS 9 allows Normal users to gain Owner privileges by removing the Users & Groups Data File, which effectively removes the Owner password and allows the Normal user to log in as the Owner account without a password.
CVE-2001-0103	2001-02-02	n/a	CoffeeCup Direct and Free FTP clients uses weak encryption to store passwords in the FTPServers.ini file, which could allow attackers to easily decrypt the passwords.
CVE-2001-0104	2001-02-02	n/a	MDaemon Pro 3.5.1 and earlier allows local users to bypass the "lock server" security setting by pressing the Cancel button at the password prompt, then pressing the enter key.
CVE-2001-0105	2001-05-07	n/a	Vulnerability in top in HP-UX 11.04 and earlier allows local users to overwrite files owned by the "sys" group.
CVE-2001-0106	2001-05-07	n/a	Vulnerability in inetd server in HP-UX 11.04 and earlier allows attackers to cause a denial of service when the "swait" state is used by a server.
CVE-2001-0107	2001-02-14	n/a	Veritas Backup agent on Linux allows remote attackers to cause a denial of service by establishing a connection without sending any data, which causes the process to hang.
CVE-2001-0108	2001-09-18	n/a	PHP Apache module 4.0.4 and earlier allows remote attackers to bypass .htaccess access restrictions via a malformed HTTP request on an unrestricted page that causes PHP to use those access controls on the next page that is requested.
CVE-2001-0109	2001-05-07	n/a	rctab in SuSE 7.0 and earlier allows local users to create or overwrite arbitrary files via a symlink attack on the rctmp temporary file.
CVE-2001-0110	2001-05-07	n/a	Buffer overflow in jaZip Zip/Jaz drive manager allows local users to gain root privileges via a long DISPLAY environmental variable.
CVE-2001-0111	2001-05-07	n/a	Format string vulnerability in splitvt before 1.6.5 allows local users to execute arbitrary commands via the -rcfile command line argument.
CVE-2001-0112	2001-02-14	n/a	Multiple buffer overflows in splitvt before 1.6.5 allow local users to execute arbitrary commands.
CVE-2001-0113	2001-02-14	n/a	statsconfig.pl in OmniHTTPd 2.07 allows remote attackers to execute arbitrary commands via the mostbrowsers parameter, whose value is used as part of a generated Perl script.
CVE-2001-0114	2001-02-14	n/a	statsconfig.pl in OmniHTTPd 2.07 allows remote attackers to overwrite arbitrary files via the cgidir parameter.
CVE-2001-0115	2001-05-07	n/a	Buffer overflow in arp command in Solaris 7 and earlier allows local users to execute arbitrary commands via a long -f parameter.
CVE-2001-0116	2001-05-07	n/a	gpm 1.19.3 allows local users to overwrite arbitrary files via a symlink attack.
CVE-2001-0117	2001-05-07	n/a	sdiff 2.7 in the diffutils package allows local users to overwrite files via a symlink attack.
CVE-2001-0118	2001-05-07	n/a	rdist 6.1.5 allows local users to overwrite arbitrary files via a symlink attack.
CVE-2001-0119	2001-05-07	n/a	getty_ps 2.0.7j allows local users to overwrite arbitrary files via a symlink attack.
CVE-2001-0120	2001-05-07	n/a	useradd program in shadow-utils program may allow local users to overwrite arbitrary files via a symlink attack.
CVE-2001-0121	2001-09-18	n/a	ImageCast Control Center 4.1.0 allows remote attackers to cause a denial of service (resource exhaustion or system crash) via a long string to port 12002.
CVE-2001-0122	2002-03-09	n/a	Kernel leak in AfpaCache module of the Fast Response Cache Accelerator (FRCA) component of IBM HTTP Server 1.3.x and Websphere 3.52 allows remote attackers to cause a denial of service via a series of malformed HTTP requests that generate a "bad request" error.
CVE-2001-0123	2001-05-07	n/a	Directory traversal vulnerability in eXtropia bbs_forum.cgi 1.0 allows remote attackers to read arbitrary files via a .. (dot dot) attack on the file parameter.
CVE-2001-0124	2001-05-07	n/a	Buffer overflow in exrecover in Solaris 2.6 and earlier possibly allows local users to gain privileges via a long command line argument.
CVE-2001-0125	2001-05-07	n/a	exmh 2.2 and earlier allows local users to overwrite arbitrary files via a symlink attack on the exmhErrorMsg temporary file.
CVE-2001-0126	2001-05-07	n/a	Oracle XSQL servlet 1.0.3.0 and earlier allows remote attackers to execute arbitrary Java code by redirecting the XSQL server to another source via the xml-stylesheet parameter in the xslt stylesheet.
CVE-2001-0127	2001-02-14	n/a	Buffer overflow in Olivier Debon Flash plugin (not the Macromedia plugin) allows remote attackers to cause a denial of service and possibly execute arbitrary code via a long DefineSound tag.
CVE-2001-0128	2001-05-07	n/a	Zope before 2.2.4 does not properly compute local roles, which could allow users to bypass specified access restrictions and gain privileges.
