CVE-2001-0378	2001-09-18	n/a	readline prior to 4.1, in OpenBSD 2.8 and earlier, creates history files with insecure permissions, which allows a local attacker to recover potentially sensitive information via readline history files.
CVE-2001-0379	2001-09-18	n/a	Vulnerability in the newgrp program included with HP9000 servers running HP-UX 11.11 allows a local attacker to obtain higher access rights.
CVE-2001-0380	2001-05-24	n/a	Crosscom/Olicom XLT-F running XL 80 IM Version 5.5 Build Level 2 allows a remote attacker SNMP read and write access via a default, undocumented community string 'ILMI'.
CVE-2001-0381	2001-05-24	n/a	The OpenPGP PGP standard allows an attacker to determine the private signature key via a cryptanalytic attack in which the attacker alters the encrypted private key file and captures a single message signed with the signature key.
CVE-2001-0382	2001-05-24	n/a	Computer Associates CCC\Harvest 5.0 for Windows NT/2000 uses weak encryption for passwords, which allows a remote attacker to gain privileges on the application.
CVE-2001-0383	2001-09-18	n/a	banners.php in PHP-Nuke 4.4 and earlier allows remote attackers to modify banner ad URLs by directly calling the Change operation, which does not require authentication.
CVE-2001-0384	2001-05-24	n/a	ppd in Reliant Sinix allows local users to corrupt arbitrary files via a symlink attack in the /tmp/ppd.trace file.
CVE-2001-0385	2001-05-24	n/a	GoAhead webserver 2.1 allows remote attackers to cause a denial of service via an HTTP request to the /aux directory.
CVE-2001-0386	2002-03-09	n/a	AnalogX SimpleServer:WWW 1.08 allows remote attackers to cause a denial of service via an HTTP request to the /aux directory.
CVE-2001-0387	2001-09-18	n/a	Format string vulnerability in hfaxd in HylaFAX before 4.1.b2_2 allows local users to gain privileges via the -q command line argument.
CVE-2001-0388	2001-09-18	n/a	time server daemon timed allows remote attackers to cause a denial of service via malformed packets.
CVE-2001-0389	2001-05-24	n/a	IBM Websphere/NetCommerce3 3.1.2 allows remote attackers to determine the real path of the server by directly calling the macro.d2w macro with a NOEXISTINGHTMLBLOCK argument.
CVE-2001-0390	2001-05-24	n/a	IBM Websphere/NetCommerce3 3.1.2 allows remote attackers to cause a denial of service by directly calling the macro.d2w macro with a long string of %0a characters.
CVE-2001-0391	2001-05-24	n/a	Xitami 2.5d4 and earlier allows remote attackers to crash the server via an HTTP request to the /aux directory.
CVE-2001-0392	2001-05-24	n/a	Navision Financials Server 2.60 and earlier allows remote attackers to cause a denial of service by sending a null character and a long string to the server port (2407), which causes the server to crash.
CVE-2001-0393	2001-05-24	n/a	Navision Financials Server 2.0 allows remote attackers to cause a denial of service via a series of connections to the server without providing a username/password combination, which consumes the license limits.
CVE-2001-0394	2002-03-09	n/a	Remote manager service in Website Pro 3.0.37 allows remote attackers to cause a denial of service via a series of malformed HTTP requests to the /dyn directory.
CVE-2001-0395	2001-05-24	n/a	Lightwave ConsoleServer 3200 does not disconnect users after unsuccessful login attempts, which could allow remote attackers to conduct brute force password guessing.
CVE-2001-0396	2001-05-24	n/a	The pre-login mode in the System Administrator interface of Lightwave ConsoleServer 3200 allows remote attackers to obtain sensitive information such as system status, configuration, and users.
CVE-2001-0397	2001-05-24	n/a	Buffer overflow in Silent Runner Collector (SRC) 1.6.1 allows remote attackers to cause a denial of service, and possibly execute arbitrary commands, via a long SMTP HELO command.
CVE-2001-0398	2001-05-24	n/a	The BAT! mail client allows remote attackers to bypass user warnings of an executable attachment and execute arbitrary commands via an attachment whose file name contains many spaces, which also causes the BAT!  to misrepresent the attachment's type with a different icon.
CVE-2001-0399	2001-05-24	n/a	Caucho Resin 1.3b1 and earlier allows remote attackers to read source code for Javabean files by inserting a .jsp before the WEB-INF specifier in an HTTP request.
CVE-2001-0400	2001-05-24	n/a	nph-maillist.pl allows remote attackers to execute arbitrary commands via shell metacharacters ("`") in the email address.
CVE-2001-0401	2001-05-24	n/a	Buffer overflow in tip in Solaris 8 and earlier allows local users to execute arbitrary commands via a long HOME environmental variable.
CVE-2001-0402	2001-09-18	n/a	IPFilter 3.4.16 and earlier does not include sufficient session information in its cache, which allows remote attackers to bypass access restrictions by sending fragmented packets to a restricted port after sending unfragmented packets to an unrestricted port.
CVE-2001-0403	2001-05-24	n/a	/opt/JSparm/bin/perfmon program in Solaris allows local users to create arbitrary files as root via the Logging File option in the GUI.
CVE-2001-0404	2001-05-24	n/a	Directory traversal vulnerability in JavaServer Web Dev Kit (JSWDK) 1.0.1 allows remote attackers to read arbitrary files via a .. (dot dot) in an HTTP request to the WEB-INF directory.
CVE-2001-0405	2001-09-18	n/a	ip_conntrack_ftp in the IPTables firewall for Linux 2.4 allows remote attackers to bypass access restrictions for an FTP server via a PORT command that lists an arbitrary IP address and port number, which is added to the RELATED table and allowed by the firewall.
CVE-2001-0406	2001-05-24	n/a	Samba before 2.2.0 allows local attackers to overwrite arbitrary files via a symlink attack using (1) a printer queue query, (2) the more command in smbclient, or (3) the mput command in smbclient.
CVE-2001-0407	2002-03-09	n/a	Directory traversal vulnerability in MySQL before 3.23.36 allows local users to modify arbitrary files and gain privileges by creating a database whose name starts with .. (dot dot).
CVE-2001-0408	2001-09-18	n/a	vim (aka gvim) processes VIM control codes that are embedded in a file, which could allow attackers to execute arbitrary commands when another user opens a file containing malicious VIM control codes.
CVE-2001-0409	2001-09-18	n/a	vim (aka gvim) allows local users to modify files being edited by other users via a symlink attack on the backup and swap files, when the victim is editing the file in a world writable directory.
CVE-2001-0410	2001-05-24	n/a	Buffer overflow in Trend Micro Virus Buster 2001 8.02 allows remote attackers to cause a denial of service, and possibly execute arbitrary commands, via a long "From" header.
CVE-2001-0411	2001-05-24	n/a	Reliant Unix 5.44 and earlier allows remote attackers to cause a denial of service via an ICMP port unreachable packet, which causes Reliant to drop all connections to the source address of the packet.
CVE-2001-0412	2001-09-18	n/a	Cisco Content Services (CSS) switch products 11800 and earlier, aka Arrowpoint, allows local users to gain privileges by entering debug mode.
CVE-2001-0413	2001-09-18	n/a	BinTec X4000 Access router, and possibly other versions, allows remote attackers to cause a denial of service via a SYN port scan, which causes the router to hang.
CVE-2001-0414	2001-09-18	n/a	Buffer overflow in ntpd ntp daemon 4.0.99k and earlier (aka xntpd and xntp3) allows remote attackers to cause a denial of service and possibly execute arbitrary commands via a long readvar argument.
CVE-2001-0415	2001-05-24	n/a	REDIPlus program, REDI.exe, stores passwords and user names in cleartext in the StartLog.txt log file, which allows local users to gain access to other accounts.
CVE-2001-0416	2002-03-09	n/a	sgml-tools (aka sgmltools) before 1.0.9-15 creates temporary files with insecure permissions, which allows other users to read files that are being processed by sgml-tools.
CVE-2001-0417	2001-05-24	n/a	Kerberos 4 (aka krb4) allows local users to overwrite arbitrary files via a symlink attack on new ticket files.
CVE-2001-0418	2001-05-24	n/a	content.pl script in NCM Content Management System allows remote attackers to read arbitrary contents of the content database by inserting SQL characters into the id parameter.
CVE-2001-0419	2001-05-24	n/a	Buffer overflow in shared library ndwfn4.so for iPlanet Web Server (iWS) 4.1, when used as a web listener for Oracle application server 4.0.8.2, allows remote attackers to execute arbitrary commands via a long HTTP request that is passed to the application server, such as /jsp/.
CVE-2001-0420	2001-05-24	n/a	Directory traversal vulnerability in talkback.cgi program allows remote attackers to read arbitrary files via a .. (dot dot) in the article parameter.
CVE-2001-0421	2001-05-24	n/a	FTP server in Solaris 8 and earlier allows local and remote attackers to cause a core dump in the root directory, possibly with world-readable permissions, by providing a valid username with an invalid password followed by a CWD ~ command, which could release sensitive information such as shadowed passwords, or fill the disk partition.
CVE-2001-0422	2002-03-09	n/a	Buffer overflow in Xsun in Solaris 8 and earlier allows local users to execute arbitrary commands via a long HOME environmental variable.
CVE-2001-0423	2004-09-01	n/a	Buffer overflow in ipcs in Solaris 7 x86 allows local users to execute arbitrary code via a long TZ (timezone) environmental variable, a different vulnerability than CAN-2002-0093.
CVE-2001-0424	2001-05-24	n/a	BubbleMon 1.31 does not properly drop group privileges before executing programs, which allows local users to execute arbitrary commands with the kmem group id.
CVE-2001-0425	2001-05-24	n/a	AdLibrary.pm in AdCycle 0.78b allows remote attackers to gain privileges to AdCycle via a malformed Agent: header in the HTTP request, which is inserted into a resulting SQL query that is used to verify login information.
CVE-2001-0426	2001-05-24	n/a	Buffer overflow in dtsession on Solaris, and possibly other operating systems, allows local users to gain privileges via a long LANG environmental variable.
CVE-2001-0427	2001-09-18	n/a	Cisco VPN 3000 series concentrators before 2.5.2(F) allow remote attackers to cause a denial of service via a flood of invalid login requests to (1) the SSL service, or (2) the telnet service, which do not properly disconnect the user after several failed login attempts.
CVE-2001-0428	2001-09-18	n/a	Cisco VPN 3000 series concentrators before 2.5.2(F) allow remote attackers to cause a denial of service via an IP packet with an invalid IP option.
CVE-2001-0429	2001-09-18	n/a	Cisco Catalyst 5000 series switches 6.1(2) and earlier will forward an 802.1x frame on a Spanning Tree Protocol (STP) blocked port, which causes a network storm and a denial of service.
CVE-2001-0430	2001-09-18	n/a	Vulnerability in exuberant-ctags before 3.2.4-0.1 insecurely creates temporary files.
CVE-2001-0431	2001-05-24	n/a	Vulnerability in iPlanet Web Server Enterprise Edition 4.x.
CVE-2001-0432	2001-05-24	n/a	Buffer overflows in various CGI programs in the remote administration service for Trend Micro Interscan VirusWall 3.01 allow remote attackers to execute arbitrary commands.
CVE-2001-0433	2001-05-24	n/a	Buffer overflow in Savant 3.0 web server allows remote attackers to cause a denial of service, and possibly execute arbitrary commands, via a long Host HTTP header.
CVE-2001-0434	2001-09-18	n/a	The LogDataListToFile ActiveX function used in (1) Knowledge Center and (2) Back web components of Compaq Presario computers allows remote attackers to modify arbitrary files and cause a denial of service.
CVE-2001-0435	2001-05-24	n/a	The split key mechanism used by PGP 7.0 allows a key share holder to obtain access to the entire key by setting the "Cache passphrase while logged on" option and capturing the passphrases of other share holders as they authenticate.
CVE-2001-0436	2001-05-24	n/a	dcboard.cgi in DCForum 2000 1.0 allows remote attackers to execute arbitrary commands by uploading a Perl program to the server and using a .. (dot dot) in the AZ parameter to reference the program.
CVE-2001-0437	2001-05-24	n/a	upload_file.pl in DCForum 2000 1.0 allows remote attackers to upload arbitrary files without authentication by setting the az parameter to upload_file.
CVE-2001-0438	2001-05-24	n/a	Preview version of Timbuktu for Mac OS X allows local users to modify System Preferences without logging in via the About Timbuktu menu.
CVE-2001-0439	2001-09-18	n/a	licq before 1.0.3 allows remote attackers to execute arbitrary commands via shell metacharacters in a URL.
CVE-2001-0440	2001-09-18	n/a	Buffer overflow in logging functions of licq before 1.0.3 allows remote attackers to cause a denial of service, and possibly execute arbitrary commands.
CVE-2001-0441	2001-05-24	n/a	Buffer overflow in (1) wrapping and (2) unwrapping functions of slrn news reader before 0.9.7.0 allows remote attackers to execute arbitrary commands via a long message header.
CVE-2001-0442	2002-03-09	n/a	Buffer overflow in Mercury MTA POP3 server for NetWare 1.48 and earlier allows remote attackers to cause a denial of service and possibly execute arbitrary code via a long APOP command.
CVE-2001-0443	2001-05-24	n/a	Buffer overflow in QPC QVT/Net Popd 4.20 in QVT/Net 5.0 allows remote attackers to cause a denial of service, and possibly execute arbitrary commands, via (1) a long username, or (2) a long password.
CVE-2001-0444	2002-03-09	n/a	Cisco CBOS 2.3.0.053 sends output of the "sh nat" (aka "show nat") command to the terminal of the next user who attempts to connect to the router via telnet, which could allow that user to obtain sensitive information.
CVE-2001-0446	2001-05-24	n/a	IBM WCS (WebSphere Commerce Suite) 4.0.1 with Application Server 3.0.2 allows remote attackers to read source code for .jsp files by appending a / to the requested URL.
CVE-2001-0447	2001-05-24	n/a	Web configuration server in 602Pro LAN SUITE allows remote attackers to cause a denial of service, and possibly execute arbitrary commands, via a long HTTP request containing "%2e" (dot dot) characters.
CVE-2001-0448	2001-05-24	n/a	Web configuration server in 602Pro LAN SUITE allows remote attackers to cause a denial of service via an HTTP GET HTTP request to the aux directory, and possibly other directories with legacy DOS device names.
CVE-2001-0449	2002-03-09	n/a	Buffer overflow in WinZip 8.0 allows attackers to execute arbitrary commands via a long file name that is processed by the /zipandemail command line option.
CVE-2001-0450	2001-05-24	n/a	Directory traversal vulnerability in Transsoft FTP Broker before 5.5 allows attackers to (1) delete arbitrary files via DELETE, or (2) list arbitrary directories via LIST, via a .. (dot dot) in the file name.
CVE-2001-0451	2001-05-24	n/a	INDEXU 2.0 beta and earlier allows remote attackers to bypass authentication and gain privileges by setting the cookie_admin_authenticated cookie value to 1.
CVE-2001-0452	2001-05-24	n/a	BRS WebWeaver FTP server before 0.64 Beta allows remote attackers to obtain the real pathname of the server via a "CD *" command followed by an ls command.
CVE-2001-0453	2001-05-24	n/a	Directory traversal vulnerability in BRS WebWeaver HTTP server allows remote attackers to read arbitrary files via a .. (dot dot) attack in the (1) syshelp, (2) sysimages, or (3) scripts directories.
CVE-2001-0454	2001-05-24	n/a	Directory traversal vulnerability in SlimServe HTTPd 1.1a allows remote attackers to read arbitrary files via a ... (modified dot dot) in the HTTP request.
CVE-2001-0455	2001-09-18	n/a	Cisco Aironet 340 Series wireless bridge before 8.55 does not properly disable access to the web interface, which allows remote attackers to modify its configuration.
CVE-2001-0456	2001-09-18	n/a	postinst installation script for Proftpd in Debian 2.2 does not properly change the "run as uid/gid root" configuration when the user enables anonymous access, which causes the server to run at a higher privilege than intended.
CVE-2001-0457	2001-09-18	n/a	man2html before 1.5-22 allows remote attackers to cause a denial of service (memory exhaustion).
CVE-2001-0458	2001-05-24	n/a	Multiple buffer overflows in ePerl before 2.2.14-0.7 allow local and remote attackers to execute arbitrary commands.
CVE-2001-0459	2001-05-24	n/a	Buffer overflows in ascdc Afterstep while running setuid allows local users to gain root privileges via a long (1) -d option, (2) -m option, or (3) -f option.
CVE-2001-0460	2001-05-24	n/a	Websweeper 4.0 does not limit the length of certain HTTP headers, which allows remote attackers to cause a denial of service (memory exhaustion) via an extremely large HTTP Referrer: header.
CVE-2001-0461	2002-03-09	n/a	template.cgi in Free On-Line Dictionary of Computing (FOLDOC) allows remote attackers to read files and execute commands via shell metacharacters in the argument to template.cgi.
CVE-2001-0462	2001-09-18	n/a	Directory traversal vulnerability in Perl web server 0.3 and earlier allows remote attackers to read arbitrary files via a .. (dot dot) in the URL.
CVE-2001-0463	2002-03-09	n/a	Directory traversal vulnerability in cal_make.pl in PerlCal allows remote attackers to read arbitrary files via a .. (dot dot) in the p0 parameter.
CVE-2001-0464	2001-05-24	n/a	Buffer overflow in websync.exe in Cyberscheduler allows remote attackers to execute arbitrary commands via a long tzs (timezone) parameter.
CVE-2001-0465	2001-09-18	n/a	TurboTax saves passwords in a temporary file when a user imports investment tax information from a financial institution, which could allow local users to obtain sensitive information.
CVE-2001-0466	2001-05-24	n/a	Directory traversal vulnerability in ustorekeeper 1.61 allows remote attackers to read arbitrary files via a .. (dot dot) in the file parameter.
CVE-2001-0467	2001-09-18	n/a	Directory traversal vulnerability in RobTex Viking Web server before 1.07-381 allows remote attackers to read arbitrary files via a \... (modified dot dot) in an HTTP URL request.
CVE-2001-0468	2001-05-24	n/a	Buffer overflow in FTPFS allows local users to gain root privileges via a long user name.
CVE-2001-0469	2001-09-18	n/a	rwho daemon rwhod in FreeBSD 4.2 and earlier, and possibly other operating systems, allows remote attackers to cause a denial of service via malformed packets with a short length.
CVE-2001-0470	2001-05-24	n/a	Buffer overflow in SNMP proxy agent snmpd in Solaris 8 may allow local users to gain root privileges by calling snmpd with a long program name.
CVE-2001-0471	2001-05-24	n/a	SSH daemon version 1 (aka SSHD-1 or SSH-1) 1.2.30 and earlier does not log repeated login attempts, which could allow remote attackers to compromise accounts without detection via a brute force attack.
CVE-2001-0472	2001-05-24	n/a	Hursley Software Laboratories Consumer Transaction Framework (HSLCTF) HTTP object allows remote attackers to cause a denial of service (crash) via an extremely long HTTP request.
CVE-2001-0473	2001-09-18	n/a	Format string vulnerability in Mutt before 1.2.5 allows a remote malicious IMAP server to execute arbitrary commands.
CVE-2001-0474	2001-09-18	n/a	Utah-glx in Mesa before 3.3-14 on Mandrake Linux 7.2 allows local users to overwrite arbitrary files via a symlink attack on the /tmp/glxmemory file.
CVE-2001-0475	2001-09-18	n/a	index.php in Jelsoft vBulletin does not properly initialize a PHP variable that is used to store template information, which allows remote attackers to execute arbitrary PHP code via special characters in the templatecache parameter.
CVE-2001-0476	2001-05-24	n/a	Multiple buffer overflows in s.cgi program in Aspseek search engine 1.03 and earlier allow remote attackers to execute arbitrary commands via (1) a long HTTP query string, or (2) a long tmpl parameter.
CVE-2001-0477	2001-05-24	n/a	Vulnerability in WebCalendar 0.9.26 allows remote command execution.
CVE-2001-0478	2001-05-24	n/a	Directory traversal vulnerability in phpMyAdmin 2.2.0 and earlier versions allows remote attackers to execute arbitrary code via a .. (dot dot) in an argument to the sql.php script.
CVE-2001-0479	2001-05-24	n/a	Directory traversal vulnerability in phpPgAdmin 2.2.1 and earlier versions allows remote attackers to execute arbitrary code via a .. (dot dot) in an argument to the sql.php script.
CVE-2001-0480	2001-05-24	n/a	Directory traversal vulnerability in Alex's FTP Server 0.7 allows remote attackers to read arbitrary files via a ... (modified dot dot) in the (1) GET or (2) CD commands.
CVE-2001-0481	2001-09-18	n/a	Vulnerability in rpmdrake in Mandrake Linux 8.0 related to insecure temporary file handling.
CVE-2001-0482	2001-09-18	n/a	Configuration error in Argus PitBull LX allows root users to bypass specified access control restrictions and cause a denial of service or execute arbitrary commands by modifying kernel variables such as MaxFiles, MaxInodes, and ModProbePath in /proc/sys via calls to sysctl.
CVE-2001-0483	2001-05-24	n/a	Configuration error in Axent Raptor Firewall 6.5 allows remote attackers to use the firewall as a proxy to access internal web resources when the http.noproxy Rule is not set.
CVE-2001-0484	2001-05-24	n/a	Tektronix PhaserLink 850 does not require authentication for access to configuration pages such as _ncl_subjects.shtml and _ncl_items.shtml, which allows remote attackers to modify configuration information and cause a denial of service by accessing the pages.
CVE-2001-0485	2004-09-01	n/a	Unknown vulnerability in netprint in IRIX 6.2, and possibly other versions, allows local users with lp privileges attacker to execute arbitrary commands via the -n option.
CVE-2001-0486	2001-09-18	n/a	Remote attackers can cause a denial of service in Novell BorderManager 3.6 and earlier by sending TCP SYN flood to port 353.
CVE-2001-0487	2002-03-09	n/a	AIX SNMP server snmpd allows remote attackers to cause a denial of service via a RST during the TCP connection.
CVE-2001-0488	2001-09-18	n/a	pcltotiff in HP-UX 10.x has unnecessary set group id permissions, which allows local users to cause a denial of service.
CVE-2001-0489	2001-09-18	n/a	Format string vulnerability in gftp prior to 2.0.8 allows remote malicious FTP servers to execute arbitrary commands.
CVE-2001-0490	2001-05-24	n/a	Buffer overflow in WINAMP 2.6x and 2.7x allows attackers to execute arbitrary code via a long string in an AIP file.
CVE-2001-0491	2001-05-24	n/a	Directory traversal vulnerability in RaidenFTPD Server 2.1 before build 952 allows attackers to access files outside the ftp root via dot dot attacks, such as (1) .... in CWD, (2) .. in NLST, or (3) ... in NLST.
CVE-2001-0492	2001-05-24	n/a	Netcruiser Web server version 0.1.2.8 and earlier allows remote attackers to determine the physical path of the server via a URL containing (1) con, (2) com2, or (3) com3.
CVE-2001-0493	2002-03-09	n/a	Small HTTP server 2.03 allows remote attackers to cause a denial of service via a URL that contains an MS-DOS device name such as aux.
CVE-2001-0494	2001-09-18	n/a	Buffer overflow in IPSwitch IMail SMTP server 6.06 and possibly prior versions allows remote attackers to execute arbitrary code via a long From: header.
CVE-2001-0495	2001-09-18	n/a	Directory traversal in DataWizard WebXQ server 1.204 allows remote attackers to view files outside of the web root via a .. (dot dot) attack.
CVE-2001-0496	2001-05-24	n/a	kdesu in kdelibs package creates world readable temporary files containing authentication info, which can allow local users to gain privileges.
CVE-2001-0497	2002-03-09	n/a	dnskeygen in BIND 8.2.4 and earlier, and dnssec-keygen in BIND 9.1.2 and earlier, set insecure permissions for a HMAC-MD5 shared secret key file used for DNS Transactional Signatures (TSIG), which allows attackers to obtain the keys and perform dynamic DNS updates.
CVE-2001-0498	2001-07-27	n/a	Transparent Network Substrate (TNS) over Net8 (SQLNet) in Oracle 8i 8.1.7 and earlier allows remote attackers to cause a denial of service via a malformed SQLNet connection request with a large offset in the header extension.
CVE-2001-0499	2001-07-27	n/a	Buffer overflow in Transparent Network Substrate (TNS) Listener in Oracle 8i 8.1.7 and earlier allows remote attackers to gain privileges via a long argument to the commands (1) STATUS, (2) PING, (3) SERVICES, (4) TRC_FILE, (5) SAVE_CONFIG, or (6) RELOAD.
CVE-2001-0500	2002-03-09	n/a	Buffer overflow in ISAPI extension (idq.dll) in Index Server 2.0 and Indexing Service 2000 in IIS 6.0 beta and earlier allows remote attackers to execute arbitrary commands via a long argument to Internet Data Administration (.ida) and Internet Data Query (.idq) files such as default.ida, as commonly exploited by Code Red.
CVE-2001-0501	2002-03-09	n/a	Microsoft Word 2002 and earlier allows attackers to automatically execute macros without warning the user by embedding the macros in a manner that escapes detection by the security scanner.
CVE-2001-0502	2002-03-09	n/a	Running Windows 2000 LDAP Server over SSL, a function does not properly check the permissions of a user request when the directory principal is a domain user and the data attribute is the domain password, which allows local users to modify the login password of other users.
CVE-2001-0503	2002-03-09	n/a	Microsoft NetMeeting 3.01 with Remote Desktop Sharing enabled allows remote attackers to cause a denial of service via a malformed string to the NetMeeting service port, aka a variant of the "NetMeeting Desktop Sharing" vulnerability.
CVE-2001-0504	2002-03-09	n/a	Vulnerability in authentication process for SMTP service in Microsoft Windows 2000 allows remote attackers to use incorrect credentials to gain privileges and conduct activities such as mail relaying.
CVE-2001-0505	2001-10-12	n/a	Multiple memory leaks in Microsoft Services for Unix 2.0 allow remote attackers to cause a denial of service (memory exhaustion) via a large number of malformed requests to (1) the Telnet service, or (2) the NFS service.
