CVE-2001-0757	2002-03-09	n/a	Cisco 6400 Access Concentrator Node Route Processor 2 (NRP2) 12.1DC card does not properly disable access when a password has not been set for vtys, which allows remote attackers to obtain access via telnet.
CVE-2001-0758	2001-10-12	n/a	Directory traversal vulnerability in Shambala 4.5 allows remote attackers to escape the FTP root directory via "CWD ..."  command.
CVE-2001-0759	2001-10-12	n/a	Buffer overflow in bctool in Jetico BestCrypt 0.8.1 and earlier allows local users to execute arbitrary code via a file or directory with a long pathname, which is processed during an unmount.
CVE-2001-0760	2002-03-09	n/a	Citrix Nfuse 1.51 allows remote attackers to obtain the absolute path of the web root via a malformed request to launch.asp that does not provide the session field.
CVE-2001-0761	2001-10-12	n/a	Buffer overflow in HttpSave.dll in Trend Micro InterScan WebManager 1.2 allows remote attackers to execute arbitrary code via a long value to a certain parameter.
CVE-2001-0762	2001-10-12	n/a	Buffer overflow in su-wrapper 1.1.1 allows local users to execute arbitrary code via a long first argument.
CVE-2001-0763	2003-04-02	n/a	Buffer overflow in Linux xinetd 2.1.8.9pre11-1 and earlier may allow remote attackers to execute arbitrary code via a long ident response, which is not properly handled by the svc_logprint function.
CVE-2001-0764	2002-03-09	n/a	Buffer overflow in ntping in scotty 2.1.0 allows local users to execute arbitrary code via a long hostname as a command line argument.
CVE-2001-0765	2002-03-09	n/a	BisonFTP V4R1 allows local users to access directories outside of their home directory by uploading .bdl files, which can then be linked to other directories.
CVE-2001-0766	2001-10-12	n/a	Apache on MacOS X Client 10.0.3 with the HFS+ file system allows remote attackers to bypass access restrictions via a URL that contains some characters whose case is not matched by Apache's filters.
CVE-2001-0767	2001-10-12	n/a	Directory traversal vulnerability in GuildFTPd 0.9.7 allows attackers to list or read arbitrary files and directories via a .. in (1) LS or (2) GET.
CVE-2001-0768	2001-10-12	n/a	GuildFTPd 0.9.7 stores user names and passwords in plaintext in the default.usr file, which allows local users to gain privileges as other FTP users by reading the file.
CVE-2001-0769	2002-06-25	n/a	Memory leak in GuildFTPd Server 0.97 allows remote attackers to cause a denial of service via a request containing a null character.
CVE-2001-0770	2002-06-25	n/a	Buffer overflow in GuildFTPd Server 0.97 allows remote attacker to execute arbitrary code via a long SITE command.
CVE-2001-0771	2001-10-12	n/a	Spytech SpyAnywhere 1.50 allows remote attackers to gain administrator access via a single character in the "loginpass" field.
CVE-2001-0772	2001-10-12	n/a	Buffer overflows and other vulnerabilities in multiple Common Desktop Environment (CDE) modules in HP-UX 10.10 through 11.11 allow attackers to cause a denial of service and possibly gain additional privileges.
CVE-2001-0773	2002-03-09	n/a	Cayman 3220-H DSL Router 1.0 allows remote attacker to cause a denial of service (crash) via a series of SYN or TCP connect requests.
CVE-2001-0774	2002-03-09	n/a	Tripwire 1.3.1, 2.2.1 and 2.3.0 allows local users to overwrite arbitrary files and possible gain privileges via a symbolic link attack on temporary files.
CVE-2001-0775	2001-10-12	n/a	Buffer overflow in xloadimage 4.1 (aka xli 1.16 and 1.17) in Linux allows remote attackers to execute arbitrary code via a FACES format image containing a long (1) Firstname or (2) Lastname field.
CVE-2001-0776	2001-10-12	n/a	Buffer overflow in DynFX MailServer version 2.10 allows remote attackers to conduct a denial of service via a long username to the POP3 service.
CVE-2001-0777	2001-10-12	n/a	Omnicron OmniHTTPd 2.0.8 allows remote attackers to cause a denial of service (memory exhaustion) via a series of requests for PHP scripts.
CVE-2001-0778	2001-10-12	n/a	OmniHTTPd 2.0.8 and earlier allow remote attackers to obtain source code via a GET request with the URL-encoded symbol for a space (%20).
CVE-2001-0779	2002-03-09	n/a	Buffer overflow in rpc.yppasswdd (yppasswd server) in Solaris 2.6, 7 and 8 allows remote attackers to gain root access via a long username.
CVE-2001-0780	2001-10-12	n/a	Directory traversal vulnerability in cosmicpro.cgi in Cosmicperl Directory Pro 2.0 allows remote attackers to gain sensitive information via a .. (dot dot) in the SHOW parameter.
CVE-2001-0781	2001-10-12	n/a	Buffer overflow in SpoonFTP 1.0.0.12 allows remote attackers to execute arbitrary code via a long argument to the commands (1) CWD or (2) LIST.
CVE-2001-0782	2001-10-12	n/a	KDE ktvision 0.1.1-271 and earlier allows local attackers to gain root privileges via a symlink attack on a user configuration file.
CVE-2001-0783	2001-10-12	n/a	Cisco TFTP server 1.1 allows remote attackers to read arbitrary files via a ..(dot dot) attack in the GET command.
CVE-2001-0784	2002-03-09	n/a	Directory traversal vulnerability in Icecast 1.3.10 and earlier allows remote attackers to read arbitrary files via a modified .. (dot dot)  attack using encoded URL characters.
CVE-2001-0785	2001-10-12	n/a	Directory traversal in Webpaging interface in Internet Software Solutions Air Messenger LAN Server (AMLServer) 3.4.2 allows allows remote attackers to read arbitrary files via a .. (dot dot) attack.
CVE-2001-0786	2001-10-12	n/a	Internet Software Solutions Air Messenger LAN Server (AMLServer) 3.4.2 stores user passwords in plaintext in the pUser.Dat file.
CVE-2001-0787	2002-03-09	n/a	LPRng in Red Hat Linux 7.0 and 7.1 does not properly drop memberships in supplemental groups when lowering privileges, which could allow a local user to elevate privileges.
CVE-2001-0788	2001-10-12	n/a	Internet Software Solutions Air Messenger LAN Server (AMLServer) 3.4.2 allows remote attackers to obtain an absolute path for the server directory by viewing the Location header.
CVE-2001-0789	2001-10-12	n/a	Format string vulnerability in avpkeeper in Kaspersky KAV 3.5.135.2 for Sendmail allows remote attackers to cause a denial of service or possibly execute arbitrary code via a malformed mail message.
CVE-2001-0790	2001-10-12	n/a	Specter IDS version 4.5 and 5.0 allows a remote attacker to cause a denial of service (CPU exhaustion) via a port scan, which causes the server to consume CPU while preparing alerts.
CVE-2001-0791	2001-10-12	n/a	Trend Micro InterScan VirusWall for Windows NT allows remote attackers to make configuration changes by directly calling certain CGI programs, which do not restrict access.
CVE-2001-0792	2004-09-01	n/a	Format string vulnerability in XChat 1.2.x allows remote attackers to execute arbitrary code via a malformed nickname.
CVE-2001-0794	2001-10-12	n/a	Buffer overflow in A-FTP Anonymous FTP Server allows remote attackers to cause a denial of service via a long USER command.
CVE-2001-0795	2001-10-12	n/a	Perception LiteServe 1.25 allows remote attackers to obtain source code of CGI scripts via URLs that contain MS-DOS conventions such as (1) upper case letters or (2) 8.3 file names.
CVE-2001-0796	2002-03-09	n/a	SGI IRIX 6.5 through 6.5.12f and possibly earlier versions, and FreeBSD 3.0, allows remote attackers to cause a denial of service via a malformed IGMP multicast packet with a small response delay.
CVE-2001-0797	2002-06-25	n/a	Buffer overflow in login in various System V based operating systems allows remote attackers to execute arbitrary commands via a large number of arguments through services such as telnet and rlogin.
CVE-2001-0799	2001-11-22	n/a	Buffer overflows in lpsched in IRIX 6.5.13f and earlier allow remote attackers to execute arbitrary commands via a long argument.
CVE-2001-0800	2001-11-22	n/a	lpsched in IRIX 6.5.13f and earlier allows remote attackers to execute arbitrary commands via shell metacharacters.
CVE-2001-0801	2002-03-09	n/a	lpstat in IRIX 6.5.13f and earlier allows local users to gain root privileges by specifying a Trojan Horse nettype shared library.
CVE-2001-0803	2002-03-09	n/a	Buffer overflow in the client connection routine of libDtSvc.so.1 in CDE Subprocess Control Service (dtspcd) allows remote attackers to execute arbitrary commands.
CVE-2001-0804	2002-03-09	n/a	Directory traversal vulnerability in story.pl in Interactive Story 1.3 allows a remote attacker to read arbitrary files via a .. (dot dot) attack on the "next" parameter.
CVE-2001-0805	2002-03-09	n/a	Directory traversal vulnerability in ttawebtop.cgi in Tarantella Enterprise 3.00 and 3.01 allows remote attackers to read arbitrary files via a .. (dot dot) in the pg parameter.
CVE-2001-0806	2002-03-09	n/a	Apple MacOS X 10.0 and 10.1 allow a local user to read and write to a user's desktop folder via insecure default permissions for the Desktop when it is created in some languages.
CVE-2001-0807	2001-11-22	n/a	Internet Explorer 5.0, and possibly other versions, may allow remote attackers (malicious web pages) to read known text files from a client's hard drive via a SCRIPT tag with a SRC value that points to the text file.
CVE-2001-0808	2001-11-22	n/a	gnatsweb.pl in GNATS GnatsWeb 2.7 through 3.95 allows remote attackers to execute arbitrary commands via certain characters in the help_file parameter.
CVE-2001-0809	2001-11-22	n/a	Vulnerability in CIFS/9000 Server (SAMBA) A.01.06 and earlier in HP-UX 11.0 and 11.11, when configured as a print server, allows local users to overwrite arbitrary files by modifying certain resources.
CVE-2001-0815	2002-03-09	n/a	Buffer overflow in PerlIS.dll in Activestate ActivePerl 5.6.1.629 and earlier allows remote attackers to execute arbitrary code via an HTTP request for a long filename that ends in a .pl extension.
CVE-2001-0816	2002-03-09	n/a	OpenSSH before 2.9.9, when running sftp using sftp-server and using restricted keypairs, allows remote authenticated users to bypass authorized_keys2 command= restrictions using sftp commands.
CVE-2001-0817	2001-11-22	n/a	Vulnerability in HP-UX line printer daemon (rlpdaemon) in HP-UX 10.01 through 11.11 allows remote attackers to modify arbitrary files and gain root privileges via a certain print request.
CVE-2001-0818	2001-11-22	n/a	A buffer overflow the '\s' console command in MDBMS 0.99b9 and earlier allows remote attackers to execute arbitrary commands by sending the command a large amount of data.
CVE-2001-0819	2002-03-09	n/a	A buffer overflow in Linux fetchmail before 5.8.6 allows remote attackers to execute arbitrary code via a large 'To:' field in an email header.
CVE-2001-0820	2001-11-22	n/a	Buffer overflows in GazTek ghttpd 1.4 allows a remote attacker to execute arbitrary code via long arguments that are passed to (1) the Log function in util.c, or (2) serveconnection in protocol.c.
CVE-2001-0821	2001-11-22	n/a	The default configuration of DCShop 1.002 beta places sensitive files in the cgi-bin directory, which could allow remote attackers to read sensitive data via an HTTP GET request for (1) orders.txt or (2) auth_user_file.txt.
CVE-2001-0822	2002-03-09	n/a	FPF kernel module 1.0 allows a remote attacker to cause a denial of service via fragmented packets.
CVE-2001-0823	2002-03-09	n/a	The pmpost program in Performance Co-Pilot (PCP) before 2.2.1-3 allows a local user to gain privileges via a symlink attack on the NOTICES file in the PCP log directory (PCP_LOG_DIR).
CVE-2001-0824	2001-11-22	n/a	Cross-site scripting vulnerability in IBM WebSphere 3.02 and 3.5 FP2 allows remote attackers to execute Javascript by inserting the Javascript into (1) a request for a .JSP file, or (2) a request to the webapp/examples/ directory, which inserts the Javascript into an error page.
CVE-2001-0825	2004-09-01	n/a	Buffer overflow in internal string handling routines of xinetd before 2.1.8.8 allows remote attackers to execute arbitrary commands via a length argument of zero or less, which disables the length check.
CVE-2001-0826	2001-11-22	n/a	Buffer overflows in CesarFTPD 0.98b allows remote attackers to execute arbitrary commands via long arguments to (1) HELP, (2) USER, (3) PASS, (4) PORT, (5) DELE, (6) REST, (7) RMD, or (8) MKD.
CVE-2001-0827	2001-11-22	n/a	Cerberus FTP server 1.0 - 1.5 allows remote attackers to cause a denial of service (crash) via a large number of "PASV" requests.
CVE-2001-0828	2002-03-09	n/a	A cross-site scripting vulnerability in Caucho Technology Resin before 1.2.4 allows a malicious webmaster to embed Javascript in a hyperlink that ends in a .jsp extension, which causes an error message that does not properly quote the Javascript.
CVE-2001-0829	2001-11-22	n/a	A cross-site scripting vulnerability in Apache Tomcat 3.2.1 allows a malicious webmaster to embed Javascript in a request for a .JSP file, which causes the Javascript to be inserted into an error message.
CVE-2001-0830	2002-03-09	n/a	6tunnel 0.08 and earlier does not properly close sockets that were initiated by a client, which allows remote attackers to cause a denial of service (resource exhaustion) by repeatedly connecting to and disconnecting from the server.
CVE-2001-0831	2001-11-22	n/a	Unknown vulnerability in Oracle Label Security in Oracle 8.1.7 and 9.0.1, when audit functionality, SET_LABEL, or SQL*Predicate is being used, allows local users to gain additional access.
CVE-2001-0832	2001-11-22	n/a	Vulnerability in Oracle 8.0.x through 9.0.1 on Unix allows local users to overwrite arbitrary files, possibly via a symlink attack or incorrect file permissions in (1) the ORACLE_HOME/rdbms/log directory or (2) an alternate directory as specified in the ORACLE_HOME environmental variable, aka the "Oracle File Overwrite Security Vulnerability."
CVE-2001-0833	2002-03-09	n/a	Buffer overflow in otrcrep in Oracle 8.0.x through 9.0.1 allows local users to execute arbitrary code via a long ORACLE_HOME environment variable, aka the "Oracle Trace Collection Security Vulnerability."
CVE-2001-0834	2002-03-09	n/a	htsearch CGI program in htdig (ht://Dig) 3.1.5 and earlier allows remote attackers to use the -c option to specify an alternate configuration file, which could be used to (1) cause a denial of service (CPU consumption) by specifying a large file such as /dev/zero, or (2) read arbitrary files by uploading an alternate configuration file that specifies the target file.
CVE-2001-0835	2001-11-22	n/a	Cross-site scripting vulnerability in Webalizer 2.01-06, and possibly other versions, allows remote attackers to inject arbitrary HTML tags by specifying them in (1) search keywords embedded in HTTP referrer information, or (2) host names that are retrieved via a reverse DNS lookup.
CVE-2001-0836	2002-03-09	n/a	Buffer overflow in Oracle9iAS Web Cache 2.0.0.1 allows remote attackers to execute arbitrary code via a long HTTP GET request.
CVE-2001-0837	2004-09-01	n/a	DeltaThree Pc-To-Phone 3.0.3 places sensitive data in world-readable locations in the installation directory, which allows local users to read the information in (1) temp.html, (2) the log folder, and (3) the PhoneBook folder.
CVE-2001-0838	2001-11-22	n/a	Format string vulnerability in Network Solutions Rwhoisd 1.5.x allows remote attackers to execute arbitrary code via format string specifiers in the -soa command.
CVE-2001-0839	2001-11-22	n/a	ibillpm.pl in iBill password management system generates weak passwords based on a client's MASTER_ACCOUNT, which allows remote attackers to modify account information in the .htpasswd file via brute force password guessing.
CVE-2001-0840	2001-11-22	n/a	Buffer overflow in Compaq Insight Manager XE 2.1b and earlier allows remote attackers to execute arbitrary code via (1) SNMP and (2) DMI.
CVE-2001-0841	2001-11-22	n/a	Directory traversal vulnerability in Search.cgi in Ikonboard ib219 and earlier allows remote attackers to overwrite files and gain privileges via .. (dot dot) sequences in the amembernamecookie cookie.
CVE-2001-0842	2001-11-22	n/a	Directory traversal vulnerability in Search.cgi in Leoboard LB5000 LB5000II 1029 and earlier allows remote attackers to overwrite files and gain privileges via .. (dot dot) sequences in the amembernamecookie cookie.
CVE-2001-0843	2002-03-09	n/a	Squid proxy server 2.4 and earlier allows remote attackers to cause a denial of service (crash) via a mkdir-only FTP PUT request.
CVE-2001-0844	2001-11-22	n/a	Vulnerability in (1) Book of guests and (2) Post it! allows remote attackers to execute arbitrary code via shell metacharacters in the email parameter.
CVE-2001-0845	2001-11-22	n/a	Vulnerability in DECwindows Motif Server on OpenVMS VAX or Alpha 6.2 through 7.3, and SEVMS VAX or Alpha 6.2, allows local users to gain access to unauthorized resources.
CVE-2001-0846	2002-03-09	n/a	Lotus Domino 5.x allows remote attackers to read files or execute arbitrary code by requesting the ReplicaID of the Web Administrator template file (webadmin.ntf).
CVE-2001-0847	2001-11-22	n/a	Lotus Domino Web Server 5.x allows remote attackers to gain sensitive information by accessing the default navigator $defaultNav via (1) URL encoding the request, or (2) directly requesting the ReplicaID.
CVE-2001-0848	2001-11-22	n/a	join.cfm in e-Zone Media Fuse Talk allows a local user to execute arbitrary SQL code via a semi-colon (;) in a form variable.
CVE-2001-0849	2001-11-22	n/a	viralator CGI script in Viralator 0.9pre1 and earlier allows remote attackers to execute arbitrary code via a URL for a file being downloaded, which is insecurely passed to a call to wget.
CVE-2001-0850	2002-03-09	n/a	A configuration error in the libdb1 package in OpenLinux 3.1 uses insecure versions of the snprintf and vsnprintf functions, which could allow local or remote users to exploit those functions with a buffer overflow.
CVE-2001-0851	2002-03-09	n/a	Linux kernel 2.0, 2.2 and 2.4 with syncookies enabled allows remote attackers to bypass firewall rules by brute force guessing the cookie.
CVE-2001-0852	2002-03-09	n/a	TUX HTTP server 2.1.0-2 in Red Hat Linux allows remote attackers to cause a denial of service via a long Host: header.
CVE-2001-0853	2001-11-22	n/a	Directory traversal vulnerability in Entrust GetAccess allows remote attackers to read arbitrary files via a .. (dot dot) in the locale parameter to (1) helpwin.gas.bat or (2) AboutBox.gas.bat.
CVE-2001-0854	2001-11-22	n/a	PHP-Nuke 5.2 allows remote attackers to copy and delete arbitrary files by calling case.filemanager.php with admin.php as an argument, which sets the $PHP_SELF variable and makes it appear that case.filemanager.php is being called by admin.php instead of the user.
CVE-2001-0855	2001-11-22	n/a	Buffer overflow in db_loader in ClearCase 4.2 and earlier allows local users to gain root privileges via a long TERM environment variable.
CVE-2001-0856	2001-11-22	n/a	Common Cryptographic Architecture (CCA) in IBM 4758 allows an attacker with physical access to the system and Combine_Key_Parts permissions, to steal DES and 3DES keys by using a brute force attack to create a 3DES exporter key.
CVE-2001-0857	2002-03-09	n/a	Cross-site scripting vulnerability in status.php3 in Imp Webmail 2.2.6 and earlier allows remote attackers to gain access to the e-mail of other users by hijacking session cookies via the message parameter.
CVE-2001-0858	2001-11-22	n/a	Buffer overflow in pppattach and other linked PPP utilities in Caldera Open Unix 8.0 and UnixWare 7.1.0 and 7.1.1 allows local users to gain privileges.
CVE-2001-0859	2002-03-09	n/a	2.4.3-12 kernel in Red Hat Linux 7.1 Korean installation program sets the setting default umask for init to 000, which installs files with world-writeable permissions.
CVE-2001-0860	2002-03-09	n/a	Terminal Services Manager MMC in Windows 2000 and XP trusts the Client Address (IP address) that is provided by the client instead of obtaining it from the packet headers, which allows clients to spoof their public IP address, e.g. through a Network Address Translation (NAT).
CVE-2001-0861	2002-03-09	n/a	Cisco 12000 with IOS 12.0 and line cards based on Engine 2 and earlier allows remote attackers to cause a denial of service (CPU consumption) by flooding the router with traffic that generates a large number of ICMP Unreachable replies.
CVE-2001-0862	2002-03-09	n/a	Cisco 12000 with IOS 12.0 and line cards based on Engine 2 does not block non-initial packet fragments, which allows remote attackers to bypass the ACL.
CVE-2001-0863	2002-03-09	n/a	Cisco 12000 with IOS 12.0 and line cards based on Engine 2 does not handle the "fragment" keyword in a compiled ACL (Turbo ACL) for packets that are sent to the router, which allows remote attackers to cause a denial of service via a flood of fragments.
CVE-2001-0864	2002-03-09	n/a	Cisco 12000 with IOS 12.0 and line cards based on Engine 2 does not properly handle the implicit "deny ip any any" rule in an outgoing ACL when the ACL contains exactly 448 entries, which can allow some outgoing packets to bypass access restrictions.
CVE-2001-0865	2002-03-09	n/a	Cisco 12000 with IOS 12.0 and line cards based on Engine 2 does not support the "fragment" keyword in an outgoing ACL, which could allow fragmented packets in violation of the intended access.
CVE-2001-0866	2002-03-09	n/a	Cisco 12000 with IOS 12.0 and lines card based on Engine 2 does not properly handle an outbound ACL when an input ACL is not configured on all the interfaces of a multi port line card, which could allow remote attackers to bypass the intended access controls.
CVE-2001-0867	2002-03-09	n/a	Cisco 12000 with IOS 12.0 and line cards based on Engine 2 does not properly filter does not properly filter packet fragments even when the "fragment" keyword is used in an ACL, which allows remote attackers to bypass the intended access controls.
CVE-2001-0868	2001-11-28	n/a	Red Hat Stronghold 2.3 to 3.0 allows remote attackers to retrieve system information via an HTTP GET request to (1) stronghold-info or (2) stronghold-status.
CVE-2001-0869	2002-06-25	n/a	Format string vulnerability in the default logging callback function _sasl_syslog in common.c in Cyrus SASL library (cyrus-sasl) may allow remote attackers to execute arbitrary commands.
CVE-2001-0870	2001-11-30	n/a	HTTP server in Alchemy Eye and Alchemy Network Monitor 1.9x through 2.6.18 is enabled without authentication by default, which allows remote attackers to obtain network monitoring logs with potentially sensitive information by directly requesting the eye.ini file.
CVE-2001-0871	2001-11-30	n/a	Directory traversal vulnerability in HTTP server for Alchemy Eye and Alchemy Network Monitor allows remote attackers to execute arbitrary commands via an HTTP request containing (1) a .. in versions 2.0 through 2.6.18, or (2) a DOS device name followed by a .. in versions 2.6.19 through 3.0.10.
CVE-2001-0872	2002-06-25	n/a	OpenSSH 3.0.1 and earlier with UseLogin enabled does not properly cleanse critical environment variables such as LD_PRELOAD, which allows local users to gain root privileges.
CVE-2001-0873	2003-04-02	n/a	uuxqt in Taylor UUCP package does not properly remove dangerous long options, which allows local users to gain privileges by calling uux and specifying an alternate configuration file with the --config option.
CVE-2001-0874	2002-03-09	n/a	Internet Explorer 5.5 and 6.0 allow remote attackers to read certain files via HTML that passes information from a frame in the client's domain to a frame in the web site's domain, a variant of the "Frame Domain Verification" vulnerability.
CVE-2001-0875	2002-03-09	n/a	Internet Explorer 5.5 and 6.0 allows remote attackers to cause the File Download dialogue box to misrepresent the name of the file in the dialogue in a way that could fool users into thinking that the file type is safe to download.
CVE-2001-0876	2002-03-09	n/a	Buffer overflow in Universal Plug and Play (UPnP) on Windows 98, 98SE, ME, and XP allows remote attackers to execute arbitrary code via a NOTIFY directive with a long Location URL.
CVE-2001-0877	2002-03-09	n/a	Universal Plug and Play (UPnP) on Windows 98, 98SE, ME, and XP allows remote attackers to cause a denial of service via (1) a spoofed SSDP advertisement that causes the client to connect to a service on another machine that generates a large amount of traffic (e.g., chargen), or (2) via a spoofed SSDP announcement to broadcast or multicast addresses, which could cause all UPnP clients to send traffic to a single target system.
CVE-2001-0879	2002-03-09	n/a	Format string vulnerability in the C runtime functions in SQL Server 7.0 and 2000 allows attackers to cause a denial of service.
CVE-2001-0884	2002-06-25	n/a	Cross-site scripting vulnerability in Mailman email archiver before 2.08 allows attackers to obtain sensitive information or authentication credentials via a malicious link that is accessed by other web users.
CVE-2001-0886	2002-06-25	n/a	Buffer overflow in glob function of glibc allows attackers to cause a denial of service (crash) and possibly execute arbitrary code via a glob pattern that ends in a brace "{" character.
CVE-2001-0887	2002-06-25	n/a	xSANE 0.81 and earlier allows local users to modify files of other xSANE users via a symlink attack on temporary files.
CVE-2001-0888	2002-06-25	n/a	Atmel Firmware 1.3 Wireless Access Point (WAP) allows remote attackers to cause a denial of service via a SNMP request with (1) a community string other than "public" or (2) an unknown OID, which causes the WAP to deny subsequent SNMP requests.
CVE-2001-0889	2002-06-25	n/a	Exim 3.22 and earlier, in some configurations, does not properly verify the local part of an address when redirecting the address to a pipe, which could allow remote attackers to execute arbitrary commands via shell metacharacters.
CVE-2001-0890	2002-07-23	n/a	Certain backend drivers in the SANE library 1.0.3 and earlier, as used in frontend software such as XSane, allows local users to modify files via a symlink attack on temporary files.
