CVE-2007-0737	2007-04-24	n/a	The Login Window in Apple Mac OS X 10.3.9 through 10.4.9 does not properly check certain environment variables, which allows local users to gain privileges via unspecified vectors.
CVE-2007-0738	2007-04-24	n/a	The Login Window in Apple Mac OS X 10.4 through 10.4.9 does not display the screen saver authentication dialog in certain circumstances when waking from sleep, even though the "require a password to wake the computer from sleep" option is enabled, which allows local users to bypass authentication controls.
CVE-2007-0739	2007-04-24	n/a	The Login Window in Apple Mac OS X 10.4 through 10.4.9 displays the software update window beneath the loginwindow authentication dialog in certain circumstances related to running scheduled tasks, which allows local users to bypass authentication controls.
CVE-2007-0740	2007-05-24	n/a	Alias Manager in Apple Mac OS X 10.3.9 and 10.4.9 does not display files with the same name in mounted disk images that have the same name, which might allow user-assisted attackers to trick a user into executing malicious files.
CVE-2007-0741	2007-04-24	n/a	Buffer overflow in natd in network_cmds in Apple Mac OS X 10.3.9 through 10.4.9, when Internet Sharing is enabled, allows remote attackers to execute arbitrary code via malformed RTSP packets.
CVE-2007-0742	2007-04-24	n/a	The WebFoundation framework in Apple Mac OS X 10.3.9 and earlier allows subdomain cookies to be accessed by the parent domain, which allows remote attackers to obtain sensitive information.
CVE-2007-0743	2007-04-24	n/a	URLMount in Apple Mac OS X 10.3.9 through 10.4.9 passes the username and password credentials for mounting filesystems on SMB servers as command line arguments to the mount_sub command, which may allow local users to obtain sensitive information by listing the process.
CVE-2007-0744	2007-04-24	n/a	SMB in Apple Mac OS X 10.3.9 through 10.4.9 does not properly clean the environment when executing commands, which allows local users to gain privileges by setting unspecified environment variables.
CVE-2007-0745	2007-05-02	n/a	The Apple Security Update 2007-004 uses an incorrect configuration file for FTPServer in Apple Mac OS X Server 10.4.9, which might allow remote authenticated users to access additional directories.
CVE-2007-0746	2007-04-24	n/a	Heap-based buffer overflow in the VideoConference framework in Apple Mac OS X 10.3.9 through 10.4.9 allows remote attackers to execute arbitrary code via a "crafted SIP packet when initializing an audio/video conference".
CVE-2007-0747	2007-04-24	n/a	load_webdav in Apple Mac OS X 10.3.9 through 10.4.9 does not properly clean the environment when mounting a WebDAV filesystem, which allows local users to gain privileges by setting unspecified environment variables.
CVE-2007-0748	2007-05-13	n/a	Heap-based buffer overflow in Apple Darwin Streaming Proxy, when using Darwin Streaming Server before 5.5.5, allows remote attackers to execute arbitrary code via multiple trackID values in a SETUP RTSP request.
CVE-2007-0749	2007-05-13	n/a	Multiple stack-based buffer overflows in the is_command function in proxy.c in Apple Darwin Streaming Proxy, when using Darwin Streaming Server before 5.5.5, allow remote attackers to execute arbitrary code via a long (1) cmd or (2) server value in an RTSP request.
CVE-2007-0750	2007-05-24	n/a	Integer overflow in CoreGraphics in Apple Mac OS X 10.4 up to 10.4.9 allows remote user-assisted attackers to cause a denial of service (application termination) or execute arbitrary code via a crafted PDF file.
CVE-2007-0751	2007-05-24	n/a	A cleanup script in crontabs in Apple Mac OS X 10.3.9 and 10.4.9 might delete filesystems that have been mounted in /tmp, which might allow local users to cause a denial of service, related to the find command.
CVE-2007-0752	2007-05-24	n/a	The PPP daemon (pppd) in Apple Mac OS X 10.4.8 checks ownership of the stdin file descriptor to determine if the invoker has sufficient privileges, which allows local users to load arbitrary plugins and gain root privileges by bypassing this check.
CVE-2007-0753	2007-05-24	n/a	Format string vulnerability in the VPN daemon (vpnd) in Apple Mac OS X 10.3.9 and 10.4.9 allows local users to execute arbitrary code via the -i parameter.
CVE-2007-0754	2007-05-14	n/a	Heap-based buffer overflow in Apple QuickTime before 7.1.3 allows user-assisted remote attackers to execute arbitrary code via a crafted Sample Table Sample Descriptor (STSD) atom size in a QuickTime movie.
CVE-2007-0756	2007-02-05	n/a	Chicken of the VNC (cotv) 2.0 allows remote attackers to cause a denial of service (application crash) via a large computer-name size value in a ServerInit packet, which triggers a failed malloc and a resulting NULL dereference.
CVE-2007-0757	2007-02-05	n/a	PHP remote file inclusion vulnerability in index.php in Miguel Nunes Call of Duty 2 (CoD2) DreamStats System 4.2 and earlier allows remote attackers to execute arbitrary PHP code via a URL in the rootpath parameter.
CVE-2007-0758	2007-02-05	n/a	PHP remote file inclusion vulnerability in lang.php in PHPProbid 5.24 allows remote attackers to execute arbitrary PHP code via a URL in the SRC attribute of an HTML element in the lang parameter.  NOTE: The provenance of this information is unknown; the details are obtained solely from third party information.
CVE-2007-0759	2007-02-05	n/a	Multiple SQL injection vulnerabilities in EasyMoblog 0.5.1 allow remote attackers to execute arbitrary SQL commands via the (1) i or (2) post_id parameter to add_comment.php, which triggers an injection in libraries.inc.php; or (3) the i parameter to list_comments.php, which triggers an injection in libraries.inc.php.
CVE-2007-0760	2007-02-05	n/a	EQdkp 1.3.1 and earlier authenticates administrative requests by verifying that the HTTP Referer header specifies an admin/ URL, which allows remote attackers to read or modify account names and passwords via a spoofed Referer.
CVE-2007-0761	2007-02-05	n/a	PHP remote file inclusion vulnerability in config.php in phpBB ezBoard converter (ezconvert) 0.2 allows remote attackers to execute arbitrary PHP code via a URL in the ezconvert_dir parameter.
CVE-2007-0762	2007-02-05	n/a	PHP remote file inclusion vulnerability in includes/functions.php in phpBB++ Build 100 allows remote attackers to execute arbitrary PHP code via a URL in the phpbb_root_path parameter.
CVE-2007-0763	2007-02-05	n/a	Cross-site scripting (XSS) vulnerability in the news comment functionality in F3Site 2.1 and earlier allows remote attackers to inject arbitrary web script or HTML via the Autor field.
CVE-2007-0764	2007-02-05	n/a	Unrestricted file upload vulnerability in F3Site 2.1 and earlier allows remote authenticated administrators to upload and execute arbitrary PHP scripts via GIF86 header in a file in the uplf parameter, which can be later accessed via a relative pathname in the dir parameter in adm.php.
CVE-2007-0765	2007-02-05	n/a	SQL injection vulnerability in news.php in dB Masters Curium CMS 1.03 and earlier allows remote attackers to execute arbitrary SQL commands via the c_id parameter.
CVE-2007-0766	2007-02-05	n/a	Stack-based buffer overflow in Remotesoft .NET Explorer 2.0.1 allows user-assisted remote attackers to cause a denial of service (application crash) and possibly execute arbitrary code via a long line in a .cpp file.
CVE-2007-0767	2007-02-05	n/a	Cross-site scripting (XSS) vulnerability in the core in Phorum before 5.1.18 allows remote attackers to inject arbitrary web script or HTML via unspecified vectors.
CVE-2007-0768	2007-02-05	n/a	Multiple cross-site scripting (XSS) vulnerabilities in the Contact Details functionality in Yahoo! Messenger 8.1.0.209 and earlier allow user-assisted remote attackers to inject arbitrary web script or HTML via a javascript: URI in the SRC attribute of an IMG element to the (1) First Name, (2) Last Name, and (3) Nickname fields.  NOTE: some of these details are obtained from third party information.
CVE-2007-0769	2007-02-05	n/a	** DISPUTED **  Cross-site scripting (XSS) vulnerability in register.php in Phorum 5.1.18 allows remote attackers to inject arbitrary web script or HTML via unspecified vectors.  NOTE: the vendor disputes this vulnerability, stating that "The characters are escaped properly."
CVE-2007-0770	2007-02-12	n/a	Buffer overflow in GraphicsMagick and ImageMagick allows user-assisted remote attackers to cause a denial of service and possibly execute arbitrary code via a PALM image that is not properly handled by the ReadPALMImage function in coders/palm.c. NOTE: this issue is due to an incomplete patch for CVE-2006-5456.
CVE-2007-0771	2007-05-02	n/a	The utrace support in Linux kernel 2.6.18, and other versions, allows local users to cause a denial of service (system hang) related to "MT exec + utrace_attach spin failure mode," as demonstrated by ptrace-thrash.c.
CVE-2007-0772	2007-02-20	n/a	The Linux kernel 2.6.13 and other versions before 2.6.20.1 allows remote attackers to cause a denial of service (oops) via a crafted NFSACL 2 ACCESS request that triggers a free of an incorrect pointer.
CVE-2007-0773	2007-06-26	n/a	The Linux kernel before 2.6.9-42.0.8 in Red Hat 4.4 allows local users to cause a denial of service (kernel OOPS from null dereference) via fput in a 32-bit ioctl on 64-bit x86 systems, an incomplete fix of CVE-2005-3044.1.
CVE-2007-0774	2007-03-04	n/a	Stack-based buffer overflow in the map_uri_to_worker function (native/common/jk_uri_worker_map.c) in mod_jk.so for Apache Tomcat JK Web Server Connector 1.2.19 and 1.2.20, as used in Tomcat 4.1.34 and 5.5.20, allows remote attackers to execute arbitrary code via a long URL that triggers the overflow in a URI worker map routine.
CVE-2007-0775	2007-02-26	n/a	Multiple unspecified vulnerabilities in the layout engine in Mozilla Firefox before 1.5.0.10 and 2.x before 2.0.0.2, Thunderbird before 1.5.0.10, and SeaMonkey before 1.0.8 allow remote attackers to cause a denial of service (crash) and potentially execute arbitrary code via certain vectors.
CVE-2007-0776	2007-02-26	n/a	Heap-based buffer overflow in the _cairo_pen_init function in Mozilla Firefox 2.x before 2.0.0.2, Thunderbird before 1.5.0.10, and SeaMonkey before 1.0.8 allows remote attackers to execute arbitrary code via a large stroke-width attribute in the clipPath element in an SVG file.
CVE-2007-0777	2007-02-26	n/a	The JavaScript engine in Mozilla Firefox before 1.5.0.10 and 2.x before 2.0.0.2, Thunderbird before 1.5.0.10, and SeaMonkey before 1.0.8 allows remote attackers to cause a denial of service (crash) and possibly execute arbitrary code via certain vectors that trigger memory corruption.
CVE-2007-0778	2007-02-26	n/a	The page cache feature in Mozilla Firefox before 1.5.0.10 and 2.x before 2.0.0.2, and SeaMonkey before 1.0.8 can generate hash collisions that cause page data to be appended to the wrong page cache, which allows remote attackers to obtain sensitive information or enable further attack vectors when the target page is reloaded from the cache.
CVE-2007-0779	2007-02-26	n/a	GUI overlay vulnerability in Mozilla Firefox 1.5.x before 1.5.0.10 and 2.x before 2.0.0.2, and SeaMonkey before 1.0.8 allows remote attackers to spoof certain user interface elements, such as the host name or security indicators, via the CSS3 hotspot property with a large, transparent, custom cursor.
CVE-2007-0780	2007-02-26	n/a	browser.js in Mozilla Firefox 1.5.x before 1.5.0.10 and 2.x before 2.0.0.2, and SeaMonkey before 1.0.8 uses the requesting URI to identify child windows, which allows remote attackers to conduct cross-site scripting (XSS) attacks by opening a blocked popup originating from a javascript: URI in combination with multiple frames having the same data: URI.
CVE-2007-0784	2007-02-06	n/a	SQL injection vulnerability in login.asp for tPassword in the Raymond BERTHOU script collection (aka RBL - ASP) allows remote attackers to execute arbitrary SQL commands via the (1) User and (2) Password parameters.
CVE-2007-0785	2007-02-06	n/a	PHP remote file inclusion vulnerability in previewtheme.php in Flipsource Flip 2.01-final 1.0 and earlier allows remote attackers to execute arbitrary PHP code via a URL in the inc_path parameter.
CVE-2007-0786	2007-02-06	n/a	SQL injection vulnerability in view.php in Noname Media Photo Galerie Standard 1.1.1 and earlier allows remote attackers to execute arbitrary SQL commands via the id parameter.
CVE-2007-0787	2007-02-06	n/a	PHP remote file inclusion vulnerability in controller.php in Simple Invoices before 20070202 allows remote attackers to execute arbitrary PHP code via a URL in the (1) module or (2) view parameter.  NOTE: some of these details are obtained from third party information.
CVE-2007-0788	2007-02-06	n/a	Cross-site scripting (XSS) vulnerability in MediaWiki 1.9.x before 1.9.2 allows remote attackers to inject arbitrary web script or HTML via unspecified vectors related to "sortable tables JavaScript."
CVE-2007-0789	2007-02-06	n/a	SQL injection vulnerability in Mambo before 4.5.5 allows remote attackers to execute arbitrary SQL commands via unspecified vectors in cancel edit functions, possibly related to the id parameter.
CVE-2007-0790	2007-02-06	n/a	Heap-based buffer overflow in SmartFTP 2.0.1002 allows remote FTP servers to execute arbitrary code via a large banner.
CVE-2007-0791	2007-02-06	n/a	Cross-site scripting (XSS) vulnerability in Atom feeds in Bugzilla 2.20.3, 2.22.1, and 2.23.3, and earlier versions down to 2.20.1, allows remote attackers to inject arbitrary web script or HTML via unspecified vectors.
CVE-2007-0792	2007-02-06	n/a	The mod_perl initialization script in Bugzilla 2.23.3 does not set the Bugzilla Apache configuration to allow .htaccess permissions to override file permissions, which allows remote attackers to obtain the database username and password via a direct request for the localconfig file.
CVE-2007-0793	2007-02-06	n/a	PHP remote file inclusion vulnerability in inc/common.php in GlobalMegaCorp dvddb 0.6 allows remote attackers to execute arbitrary PHP code via a URL in the config parameter.
CVE-2007-0794	2007-02-06	n/a	** DISPUTED **  SQL injection vulnerability in inc/common.php in GlobalMegaCorp dvddb 0.6 allows remote attackers to execute arbitrary SQL commands via the user parameter.  NOTE: this issue has been disputed by a reliable third party, who states that inc/common.php only contains function definitions.
CVE-2007-0795	2007-02-06	n/a	Multiple PHP remote file inclusion vulnerabilities in Wap Portal Server 1.x allow remote attackers to execute arbitrary PHP code via a URL in the language parameter to (1) index.php and (2) admin/index.php.
CVE-2007-0796	2007-02-06	n/a	Blue Coat Systems WinProxy 6.1a and 6.0 r1c, and possibly earlier, allows remote attackers to cause a denial of service (daemon crash) or possibly execute arbitrary code via a long HTTP CONNECT request, which triggers heap corruption.
CVE-2007-0797	2007-02-06	n/a	PHP remote file inclusion vulnerability in theme/settings.php in bluevirus-design SMA-DB 0.3.9 and earlier allows remote attackers to execute arbitrary PHP code via a URL in the pfad_z parameter.
CVE-2007-0798	2007-02-06	n/a	Multiple cross-site scripting (XSS) vulnerabilities in Ublog Reload 1.0.5 allow remote attackers to inject arbitrary web script or HTML via unspecified parameters to (1) login.asp; and allow remote authenticated users to inject arbitrary web script or HTML via unspecified parameters to (2) badword.asp, (3) polls.asp, and (4) users.asp.
CVE-2007-0799	2007-02-06	n/a	SQL injection vulnerability in badword.asp in Ublog Reload 1.0.5 allows remote attackers to execute arbitrary SQL commands via unspecified vectors.
CVE-2007-0800	2007-02-07	n/a	Cross-zone vulnerability in Mozilla Firefox 1.5.0.9 considers blocked popups to have an internal zone origin, which allows user-assisted remote attackers to cross zone restrictions and read arbitrary file:// URIs by convincing a user to show a blocked popup.
CVE-2007-0801	2007-02-07	n/a	The nsExternalAppHandler::SetUpTempFile function in Mozilla Firefox 1.5.0.9 creates temporary files with predictable filenames based on creation time, which allows remote attackers to execute arbitrary web script or HTML via a crafted XMLHttpRequest.
CVE-2007-0802	2007-02-07	n/a	Mozilla Firefox 2.0.0.1 allows remote attackers to bypass the Phishing Protection mechanism by adding certain characters to the end of the domain name, as demonstrated by the "." and "/" characters, which is not caught by the Phishing List blacklist filter.
CVE-2007-0803	2007-02-07	n/a	Multiple buffer overflows in STLport before 5.0.3 allow remote attackers to execute arbitrary code via unspecified vectors relating to (1) "print floats" and (2) a missing null termination in the "rope constructor."
CVE-2007-0804	2007-02-07	n/a	Directory traversal vulnerability in admin/subpages.php in GGCMS 1.1.0 RC1 and earlier allows remote attackers to inject arbitrary PHP code into arbitrary files via ".." sequences in the subpageName parameter, as demonstrated by injecting PHP code into a template file.
CVE-2007-0805	2007-02-07	n/a	The ps (/usr/ucb/ps) command on HP Tru64 UNIX 5.1 1885 allows local users to obtain sensitive information, including environment variables of arbitrary processes, via the "auxewww" argument, a similar issue to CVE-1999-1587.
CVE-2007-0806	2007-02-07	n/a	Les News 2.2 allows remote attackers to bypass authentication and gain administrative access via a direct request for adminews/index_fr.php3, and possibly the adminews index documents for other localizations.
CVE-2007-0807	2007-02-07	n/a	Cross-site scripting (XSS) vulnerability in info.php in flashChat 4.7.8 allows remote attackers to inject arbitrary web script or HTML via a channel title (aka room name) that is not properly handled by the "who's online" feature.
CVE-2007-0808	2007-02-07	n/a	PHP remote file inclusion vulnerability in Mina Ajans Script allows remote attackers to execute arbitrary PHP code via a URL in the syf parameter to an unspecified PHP script.
CVE-2007-0809	2007-02-07	n/a	PHP remote file inclusion vulnerability in includes/class_template.php in Categories hierarchy (aka CH or mod-CH) 2.1.2 in ptirhiikmods allows remote attackers to execute arbitrary PHP code via a URL in the phpbb_root_path parameter.
CVE-2007-0810	2007-02-07	n/a	PHP remote file inclusion vulnerability in MVCnPHP/BaseView.php in GeekLog 2 and earlier allows remote attackers to execute arbitrary PHP code via a URL in the glConf[path_libraries] parameter.  NOTE: this might be a vulnerability in MVCnPHP rather than a vulnerability in GeekLog.
CVE-2007-0811	2007-02-07	n/a	Microsoft Internet Explorer 6.0 SP1 on Windows 2000, and 6.0 SP2 on Windows XP, allows remote attackers to cause a denial of service (NULL pointer dereference and application crash) via an HTML document containing a certain JavaScript for loop with an empty loop body, possibly involving getElementById.
CVE-2007-0812	2007-02-07	n/a	SQL injection vulnerability in pms.php in Woltlab Burning Board (wBB) Lite 1.0.2pl3e and earlier allows remote authenticated users to execute arbitrary SQL commands via the pmid[0] parameter.
CVE-2007-0813	2007-02-07	n/a	Cross-site scripting (XSS) vulnerability in Home production MySearchEngine allows remote attackers to inject arbitrary web script or HTML via unspecified vectors.
CVE-2007-0814	2007-02-07	n/a	Multiple cross-site scripting (XSS) vulnerabilities in Adrenalin's ASP Chat allow remote attackers to inject arbitrary web script or HTML (1) via the psuedo (pseudo) field or (2) during chat.
CVE-2007-0815	2007-02-07	n/a	Cross-site scripting (XSS) vulnerability in images_archive.asp in Uapplication Uphotogallery 1.1 allows remote authenticated administrators to inject arbitrary web script or HTML via the s parameter.  NOTE: the thumbnails.asp vector is already covered by CVE-2006-3023.
CVE-2007-0816	2007-02-07	n/a	The RPC Server service (catirpc.exe) in CA (formerly Computer Associates) BrightStor ARCserve Backup 11.5 SP2 and earlier allows remote attackers to cause a denial of service (service crash) via a crafted TADDR2UADDR that triggers a null pointer dereference in catirpc.dll, possibly related to null credentials or verifier fields.
CVE-2007-0817	2007-02-07	n/a	Cross-site scripting (XSS) vulnerability in Adobe ColdFusion web server allows remote attackers to inject arbitrary HTML or web script via the User-Agent HTTP header, which is not sanitized before being displayed in an error page.
CVE-2007-0819	2007-02-08	n/a	HP Network Node Manager (NNM) Remote Console 7.50, 7.51, and 7.53 assigns Everyone Full Control permission for the %PROGRAMFILES%\HP OpenView directory tree, which allows local users to gain privileges via a Trojan horse executable file or ActiveX component, or a modified bin\ovtrcsvc.exe for the HP Open View Shared Trace Service.
CVE-2007-0820	2007-02-07	n/a	Multiple PHP remote file inclusion vulnerabilities in Cedric CLAIRE PortailPhp 2 allow remote attackers to execute arbitrary PHP code via a URL in the chemin parameter to (1) mod_news/index.php, (2) mod_news/goodies.php, or (3) mod_search/index.php.  NOTE: The provenance of this information is unknown; the details are obtained solely from third party information.
CVE-2007-0821	2007-02-07	n/a	Multiple directory traversal vulnerabilities in Cedric CLAIRE PortailPhp 2 allow remote attackers to read arbitrary files via a .. (dot dot) in the chemin parameter to (1) mod_news/index.php or (2) mod_news/goodies.php.  NOTE: The provenance of this information is unknown; the details are obtained solely from third party information.
CVE-2007-0822	2007-02-07	n/a	umount, when running with the Linux 2.6.15 kernel on Slackware Linux 10.2, allows local users to trigger a NULL dereference and application crash by invoking the program with a pathname for a USB pen drive that was mounted and then physically removed, which might allow the users to obtain sensitive information, including core file contents.
CVE-2007-0823	2007-02-07	n/a	xterm on Slackware Linux 10.2 stores information that had been displayed for a different user account using the same xterm process, which might allow local users to bypass file permissions and read other users' files, or obtain other sensitive information, by reading the xterm process memory.  NOTE: it could be argued that this is an expected consequence of multiple users sharing the same interactive process, in which case this is not a vulnerability.
CVE-2007-0824	2007-02-07	n/a	PHP remote file inclusion vulnerability in inhalt.php in LightRO CMS 1.0 allows remote attackers to execute arbitrary PHP code via a URL in the dateien[news] parameter.
CVE-2007-0825	2007-02-07	n/a	FlashFXP 3.4.0 build 1145 allows remote servers to cause a denial of service (CPU consumption) via a response to a PWD command that contains a long string with deeply nested directory structure, possibly due to a buffer overflow.
CVE-2007-0826	2007-02-07	n/a	SQL injection vulnerability in forum.asp in Kisisel Site 2007 allows remote attackers to execute arbitrary SQL commands via the forumid parameter.
CVE-2007-0827	2007-02-07	n/a	The Alibaba Alipay PTA Module ActiveX control (PTA.DLL) allows remote attackers to execute arbitrary code via a JavaScript function that invokes the Remove method with an invalid index argument, which is used as an offset for a function call.
CVE-2007-0828	2007-02-07	n/a	PHP remote file inclusion vulnerability in affichearticles.php3 in MySQLNewsEngine allows remote attackers to execute arbitrary PHP code via a URL in the newsenginedir parameter.
CVE-2007-0829	2007-02-07	n/a	avast! Server Edition before 4.7.726 does not demand a password in a certain intended context, even when a password has been set, which allows local users to bypass authentication requirements.
CVE-2007-0830	2007-02-07	n/a	** DISPUTED **  Multiple cross-site scripting (XSS) vulnerabilities in the Admin Control Panel (AdminCP) in Jelsoft vBulletin 3.6.4 allow remote authenticated administrators to inject arbitrary web script or HTML via unspecified vectors related to the (1) User Group Manager, (2) User Rank Manager, (3) User Title Manager, (4) BB Code Manager, (5) Attachment Manager, (6) Calendar Manager, and (7) Forums & Moderators functions.  NOTE: the vendor disputes this issue, stating that modifying HTML is an intended privilege of an administrator.  NOTE: it is possible that this issue overlaps CVE-2006-6040.
CVE-2007-0831	2007-02-07	n/a	** DISPUTED ** Multiple PHP remote file inclusion vulnerabilities in Atsphp 5.0.1 allow remote attackers to execute arbitrary PHP code via a URL in the CONF[path] parameter to (1) index.php, (2) sources/usercp.php, or (3) sources/admin.php.  NOTE: Another researcher has disputed this vulnerability, noting that CONF[path] is defined before use in index.php, that CONF[path] inclusion cannot occur through a direct request to other affected files, and that usercp.php is a typo of user_cp.php.
CVE-2007-0832	2007-02-07	n/a	VMware Workstation 5.5.3 34685 does not immediately change the availability of a shared clipboard when the "Enable copy and paste to and from this virtual machine" checkbox is changed, which allows local users to obtain sensitive information or conduct certain attacks that are facilitated by weaker isolation between the host and guest operating systems.
CVE-2007-0833	2007-02-07	n/a	VMware Workstation 5.5.3 34685, when the "Enable copy and paste to and from this virtual machine" option is enabled, preserves clipboard data on the guest operating system after it was deleted on the host operating system, which might allow local users to read clipboard contents by moving the focus back to the host operating system.
