CVE-2007-0001	2007-02-27	n/a	The file watch implementation in the audit subsystem (auditctl -w) in the Red Hat Enterprise Linux (RHEL) 4 kernel 2.6.9 allows local users to cause a denial of service (kernel panic) by replacing a watched file, which does not cause the watch on the old inode to be dropped.
CVE-2007-0002	2007-03-16	n/a	Multiple heap-based buffer overflows in WordPerfect Document importer/exporter (libwpd) before 0.8.9 allow user-assisted remote attackers to cause a denial of service (application crash) and possibly execute arbitrary code via a crafted WordPerfect file in which values to loop counters are not properly handled in the (1) WP3TablesGroup::_readContents and (2) WP5DefinitionGroup_DefineTablesSubGroup::WP5DefinitionGroup_DefineTablesSubGroup functions.  NOTE: the integer overflow has been split into CVE-2007-1466.
CVE-2007-0003	2007-01-23	n/a	pam_unix.so in Linux-PAM 0.99.7.0 allows context-dependent attackers to log into accounts whose password hash, as stored in /etc/passwd or /etc/shadow, has only two characters.
CVE-2007-0004	2007-09-18	n/a	The NFS client implementation in the kernel in Red Hat Enterprise Linux (RHEL) 3, when a filesystem is mounted with the noacl option, checks permissions for the open system call via vfs_permission (mode bits) data rather than an NFS ACCESS call to the server, which allows local client processes to obtain a false success status from open calls that the server would deny, and possibly obtain sensitive information about file permissions on the server, as demonstrated in a root_squash environment.  NOTE: it is uncertain whether any scenarios involving this issue cross privilege boundaries.
CVE-2007-0005	2007-03-09	n/a	Multiple buffer overflows in the (1) read and (2) write handlers in the Omnikey CardMan 4040 driver in the Linux kernel before 2.6.21-rc3 allow local users to gain privileges.
CVE-2007-0006	2007-02-06	n/a	The key serial number collision avoidance code in the key_alloc_serial function in Linux kernel 2.6.9 up to 2.6.20 allows local users to cause a denial of service (crash) via vectors that trigger a null dereference, as originally reported as "spinlock CPU recursion."
CVE-2007-0007	2007-02-19	n/a	gnucash 2.0.4 and earlier allows local users to overwrite arbitrary files via a symlink attack on the (1) gnucash.trace, (2) qof.trace, and (3) qof.trace.[PID] temporary files.
CVE-2007-0008	2007-02-26	n/a	Integer underflow in the SSLv2 support in Mozilla Network Security Services (NSS) before 3.11.5, as used by Firefox before 1.5.0.10 and 2.x before 2.0.0.2, SeaMonkey before 1.0.8, Thunderbird before 1.5.0.10, and certain Sun Java System server products before 20070611, allows remote attackers to execute arbitrary code via a crafted SSLv2 server message containing a public key that is too short to encrypt the "Master Secret", which results in a heap-based overflow.
CVE-2007-0009	2007-02-26	n/a	Stack-based buffer overflow in the SSLv2 support in Mozilla Network Security Services (NSS) before 3.11.5, as used by Firefox before 1.5.0.10 and 2.x before 2.0.0.2, Thunderbird before 1.5.0.10, SeaMonkey before 1.0.8, and certain Sun Java System server products before 20070611, allows remote attackers to execute arbitrary code via invalid "Client Master Key" length values.
CVE-2007-0010	2007-01-24	n/a	The GdkPixbufLoader function in GIMP ToolKit (GTK+) in GTK 2 (gtk2) before 2.4.13 allows context-dependent attackers to cause a denial of service (crash) via a malformed image file.
CVE-2007-0011	2007-11-05	n/a	The web portal interface in Citrix Access Gateway (aka Citrix Advanced Access Control) before Advanced Edition 4.5 HF1 places a session ID in the URL, which allows context-dependent attackers to hijack sessions by reading "residual information", including the a referer log, browser history, or browser cache.
CVE-2007-0012	2008-01-09	n/a	Sun JRE 5.0 before update 14 allows remote attackers to cause a denial of service (Internet Explorer crash) via an object tag with an encoded applet and an undefined name attribute, which triggers a NULL pointer dereference in jpiexp32.dll when the applet is decoded and passed to the JVM.
CVE-2007-0014	2007-01-16	n/a	ChainKey Java Code Protection allows attackers to decompile Java class files via a Java class loader with a modified defineClass method that saves the bytecode to a file before it is passed to the JVM.
CVE-2007-0015	2007-01-01	n/a	Buffer overflow in Apple QuickTime 7.1.3 allows remote attackers to execute arbitrary code via a long rtsp:// URI.
CVE-2007-0016	2007-01-02	n/a	Stack-based buffer overflow in MoviePlay 4.76 allows remote attackers to execute arbitrary code via a long filename in a LST file.
CVE-2007-0017	2007-01-02	n/a	Multiple format string vulnerabilities in (1) the cdio_log_handler function in modules/access/cdda/access.c in the CDDA (libcdda_plugin) plugin, and the (2) cdio_log_handler and (3) vcd_log_handler functions in modules/access/vcdx/access.c in the VCDX (libvcdx_plugin) plugin, in VideoLAN VLC 0.7.0 through 0.8.6 allow user-assisted remote attackers to execute arbitrary code via format string specifiers in an invalid URI, as demonstrated by a udp://-- URI in an M3U file.
CVE-2007-0018	2007-01-24	n/a	Stack-based buffer overflow in the NCTAudioFile2.AudioFile ActiveX control (NCTAudioFile2.dll), as used by multiple products, allows remote attackers to execute arbitrary code via a long argument to the SetFormatLikeSample function. NOTE: the products include (1) NCTsoft NCTAudioStudio, NCTAudioEditor, and NCTDialogicVoice; (2) Magic Audio Recorder, Music Editor, and Audio Converter; (3) Aurora Media Workshop; DB Audio Mixer And Editor; (4) J. Hepple Products including Fx Audio Editor and others; (5) EXPStudio Audio Editor; (6) iMesh; (7) Quikscribe; (8) RMBSoft AudioConvert and SoundEdit Pro 2.1; (9) CDBurnerXP; (10) Code-it Software Wave MP3 Editor and aBasic Editor; (11) Movavi VideoMessage, DVD to iPod, and others; (12) SoftDiv Software Dexster, iVideoMAX, and others; (13) Sienzo Digital Music Mentor (DMM); (14) MP3 Normalizer; (15) Roemer Software FREE and Easy Hi-Q Recorder, and Easy Hi-Q Converter; (16) Audio Edit Magic; (17) Joshua Video and Audio Converter; (18) Virtual CD; (19) Cheetah CD and DVD Burner; (20) Mystik Media AudioEdit Deluxe, Blaze Media, and others; (21) Power Audio Editor; (22) DanDans Digital Media Full Audio Converter, Music Editing Master, and others; (23) Xrlly Software Text to Speech Makerand Arial Sound Recorder / Audio Converter; (24) Absolute Sound Recorder, Video to Audio Converter, and MP3 Splitter; (25) Easy Ringtone Maker; (26) RecordNRip; (27) McFunSoft iPod Audio Studio, Audio Recorder for Free, and others; (28) MP3 WAV Converter; (29) BearShare 6.0.2.26789; and (30) Oracle Siebel SimBuilder and CRM 7.x.
CVE-2007-0019	2007-01-19	n/a	Multiple heap-based buffer overflows in rumpusd in Rumpus 5.1 and earlier (1) allow remote authenticated users to execute arbitrary code via a long LIST command and other unspecified requests to the FTP service, and (2) allow remote attackers to execute arbitrary code via unspecified requests to the HTTP service.
CVE-2007-0020	2007-01-23	n/a	Heap-based buffer overflow in the SFTP protocol handler for Panic Transmit (Transmit.app) up to 3.5.5 allows remote attackers to execute arbitrary code via a long ftps:// URL.
CVE-2007-0021	2007-01-22	n/a	Format string vulnerability in Apple iChat 3.1.6 allows remote attackers to cause a denial of service (null pointer dereference and application crash) and possibly execute arbitrary code via format string specifiers in an aim:// URI.
CVE-2007-0022	2007-01-22	n/a	Untrusted search path vulnerability in writeconfig in Apple Mac OS X 10.4.8 allows local users to gain privileges via a modified PATH that points to a malicious launchctl program.
CVE-2007-0023	2007-01-23	n/a	The CFUserNotificationSendRequest function in UserNotificationCenter.app in Apple Mac OS X 10.4.8, when used in combination with diskutil, allows local users to gain privileges via a malicious InputManager in Library/InputManagers in a user's home directory, which is executed when Cocoa applications attempt to notify the user.
CVE-2007-0024	2007-01-09	n/a	Integer overflow in the Vector Markup Language (VML) implementation (vgx.dll) in Microsoft Internet Explorer 5.01, 6, and 7 on Windows 2000 SP4, XP SP2, Server 2003, and Server 2003 SP1 allows remote attackers to execute arbitrary code via a crafted web page that contains unspecified integer properties that cause insufficient memory allocation and trigger a buffer overflow, aka the "VML Buffer Overrun Vulnerability."
CVE-2007-0025	2007-02-13	n/a	The MFC component in Microsoft Windows 2000 SP4, XP SP2, and 2003 SP1 and Visual Studio .NET 2000, 2002 SP1, 2003, and 2003 SP1 allows user-assisted remote attackers to execute arbitrary code via an RTF file with a malformed OLE object that triggers memory corruption. NOTE: this might be due to a stack-based buffer overflow in the AfxOleSetEditMenu function in MFC42u.dll.
CVE-2007-0026	2007-02-13	n/a	The OLE Dialog component in Microsoft Windows 2000 SP4, XP SP2, and 2003 SP1 allows user-assisted remote attackers to execute arbitrary code via an RTF file with a malformed OLE object that triggers memory corruption.
CVE-2007-0027	2007-01-09	n/a	Microsoft Excel 2000 SP3, 2002 SP3, 2003 SP2, 2004 for Mac, and v.X for Mac allows remote attackers to execute arbitrary code via malformed IMDATA records that trigger memory corruption.
CVE-2007-0028	2007-01-09	n/a	Microsoft Excel 2000, 2002, 2003, Viewer 2003, Office 2004 for Mac, and Office v.X for Mac does not properly handle certain opcodes, which allows user-assisted remote attackers to execute arbitrary code via a crafted XLS file, which results in an "Improper Memory Access Vulnerability."  NOTE: an early disclosure of this issue used CVE-2006-3432, but only CVE-2007-0028 should be used.
CVE-2007-0029	2007-01-09	n/a	Microsoft Excel 2000 SP3, 2002 SP3, 2003 SP2, 2004 for Mac, and v.X for Mac allows user-assisted remote attackers to execute arbitrary code via a malformed string, aka "Excel Malformed String Vulnerability."
CVE-2007-0030	2007-01-09	n/a	Microsoft Excel 2000 SP3, 2002 SP3, 2003 SP2, 2004 for Mac, and v.X for Mac allows user-assisted remote attackers to execute arbitrary code via an Excel file with an out-of-range Column field in certain BIFF8 record types, which references arbitrary memory.
CVE-2007-0031	2007-01-09	n/a	Heap-based buffer overflow in Microsoft Excel 2000 SP3, 2002 SP3, 2003 SP2, 2004 for Mac, and v.X for Mac allows user-assisted remote attackers to execute arbitrary code via a BIFF8 spreadsheet with a PALETTE record that contains a large number of entries.
CVE-2007-0033	2007-01-09	n/a	Microsoft Outlook 2002 and 2003 allows user-assisted remote attackers to execute arbitrary code via a malformed VEVENT record in an .iCal meeting request or ICS file.
CVE-2007-0034	2007-01-09	n/a	Buffer overflow in the Advanced Search (Finder.exe) feature of Microsoft Outlook 2000, 2002, and 2003 allows user-assisted remote attackers to execute arbitrary code via a crafted Outlook Saved Searches (OSS) file that triggers memory corruption, aka "Microsoft Outlook Advanced Find Vulnerability."
CVE-2007-0035	2007-05-08	n/a	Word (or Word Viewer) in Microsoft Office 2000 SP3, XP SP3, 2003 SP2, 2004 for Mac, and Works Suite 2004, 2005, and 2006 does not properly handle data in a certain array, which allows user-assisted remote attackers to execute arbitrary code, aka the "Word Array Overflow Vulnerability."
CVE-2007-0038	2007-03-30	n/a	Stack-based buffer overflow in the animated cursor code in Microsoft Windows 2000 SP4 through Vista allows remote attackers to execute arbitrary code or cause a denial of service (persistent reboot) via a large length value in the second (or later) anih block of a RIFF .ANI, cur, or .ico file, which results in memory corruption when processing cursors, animated cursors, and icons, a variant of CVE-2005-0416, as originally demonstrated using Internet Explorer 6 and 7. NOTE: this might be a duplicate of CVE-2007-1765; if so, then CVE-2007-0038 should be preferred.
CVE-2007-0039	2007-05-08	n/a	The Exchange Collaboration Data Objects (EXCDO) functionality in Microsoft Exchange Server 2000 SP3, 2003 SP1 and SP2, and 2007 allows remote attackers to cause a denial of service (crash) via an Internet Calendar (iCal) file containing multiple X-MICROSOFT-CDO-MODPROPS (MODPROPS) properties in which the second MODPROPS is longer than the first, which triggers a NULL pointer dereference and an unhandled exception.
CVE-2007-0040	2007-07-10	n/a	The LDAP service in Windows Active Directory in Microsoft Windows 2000 Server SP4, Server 2003 SP1 and SP2, Server 2003 x64 Edition and SP2, and Server 2003 for Itanium-based Systems SP1 and SP2 allows remote attackers to execute arbitrary code via a crafted LDAP request with an unspecified number of "convertible attributes."
CVE-2007-0041	2007-07-10	n/a	The PE Loader service in Microsoft .NET Framework 1.0, 1.1, and 2.0 for Windows 2000, XP, Server 2003, and Vista allows remote attackers to execute arbitrary code via unspecified vectors involving an "unchecked buffer" and unvalidated message lengths, probably a buffer overflow.
CVE-2007-0042	2007-07-10	n/a	Interpretation conflict in ASP.NET in Microsoft .NET Framework 1.0, 1.1, and 2.0 for Windows 2000, XP, Server 2003, and Vista allows remote attackers to access configuration files and obtain sensitive information, and possibly bypass security mechanisms that try to constrain the final substring of a string, via %00 characters, related to use of %00 as a string terminator within POSIX functions but a data character within .NET strings, aka "Null Byte Termination Vulnerability."
CVE-2007-0043	2007-07-10	n/a	The Just In Time (JIT) Compiler service in Microsoft .NET Framework 1.0, 1.1, and 2.0 for Windows 2000, XP, Server 2003, and Vista allows user-assisted remote attackers to execute arbitrary code via unspecified vectors involving an "unchecked buffer," probably a buffer overflow, aka ".NET JIT Compiler Vulnerability".
CVE-2007-0044	2007-01-03	n/a	Adobe Acrobat Reader Plugin before 8.0.0 for the Firefox, Internet Explorer, and Opera web browsers allows remote attackers to force the browser to make unauthorized requests to other web sites via a URL in the (1) FDF, (2) xml, and (3) xfdf AJAX request parameters, following the # (hash) character, aka "Universal CSRF and session riding."
CVE-2007-0045	2007-01-03	n/a	Multiple cross-site scripting (XSS) vulnerabilities in Adobe Acrobat Reader Plugin before 8.0.0, and possibly the plugin distributed with Adobe Reader 7.x before 7.1.4, 8.x before 8.1.7, and 9.x before 9.2, for Mozilla Firefox, Microsoft Internet Explorer 6 SP1, Google Chrome, Opera 8.5.4 build 770, and Opera 9.10.8679 on Windows allow remote attackers to inject arbitrary JavaScript and conduct other attacks via a .pdf URL with a javascript: or res: URI with (1) FDF, (2) XML, and (3) XFDF AJAX parameters, or (4) an arbitrarily named name=URI anchor identifier, aka "Universal XSS (UXSS)."
CVE-2007-0046	2007-01-03	n/a	Double free vulnerability in the Adobe Acrobat Reader Plugin before 8.0.0, as used in Mozilla Firefox 1.5.0.7, allows remote attackers to execute arbitrary code by causing an error via a javascript: URI call to document.write in the (1) FDF, (2) XML, or (3) XFDF AJAX request parameters.
CVE-2007-0047	2007-01-03	n/a	CRLF injection vulnerability in Adobe Acrobat Reader Plugin before 8.0.0, when used with the Microsoft.XMLHTTP ActiveX object in Internet Explorer, allows remote attackers to inject arbitrary HTTP headers and conduct HTTP response splitting attacks via CRLF sequences in the javascript: URI in the (1) FDF, (2) XML, or (3) XFDF AJAX request parameters.
CVE-2007-0048	2007-01-03	n/a	Adobe Acrobat Reader Plugin before 8.0.0, and possibly the plugin distributed with Adobe Reader 7.x before 7.1.4, 8.x before 8.1.7, and 9.x before 9.2, when used with Internet Explorer, Google Chrome, or Opera, allows remote attackers to cause a denial of service (memory consumption) via a long sequence of # (hash) characters appended to a PDF URL, related to a "cross-site scripting issue."
CVE-2007-0049	2007-01-04	n/a	Geckovich TaskTracker Pro 1.5 and earlier allows remote attackers to add administrative or other accounts via an Add action with a modified GroupID in a direct request to Customize.asp.
CVE-2007-0050	2007-01-04	n/a	** DISPUTED **  PHP remote file inclusion vulnerability in index.php in OpenPinboard 2.0 allows remote attackers to execute arbitrary PHP code via a URL in the language parameter.  NOTE: this issue has been disputed by the developer and a third party, since the variable is set before use. CVE analysis suggests that there is a small time window of risk before the installation is complete.
CVE-2007-0051	2007-01-04	n/a	Format string vulnerability in Apple iPhoto 6.0.5 (316), and other versions before 6.0.6, allows remote user-assisted attackers to execute arbitrary code via a crafted photocast with format string specifiers in the title of an RSS iPhoto feed.
CVE-2007-0052	2007-01-04	n/a	SQL injection vulnerability in haberdetay.asp in Vizayn Haber allows remote attackers to execute arbitrary SQL commands via the id parameter.
CVE-2007-0053	2007-01-04	n/a	SQL injection vulnerability in detail.asp in ASP SiteWare autoDealer 2.0 and earlier allows remote attackers to execute arbitrary SQL commands via the iPro parameter.
CVE-2007-0054	2007-01-04	n/a	Cross-site scripting (XSS) vulnerability in gbrowse.php in Belchior Foundry vCard PRO allows remote attackers to inject arbitrary web script or HTML via the sortby parameter.
CVE-2007-0055	2007-01-04	n/a	Directory traversal vulnerability in formbankcgi.exe/AbfrageForm in Formbankserver 1.9 allows remote attackers to read arbitrary files via directory traversal sequences in the Name parameter.  NOTE: The provenance of this information is unknown; the details are obtained solely from third party information.
CVE-2007-0056	2007-01-04	n/a	Multiple cross-site scripting (XSS) vulnerabilities in AShop Deluxe 4.5 and AShop Administration Panel allow remote attackers to inject arbitrary web script or HTML via the (1) cat parameter to (a) ashop/catalogue.php and (b) ashop/basket.php, the (2) exp parameter to ashop/catalogue.php, the (3) searchstring parameter to (c) ashop/search.php, the (4) checkout and (5) action parameters to (d) ashop/shipping.php, the cat parameter to (f) cart-path/admin/editcatalogue.php, and the (7) resultpage parameter to (g) cart-path/admin/salesadmin.php.
CVE-2007-0057	2007-01-04	n/a	Cisco Clean Access (CCA) 3.6.x through 3.6.4.2 and 4.0.x through 4.0.3.2 does not properly configure or allow modification of a shared secret authentication key, which causes all devices to have the same shared sercet and allows remote attackers to gain unauthorized access.
CVE-2007-0058	2007-01-04	n/a	Cisco Clean Access (CCA) 3.5.x through 3.5.9 and 3.6.x through 3.6.1.1 on the Clean Access Manager (CAM) allows remote attackers to bypass authentication and download arbitrary manual database backups by guessing the snapshot filename using brute force, then making a direct request for the file.
CVE-2007-0059	2007-01-04	n/a	Cross-zone scripting vulnerability in Apple Quicktime 3 to 7.1.3 allows remote user-assisted attackers to execute arbitrary code and list filesystem contents via a QuickTime movie (.MOV) with an HREF Track (HREFTrack) that contains an automatic action tag with a local URI, which is executed in a local zone during preview, as exploited by a MySpace worm.
CVE-2007-0060	2007-07-25	n/a	Stack-based buffer overflow in the Message Queuing Server (Cam.exe) in CA (formerly Computer Associates) Message Queuing (CAM / CAFT) software before 1.11 Build 54_4 on Windows and NetWare, as used in CA Advantage Data Transport, eTrust Admin, certain BrightStor products, certain CleverPath products, and certain Unicenter products, allows remote attackers to execute arbitrary code via a crafted message to TCP port 3104.
CVE-2007-0061	2007-09-21	n/a	The DHCP server in EMC VMware Workstation before 5.5.5 Build 56455 and 6.x before 6.0.1 Build 55017, Player before 1.0.5 Build 56455 and Player 2 before 2.0.1 Build 55017, ACE before 1.0.3 Build 54075 and ACE 2 before 2.0.1 Build 55017, and Server before 1.0.4 Build 56528 allows remote attackers to execute arbitrary code via a malformed packet that triggers "corrupt stack memory."
CVE-2007-0062	2007-09-21	n/a	Integer overflow in the ISC dhcpd 3.0.x before 3.0.7 and 3.1.x before 3.1.1; and the DHCP server in EMC VMware Workstation before 5.5.5 Build 56455 and 6.x before 6.0.1 Build 55017, Player before 1.0.5 Build 56455 and Player 2 before 2.0.1 Build 55017, ACE before 1.0.3 Build 54075 and ACE 2 before 2.0.1 Build 55017, and Server before 1.0.4 Build 56528; allows remote attackers to cause a denial of service (daemon crash) or execute arbitrary code via a malformed DHCP packet with a large dhcp-max-message-size that triggers a stack-based buffer overflow, related to servers configured to send many DHCP options to clients.
CVE-2007-0063	2007-09-21	n/a	Integer underflow in the DHCP server in EMC VMware Workstation before 5.5.5 Build 56455 and 6.x before 6.0.1 Build 55017, Player before 1.0.5 Build 56455 and Player 2 before 2.0.1 Build 55017, ACE before 1.0.3 Build 54075 and ACE 2 before 2.0.1 Build 55017, and Server before 1.0.4 Build 56528 allows remote attackers to execute arbitrary code via a malformed DHCP packet that triggers a stack-based buffer overflow.
CVE-2007-0064	2007-12-11	n/a	Heap-based buffer overflow in Windows Media Format Runtime 7.1, 9, 9.5, 9.5 x64 Edition, 11, and Windows Media Services 9.1 for Microsoft Windows 2000, XP, Server 2003, and Vista allows user-assisted remote attackers to execute arbitrary code via a crafted Advanced Systems Format (ASF) file.
CVE-2007-0065	2008-02-12	n/a	Heap-based buffer overflow in Object Linking and Embedding (OLE) Automation in Microsoft Windows 2000 SP4, XP SP2, Server 2003 SP1 and SP2, Vista, Office 2004 for Mac, and Visual basic 6.0 SP6 allows remote attackers to execute arbitrary code via a crafted script request.
CVE-2007-0066	2008-01-08	n/a	The kernel in Microsoft Windows 2000 SP4, XP SP2, and Server 2003, when ICMP Router Discovery Protocol (RDP) is enabled, allows remote attackers to cause a denial of service via fragmented router advertisement ICMP packets that trigger an out-of-bounds read, aka "Windows Kernel TCP/IP/ICMP Vulnerability."
CVE-2007-0067	2007-06-06	n/a	Unspecified vulnerability in the Lotus Domino Web Server 6.0, 6.5.x before 6.5.6, and 7.0.x before 7.0.3 allows remote attackers to cause a denial of service (daemon crash) via requests for URLs that reference certain files.
CVE-2007-0068	2007-06-06	n/a	IBM Lotus Domino 7.0.x before 7.0.3 does not revalidate the signature on a signed scheduled agent after the agent is modified, which allows remote authenticated users to gain privileges via a modified agent in a server database.
CVE-2007-0069	2008-01-08	n/a	Unspecified vulnerability in the kernel in Microsoft Windows XP SP2, Server 2003, and Vista allows remote attackers to cause a denial of service (CPU consumption) and possibly execute arbitrary code via crafted (1) IGMPv3 and (2) MLDv2 packets that trigger memory corruption, aka "Windows Kernel TCP/IP/IGMPv3 and MLDv2 Vulnerability."
CVE-2007-0071	2008-04-09	n/a	Integer overflow in Adobe Flash Player 9.0.115.0 and earlier, and 8.0.39.0 and earlier, allows remote attackers to execute arbitrary code via a crafted SWF file with a negative Scene Count value, which passes a signed comparison, is used as an offset of a NULL pointer, and triggers a buffer overflow.
CVE-2007-0072	2008-11-17	n/a	Heap-based buffer overflow in an unspecified procedure in Trend Micro ServerProtect 5.7 and 5.58 allows remote attackers to execute arbitrary code via unknown vectors, possibly related to a read operation over RPC.
CVE-2007-0073	2008-11-17	n/a	Heap-based buffer overflow in an unspecified procedure in Trend Micro ServerProtect 5.7 and 5.58 allows remote attackers to execute arbitrary code via unknown vectors, possibly related to a file read operation over RPC.
CVE-2007-0074	2008-11-17	n/a	Heap-based buffer overflow in an unspecified procedure in Trend Micro ServerProtect 5.7 and 5.58 allows remote attackers to execute arbitrary code via unknown vectors, possibly related to a folder read operation over RPC.
CVE-2007-0075	2007-01-05	n/a	AspBB stores sensitive information under the web root with insufficient access control, which allows remote attackers to download a database containing user passwords via a direct request for db/aspbb.mdb.
CVE-2007-0076	2007-01-05	n/a	Openforum stores sensitive information under the web root with insufficient access control, which allows remote attackers to download a database containing user passwords via a direct request for openforum.mdb.
CVE-2007-0077	2007-01-05	n/a	lblog stores sensitive information under the web root with insufficient access control, which allows remote attackers to download a database via a direct request for a certain file in admin/db/newFolder/.
CVE-2007-0078	2007-01-05	n/a	BattleBlog stores sensitive information under the web root with insufficient access control, which allows remote attackers to download a database via a direct request for database/blankmaster.mdb.
CVE-2007-0079	2007-01-05	n/a	rblog stores sensitive information under the web root with insufficient access control, which allows remote attackers to download a database via a direct request for (1) data/admin.mdb or (2) data/rblog.mdb.
