CVE-2022-0011	2022-02-10	PAN-OS : Prisma Access	PAN-OS software provides options to exclude specific websites from URL category enforcement and those websites are blocked or allowed (depending on your rules) regardless of their associated URL category. This is done by creating a custom URL category list or by using an external dynamic list (EDL) in a URL Filtering profile. When the entries in these lists have a hostname pattern that does not end with a forward slash (/) or a hostname pattern that ends with an asterisk (*), any URL that starts with the specified pattern is considered a match. Entries with a caret (^) at the end of a hostname pattern match any top level domain. This may inadvertently allow or block more URLs than intended and allowing more URLs than intended represents a security risk. For example: example.com will match example.com.website.test example.com.* will match example.com.website.test example.com.^ will match example.com.test You should take special care when using such entries in policy rules that allow traffic. Where possible, use the exact list of hostname names ending with a forward slash (/) instead of using wildcards. PAN-OS 10.1 versions earlier than PAN-OS 10.1.3; PAN-OS 10.0 versions earlier than PAN-OS 10.0.8; PAN-OS 9.1 versions earlier than PAN-OS 9.1.12; all PAN-OS 9.0 versions; PAN-OS 8.1 versions earlier than PAN-OS 8.1.21, and Prisma Access 2.2 and 2.1 versions do not allow customers to change this behavior without changing the URL category list or EDL.
CVE-2022-0012	2022-01-12	Cortex XDR Agent	An improper link resolution before file access vulnerability exists in the Palo Alto Networks Cortex XDR agent on Windows platforms that enables a local user to delete arbitrary system files and impact the system integrity or cause a denial of service condition. This issue impacts: Cortex XDR agent 5.0 versions earlier than Cortex XDR agent 5.0.12; Cortex XDR agent 6.1 versions earlier than Cortex XDR agent 6.1.9; Cortex XDR agent 7.2 versions earlier than Cortex XDR agent 7.2.4; Cortex XDR agent 7.3 versions earlier than Cortex XDR agent 7.3.2.
CVE-2022-0013	2022-01-12	Cortex XDR Agent	A file information exposure vulnerability exists in the Palo Alto Networks Cortex XDR agent that enables a local attacker to read the contents of arbitrary files on the system with elevated privileges when generating a support file. This issue impacts: Cortex XDR agent 5.0 versions earlier than Cortex XDR agent 5.0.12; Cortex XDR agent 6.1 versions earlier than Cortex XDR agent 6.1.9; Cortex XDR agent 7.2 versions earlier than Cortex XDR agent 7.2.4; Cortex XDR agent 7.3 versions earlier than Cortex XDR agent 7.3.2.
CVE-2022-0014	2022-01-12	Cortex XDR Agent	An untrusted search path vulnerability exists in the Palo Alto Networks Cortex XDR agent that enables a local attacker with file creation privilege in the Windows root directory (such as C:\) to store a program that can then be unintentionally executed by another local user when that user utilizes a Live Terminal session. This issue impacts: Cortex XDR agent 5.0 versions earlier than Cortex XDR agent 5.0.12; Cortex XDR agent 6.1 versions earlier than Cortex XDR agent 6.1.9; Cortex XDR agent 7.2 versions earlier than Cortex XDR agent 7.2.4; Cortex XDR agent 7.3 versions earlier than Cortex XDR agent 7.3.2.
CVE-2022-0015	2022-01-12	Cortex XDR Agent	A local privilege escalation (PE) vulnerability exists in the Palo Alto Networks Cortex XDR agent that enables an authenticated local user to execute programs with elevated privileges. This issue impacts: Cortex XDR agent 5.0 versions earlier than Cortex XDR agent 5.0.12; Cortex XDR agent 6.1 versions earlier than Cortex XDR agent 6.1.9.
CVE-2022-0016	2022-02-10	GlobalProtect App	An improper handling of exceptional conditions vulnerability exists within the Connect Before Logon feature of the Palo Alto Networks GlobalProtect app that enables a local attacker to escalate to SYSTEM or root privileges when authenticating with Connect Before Logon under certain circumstances. This issue impacts GlobalProtect app 5.2 versions earlier than GlobalProtect app 5.2.9 on Windows and MacOS. This issue does not affect the GlobalProtect app on other platforms.
CVE-2022-0017	2022-02-10	GlobalProtect App	An improper link resolution before file access ('link following') vulnerability exists in the Palo Alto Networks GlobalProtect app on Windows that enables a local attacker to disrupt system processes and potentially execute arbitrary code with SYSTEM privileges under certain circumstances. This issue impacts: GlobalProtect app 5.1 versions earlier than GlobalProtect app 5.1.10 on Windows. GlobalProtect app 5.2 versions earlier than GlobalProtect app 5.2.5 on Windows. This issue does not affect GlobalProtect app on other platforms.
CVE-2022-0018	2022-02-10	GlobalProtect App	An information exposure vulnerability exists in the Palo Alto Networks GlobalProtect app on Windows and MacOS where the credentials of the local user account are sent to the GlobalProtect portal when the Single Sign-On feature is enabled in the GlobalProtect portal configuration. This product behavior is intentional and poses no security risk when connecting to trusted GlobalProtect portals configured to use the same Single Sign-On credentials both for the local user account as well as the GlobalProtect login. However when the credentials are different, the local account credentials are inadvertently sent to the GlobalProtect portal for authentication. A third party MITM type of attacker cannot see these credentials in transit. This vulnerability is a concern where the GlobalProtect app is deployed on Bring-your-Own-Device (BYOD) type of clients with private local user accounts or GlobalProtect app is used to connect to different organizations. Fixed versions of GlobalProtect app have an app setting to prevent the transmission of the user's local user credentials to the target GlobalProtect portal regardless of the portal configuration. This issue impacts: GlobalProtect app 5.1 versions earlier than GlobalProtect app 5.1.10 on Windows and MacOS; GlobalProtect app 5.2 versions earlier than GlobalProtect app 5.2.9 on Windows and MacOS This issue does not affect GlobalProtect app on other platforms.
CVE-2022-0019	2022-02-10	GlobalProtect App	An insufficiently protected credentials vulnerability exists in the Palo Alto Networks GlobalProtect app on Linux that exposes the hashed credentials of GlobalProtect users that saved their password during previous GlobalProtect app sessions to other local users on the system. The exposed credentials enable a local attacker to authenticate to the GlobalProtect portal or gateway as the target user without knowing of the target user’s plaintext password. This issue impacts: GlobalProtect app 5.1 versions earlier than GlobalProtect app 5.1.10 on Linux. GlobalProtect app 5.2 versions earlier than and including GlobalProtect app 5.2.7 on Linux. GlobalProtect app 5.3 versions earlier than GlobalProtect app 5.3.2 on Linux. This issue does not affect the GlobalProtect app on other platforms.
CVE-2022-0020	2022-02-10	Cortex XSOAR	A stored cross-site scripting (XSS) vulnerability in Palo Alto Network Cortex XSOAR web interface enables an authenticated network-based attacker to store a persistent javascript payload that will perform arbitrary actions in the Cortex XSOAR web interface on behalf of authenticated administrators who encounter the payload during normal operations. This issue impacts: All builds of Cortex XSOAR 6.1.0; Cortex XSOAR 6.2.0 builds earlier than build 1958888.
CVE-2022-0021	2022-02-10	GlobalProtect App	An information exposure through log file vulnerability exists in the Palo Alto Networks GlobalProtect app on Windows that logs the cleartext credentials of the connecting GlobalProtect user when authenticating using Connect Before Logon feature. This issue impacts GlobalProtect App 5.2 versions earlier than 5.2.9 on Windows. This issue does not affect the GlobalProtect app on other platforms.
CVE-2022-0079	2022-01-02	star7th/showdoc	showdoc is vulnerable to Generation of Error Message Containing Sensitive Information
CVE-2022-0080	2022-01-02	mruby/mruby	mruby is vulnerable to Heap-based Buffer Overflow
CVE-2022-0083	2022-01-04	livehelperchat/livehelperchat	livehelperchat is vulnerable to Generation of Error Message Containing Sensitive Information
CVE-2022-0086	2022-01-04	transloadit/uppy	uppy is vulnerable to Server-Side Request Forgery (SSRF)
CVE-2022-0087	2022-01-11	keystonejs/keystone	keystone is vulnerable to Improper Neutralization of Input During Web Page Generation ('Cross-site Scripting')
CVE-2022-0090	2022-01-18	GitLab	An issue has been discovered affecting GitLab versions prior to 14.4.5, between 14.5.0 and 14.5.3, and between 14.6.0 and 14.6.1. GitLab is configured in a way that it doesn't ignore replacement references with git sub-commands, allowing a malicious user to spoof the contents of their commits in the UI.
CVE-2022-0093	2022-01-18	GitLab	An issue has been discovered affecting GitLab versions prior to 14.4.5, between 14.5.0 and 14.5.3, and between 14.6.0 and 14.6.1. GitLab allows a user with an expired password to access sensitive information through RSS feeds.
CVE-2022-0096	2022-02-11	Chrome	Use after free in Storage in Google Chrome prior to 97.0.4692.71 allowed a remote attacker to potentially exploit heap corruption via a crafted HTML page.
CVE-2022-0097	2022-02-11	Chrome	Inappropriate implementation in DevTools in Google Chrome prior to 97.0.4692.71 allowed an attacker who convinced a user to install a malicious extension to to potentially allow extension to escape the sandbox via a crafted HTML page.
CVE-2022-0098	2022-02-11	Chrome	Use after free in Screen Capture in Google Chrome on Chrome OS prior to 97.0.4692.71 allowed an attacker who convinced a user to perform specific user gestures to potentially exploit heap corruption via specific user gestures.
CVE-2022-0099	2022-02-11	Chrome	Use after free in Sign-in in Google Chrome prior to 97.0.4692.71 allowed a remote attacker who convinced a user to perform specific user gestures to potentially exploit heap corruption via specific user gesture.
CVE-2022-0100	2022-02-11	Chrome	Heap buffer overflow in Media streams API in Google Chrome prior to 97.0.4692.71 allowed a remote attacker to potentially exploit heap corruption via a crafted HTML page.
CVE-2022-0101	2022-02-11	Chrome	Heap buffer overflow in Bookmarks in Google Chrome prior to 97.0.4692.71 allowed a remote attacker who convinced a user to perform specific user gesture to potentially exploit heap corruption via specific user gesture.
CVE-2022-0102	2022-02-11	Chrome	Type confusion in V8 in Google Chrome prior to 97.0.4692.71 allowed a remote attacker to potentially exploit heap corruption via a crafted HTML page.
CVE-2022-0103	2022-02-11	Chrome	Use after free in SwiftShader in Google Chrome prior to 97.0.4692.71 allowed a remote attacker to potentially exploit heap corruption via a crafted HTML page.
CVE-2022-0104	2022-02-11	Chrome	Heap buffer overflow in ANGLE in Google Chrome prior to 97.0.4692.71 allowed a remote attacker to potentially exploit heap corruption via a crafted HTML page.
CVE-2022-0105	2022-02-11	Chrome	Use after free in PDF Accessibility in Google Chrome prior to 97.0.4692.71 allowed a remote attacker to potentially exploit heap corruption via a crafted HTML page.
CVE-2022-0106	2022-02-11	Chrome	Use after free in Autofill in Google Chrome prior to 97.0.4692.71 allowed a remote attacker who convinced a user to perform specific user gesture to potentially exploit heap corruption via a crafted HTML page.
CVE-2022-0107	2022-02-11	Chrome	Use after free in File Manager API in Google Chrome on Chrome OS prior to 97.0.4692.71 allowed an attacker who convinced a user to install a malicious extension to potentially exploit heap corruption via a crafted HTML page.
CVE-2022-0108	2022-02-11	Chrome	Inappropriate implementation in Navigation in Google Chrome prior to 97.0.4692.71 allowed a remote attacker to leak cross-origin data via a crafted HTML page.
CVE-2022-0109	2022-02-11	Chrome	Inappropriate implementation in Autofill in Google Chrome prior to 97.0.4692.71 allowed a remote attacker to obtain potentially sensitive information via a crafted HTML page.
CVE-2022-0110	2022-02-11	Chrome	Incorrect security UI in Autofill in Google Chrome prior to 97.0.4692.71 allowed a remote attacker to spoof the contents of the Omnibox (URL bar) via a crafted HTML page.
CVE-2022-0111	2022-02-11	Chrome	Inappropriate implementation in Navigation in Google Chrome prior to 97.0.4692.71 allowed a remote attacker to incorrectly set origin via a crafted HTML page.
CVE-2022-0112	2022-02-11	Chrome	Incorrect security UI in Browser UI in Google Chrome prior to 97.0.4692.71 allowed a remote attacker to display missing URL or incorrect URL via a crafted URL.
CVE-2022-0113	2022-02-11	Chrome	Inappropriate implementation in Blink in Google Chrome prior to 97.0.4692.71 allowed a remote attacker to leak cross-origin data via a crafted HTML page.
CVE-2022-0114	2022-02-11	Chrome	Out of bounds memory access in Blink Serial API in Google Chrome prior to 97.0.4692.71 allowed a remote attacker to perform an out of bounds memory read via a crafted HTML page and virtual serial port driver.
CVE-2022-0115	2022-02-11	Chrome	Uninitialized use in File API in Google Chrome prior to 97.0.4692.71 allowed a remote attacker to potentially perform out of bounds memory access via a crafted HTML page.
CVE-2022-0116	2022-02-11	Chrome	Inappropriate implementation in Compositing in Google Chrome prior to 97.0.4692.71 allowed a remote attacker to spoof the contents of the Omnibox (URL bar) via a crafted HTML page.
CVE-2022-0117	2022-02-11	Chrome	Policy bypass in Blink in Google Chrome prior to 97.0.4692.71 allowed a remote attacker to leak cross-origin data via a crafted HTML page.
CVE-2022-0118	2022-02-11	Chrome	Inappropriate implementation in WebShare in Google Chrome prior to 97.0.4692.71 allowed a remote attacker to potentially hide the contents of the Omnibox (URL bar) via a crafted HTML page.
CVE-2022-0120	2022-02-11	Chrome	Inappropriate implementation in Passwords in Google Chrome prior to 97.0.4692.71 allowed a remote attacker to potentially leak cross-origin data via a malicious website.
CVE-2022-0121	2022-01-05	hoppscotch/hoppscotch	hoppscotch is vulnerable to Exposure of Sensitive Information to an Unauthorized Actor
CVE-2022-0122	2022-01-06	digitalbazaar/forge	forge is vulnerable to URL Redirection to Untrusted Site
CVE-2022-0124	2022-01-18	GitLab	An issue has been discovered affecting GitLab versions prior to 14.4.5, between 14.5.0 and 14.5.3, and between 14.6.0 and 14.6.1. Gitlab's Slack integration is incorrectly validating user input and allows to craft malicious URLs that are sent to slack.
CVE-2022-0125	2022-01-18	GitLab	An issue has been discovered in GitLab affecting all versions starting from 12.0 before 14.4.5, all versions starting from 14.5.0 before 14.5.3, all versions starting from 14.6.0 before 14.6.2. GitLab was not verifying that a maintainer of a project had the right access to import members from a target project.
CVE-2022-0128	2022-01-06	vim/vim	vim is vulnerable to Out-of-bounds Read
CVE-2022-0129	2022-01-11	McAfee TechCheck	Uncontrolled search path element vulnerability in McAfee TechCheck prior to 4.0.0.2 allows a local administrator to load their own Dynamic Link Library (DLL) gaining elevation of privileges to system user. This was achieved through placing the malicious DLL in the same directory that the process was run from.
CVE-2022-0130	2022-01-14	Tenable.sc	Tenable.sc versions 5.14.0 through 5.19.1 were found to contain a remote code execution vulnerability which could allow a remote, unauthenticated attacker to execute code under special circumstances. An attacker would first have to stage a specific file type in the web server root of the Tenable.sc host prior to remote exploitation.
CVE-2022-0131	2022-01-17	Jimoty App for Android	Jimoty App for Android versions prior to 3.7.42 uses a hard-coded API key for an external service. By exploiting this vulnerability, API key for an external service may be obtained by analyzing data in the app.
CVE-2022-0132	2022-01-07	chocobozzz/peertube	peertube is vulnerable to Server-Side Request Forgery (SSRF)
CVE-2022-0133	2022-01-07	chocobozzz/peertube	peertube is vulnerable to Improper Access Control
CVE-2022-0139	2022-02-08	radareorg/radare2	Use After Free in GitHub repository radareorg/radare2 prior to 5.6.0.
CVE-2022-0144	2022-01-11	shelljs/shelljs	shelljs is vulnerable to Improper Privilege Management
CVE-2022-0148	2022-02-07	All-in-one Floating Contact Form, Call, Chat, and 50+ Social Icon Tabs  – My Sticky Elements	The All-in-one Floating Contact Form, Call, Chat, and 50+ Social Icon Tabs WordPress plugin before 2.0.4 was vulnerable to reflected XSS on the my-sticky-elements-leads admin page.
CVE-2022-0149	2022-02-07	WooCommerce – Store Exporter	The WooCommerce Stored Exporter WordPress plugin before 2.7.1 was affected by a Reflected Cross-Site Scripting (XSS) vulnerability in the woo_ce admin page.
CVE-2022-0151	2022-01-18	GitLab	An issue has been discovered in GitLab affecting all versions starting from 12.10 before 14.4.5, all versions starting from 14.5.0 before 14.5.3, all versions starting from 14.6.0 before 14.6.2. GitLab was not correctly handling requests to delete existing packages which could result in a Denial of Service under specific conditions.
CVE-2022-0152	2022-01-18	GitLab	An issue has been discovered in GitLab affecting all versions starting from 13.10 before 14.4.5, all versions starting from 14.5.0 before 14.5.3, all versions starting from 14.6.0 before 14.6.2. GitLab was vulnerable to unauthorized access to some particular fields through the GraphQL API.
CVE-2022-0154	2022-01-18	GitLab	An issue has been discovered in GitLab affecting all versions starting from 7.7 before 14.4.5, all versions starting from 14.5.0 before 14.5.3, all versions starting from 14.6.0 before 14.6.2. GitLab was vulnerable to a Cross-Site Request Forgery attack that allows a malicious user to have their GitHub project imported on another GitLab user account.
CVE-2022-0155	2022-01-10	follow-redirects/follow-redirects	follow-redirects is vulnerable to Exposure of Private Personal Information to an Unauthorized Actor
CVE-2022-0156	2022-01-10	vim/vim	vim is vulnerable to Use After Free
CVE-2022-0157	2022-01-10	phoronix-test-suite/phoronix-test-suite	phoronix-test-suite is vulnerable to Improper Neutralization of Input During Web Page Generation ('Cross-site Scripting')
CVE-2022-0158	2022-01-10	vim/vim	vim is vulnerable to Heap-based Buffer Overflow
CVE-2022-0159	2022-01-11	orchardcms/orchardcore	orchardcore is vulnerable to Improper Neutralization of Input During Web Page Generation ('Cross-site Scripting')
CVE-2022-0162	2022-02-09	TL-WR841N	The vulnerability exists in TP-Link TL-WR841N V11 3.16.9 Build 160325 Rel.62500n wireless router due to transmission of authentication information in cleartextbase64 format. Successful exploitation of this vulnerability could allow a remote attacker to intercept credentials and subsequently perform administrative operations on the affected device through web-based management interface.
CVE-2022-0166	2022-01-19	McAfee Agent for Windows	A privilege escalation vulnerability in the McAfee Agent prior to 5.7.5. McAfee Agent uses openssl.cnf during the build process to specify the OPENSSLDIR variable as a subdirectory within the installation directory. A low privilege user could have created subdirectories and executed arbitrary code with SYSTEM privileges by creating the appropriate pathway to the specifically created malicious openssl.cnf file.
CVE-2022-0170	2022-01-11	chocobozzz/peertube	peertube is vulnerable to Improper Access Control
CVE-2022-0172	2022-01-18	GitLab	An issue has been discovered in GitLab CE/EE affecting all versions starting with 12.3. Under certain conditions it was possible to bypass the IP restriction for public projects through GraphQL allowing unauthorised users to read titles of issues, merge requests and milestones.
CVE-2022-0173	2022-01-11	radareorg/radare2	radare2 is vulnerable to Out-of-bounds Read
CVE-2022-0174	2022-01-10	dolibarr/dolibarr	dolibarr is vulnerable to Business Logic Errors
CVE-2022-0176	2022-02-14	PowerPack Lite for Beaver Builder	The PowerPack Lite for Beaver Builder WordPress plugin before 1.2.9.3 does not sanitise and escape the tab parameter before outputting it back in an admin page, leading to a Reflected Cross-Site Scripting
CVE-2022-0178	2022-01-13	snipe/snipe-it	snipe-it is vulnerable to Improper Access Control
CVE-2022-0179	2022-01-12	snipe/snipe-it	snipe-it is vulnerable to Improper Access Control
CVE-2022-0180	2022-01-17	Quiz And Survey Master	Cross-site request forgery (CSRF) vulnerability in Quiz And Survey Master versions prior to 7.3.7 allows a remote attacker to hijack the authentication of administrators and conduct arbitrary operations via a specially crafted web page.
CVE-2022-0181	2022-01-17	Quiz And Survey Master	Reflected cross-site scripting vulnerability in Quiz And Survey Master versions prior to 7.3.7 allows a remote attacker to inject an arbitrary script via unspecified vectors.
CVE-2022-0182	2022-01-17	Quiz And Survey Master	Stored cross-site scripting vulnerability in Quiz And Survey Master versions prior to 7.3.7 allows a remote authenticated attacker to inject an arbitrary script via an website that uses Quiz And Survey Master.
CVE-2022-0183	2022-01-17	MIRUPASS	Missing encryption of sensitive data vulnerability in 'MIRUPASS' PW10 firmware all versions and 'MIRUPASS' PW20 firmware all versions allows an attacker who can physically access the device to obtain the stored passwords.
CVE-2022-0184	2022-01-17	TEPRA PRO	Insufficiently protected credentials vulnerability in 'TEPRA' PRO SR5900P Ver.1.080 and earlier and 'TEPRA' PRO SR-R7900P Ver.1.030 and earlier allows an attacker on the adjacent network to obtain credentials for connecting to the Wi-Fi access point with the infrastructure mode.
CVE-2022-0185	2022-02-11	kernel	A heap-based buffer overflow flaw was found in the way the legacy_parse_param function in the Filesystem Context functionality of the Linux kernel verified the supplied parameters length. An unprivileged (in case of unprivileged user namespaces enabled, otherwise needs namespaced CAP_SYS_ADMIN privilege) local user able to open a filesystem that does not support the Filesystem Context API (and thus fallbacks to legacy handling) could use this flaw to escalate their privileges on the system.
CVE-2022-0188	2022-02-14	CMP – Coming Soon & Maintenance Plugin by NiteoThemes	The CMP WordPress plugin before 4.0.19 allows any user, even not logged in, to arbitrarily change the coming soon page layout.
CVE-2022-0190	2022-02-14	Ad Invalid Click Protector (AICP)	The Ad Invalid Click Protector (AICP) WordPress plugin before 1.2.6 is affected by a SQL Injection in the id parameter of the delete action.
CVE-2022-0193	2022-02-14	Complianz – GDPR/CCPA Cookie Consent	The Complianz WordPress plugin before 6.0.0 does not escape the s parameter before outputting it back in an attribute in an admin page, leading to a Reflected Cross-Site Scripting
CVE-2022-0196	2022-01-12	phoronix-test-suite/phoronix-test-suite	phoronix-test-suite is vulnerable to Cross-Site Request Forgery (CSRF)
CVE-2022-0197	2022-01-12	phoronix-test-suite/phoronix-test-suite	phoronix-test-suite is vulnerable to Cross-Site Request Forgery (CSRF)
CVE-2022-0198	2022-01-13	stanfordnlp/corenlp	corenlp is vulnerable to Improper Restriction of XML External Entity Reference
CVE-2022-0200	2022-02-14	Themify Portfolio Post	Themify Portfolio Post WordPress plugin before 1.1.7 does not sanitise and escape the num_of_pages parameter before outputting it back the response of the themify_create_popup_page_pagination AJAX action (available to any authenticated user), leading to a Reflected Cross-Site Scripting
CVE-2022-0201	2022-02-14	Permalink Manager Lite : Permalink Manager Pro	The Permalink Manager Lite WordPress plugin before 2.2.15 and Permalink Manager Pro WordPress plugin before 2.2.15 do not sanitise and escape query parameters before outputting them back in the debug page, leading to a Reflected Cross-Site Scripting issue
CVE-2022-0203	2022-01-26	crater-invoice/crater	Improper Access Control in GitHub repository crater-invoice/crater prior to 6.0.2.
CVE-2022-0206	2022-02-14	NewStatPress	The NewStatPress WordPress plugin before 1.3.6 does not properly escape the whatX parameters before outputting them back in attributes, leading to Reflected Cross-Site Scripting issues
CVE-2022-0208	2022-02-14	MapPress Maps for WordPress	The MapPress Maps for WordPress plugin before 2.73.4 does not sanitise and escape the mapid parameter before outputting it back in the "Bad mapid" error message, leading to a Reflected Cross-Site Scripting
CVE-2022-0210	2022-01-18	Random Banner	The Random Banner WordPress plugin is vulnerable to Stored Cross-Site Scripting due to insufficient escaping via the category parameter found in the ~/include/models/model.php file which allowed attackers with administrative user access to inject arbitrary web scripts, in versions up to and including 4.1.4. This affects multi-site installations where unfiltered_html is disabled for administrators, and sites where unfiltered_html is disabled.
CVE-2022-0212	2022-02-14	SpiderCalendar	The SpiderCalendar WordPress plugin through 1.5.65 does not sanitise and escape the callback parameter before outputting it back in the page via the window AJAX action (available to both unauthenticated and authenticated users), leading to a Reflected Cross-Site Scripting issue.
CVE-2022-0213	2022-01-14	vim/vim	vim is vulnerable to Heap-based Buffer Overflow
