CVE-2022-23030	2022-01-25	BIG-IP	On version 16.1.x before 16.1.2, 15.1.x before 15.1.4.1, 14.1.x before 14.1.4.5, and all versions of 13.1.x, when the BIG-IP Virtual Edition (VE) uses the ixlv driver (which is used in SR-IOV mode and requires Intel X710/XL710/XXV710 family of network adapters on the Hypervisor) and TCP Segmentation Offload configuration is enabled, undisclosed requests may cause an increase in CPU resource utilization. Note: Software versions which have reached End of Technical Support (EoTS) are not evaluated.
CVE-2022-23031	2022-01-25	BIG-IP FPS, ASM, and Advanced WAF	On BIG-IP FPS, ASM, and Advanced WAF versions 16.1.x before 16.1.1, 15.1.x before 15.1.4, and 14.1.x before 14.1.4.4, an XML External Entity (XXE) vulnerability exists in an undisclosed page of the F5 Advanced Web Application Firewall (Advanced WAF) and BIG-IP ASM Traffic Management User Interface (TMUI), also referred to as the Configuration utility, that allows an authenticated high-privileged attacker to read local files and force BIG-IP to send HTTP requests. Note: Software versions which have reached End of Technical Support (EoTS) are not evaluated.
CVE-2022-23032	2022-01-25	BIG-IP Edge Client for Mac and Windows	In all versions before 7.2.1.4, when proxy settings are configured in the network access resource of a BIG-IP APM system, connecting BIG-IP Edge Client on Mac and Windows is vulnerable to a DNS rebinding attack. Note: Software versions which have reached End of Technical Support (EoTS) are not evaluated.
CVE-2022-23033	2022-01-25	xen	arm: guest_physmap_remove_page not removing the p2m mappings The functions to remove one or more entries from a guest p2m pagetable on Arm (p2m_remove_mapping, guest_physmap_remove_page, and p2m_set_entry with mfn set to INVALID_MFN) do not actually clear the pagetable entry if the entry doesn't have the valid bit set. It is possible to have a valid pagetable entry without the valid bit set when a guest operating system uses set/way cache maintenance instructions. For instance, a guest issuing a set/way cache maintenance instruction, then calling the XENMEM_decrease_reservation hypercall to give back memory pages to Xen, might be able to retain access to those pages even after Xen started reusing them for other purposes.
CVE-2022-23034	2022-01-25	xen	A PV guest could DoS Xen while unmapping a grant To address XSA-380, reference counting was introduced for grant mappings for the case where a PV guest would have the IOMMU enabled. PV guests can request two forms of mappings. When both are in use for any individual mapping, unmapping of such a mapping can be requested in two steps. The reference count for such a mapping would then mistakenly be decremented twice. Underflow of the counters gets detected, resulting in the triggering of a hypervisor bug check.
CVE-2022-23035	2022-01-25	xen	Insufficient cleanup of passed-through device IRQs The management of IRQs associated with physical devices exposed to x86 HVM guests involves an iterative operation in particular when cleaning up after the guest's use of the device. In the case where an interrupt is not quiescent yet at the time this cleanup gets invoked, the cleanup attempt may be scheduled to be retried. When multiple interrupts are involved, this scheduling of a retry may get erroneously skipped. At the same time pointers may get cleared (resulting in a de-reference of NULL) and freed (resulting in a use-after-free), while other code would continue to assume them to be valid.
CVE-2022-23045	2022-01-19	PhpIPAM	PhpIPAM v1.4.4 allows an authenticated admin user to inject persistent JavaScript code inside the "Site title" parameter while updating the site settings. The "Site title" setting is injected in several locations which triggers the XSS.
CVE-2022-23046	2022-01-19	PhpIPAM	PhpIPAM v1.4.4 allows an authenticated admin user to inject SQL sentences in the "subnet" parameter while searching a subnet via app/admin/routing/edit-bgp-mapping-search.php
CVE-2022-23047	2022-02-09	Exponent CMS	Exponent CMS 2.6.0patch2 allows an authenticated admin user to inject persistent JavaScript code inside the "Site/Organization Name","Site Title" and "Site Header" parameters while updating the site settings on "/exponentcms/administration/configure_site"
CVE-2022-23048	2022-02-09	Exponent CMS	Exponent CMS 2.6.0patch2 allows an authenticated admin user to upload a malicious extension in the format of a ZIP file with a PHP file inside it. After upload it, the PHP file will be placed at "themes/simpletheme/{rce}.php" from where can be accessed in order to execute commands.
CVE-2022-23049	2022-02-09	Exponent CMS	Exponent CMS 2.6.0patch2 allows an authenticated user to inject persistent JavaScript code on the "User-Agent" header when logging in. When an administrator user visits the "User Sessions" tab, the JavaScript will be triggered allowing an attacker to compromise the administrator session.
CVE-2022-23083	2022-01-18	NetMaster Network Management for TCP/IP and NetMaster File Transfer Management	NetMaster 12.2 Network Management for TCP/IP and NetMaster File Transfer Management contain a XSS (Cross-Site Scripting) vulnerability in ReportCenter UI due to insufficient input validation that could potentially allow an attacker to execute code on the affected machine.
CVE-2022-23094	2022-01-14	n/a	Libreswan 4.2 through 4.5 allows remote attackers to cause a denial of service (NULL pointer dereference and daemon crash) via a crafted IKEv1 packet because pluto/ikev1.c wrongly expects that a state object exists. This is fixed in 4.6.
CVE-2022-23095	2022-01-15	n/a	Open Design Alliance Drawings SDK before 2022.12.1 mishandles the loading of JPG files. Unchecked input data from a crafted JPG file leads to memory corruption. An attacker can leverage this vulnerability to execute code in the context of the current process.
CVE-2022-23096	2022-01-28	n/a	An issue was discovered in the DNS proxy in Connman through 1.40. The TCP server reply implementation lacks a check for the presence of sufficient Header Data, leading to an out-of-bounds read.
CVE-2022-23097	2022-01-28	n/a	An issue was discovered in the DNS proxy in Connman through 1.40. forward_dns_reply mishandles a strnlen call, leading to an out-of-bounds read.
CVE-2022-23098	2022-01-28	n/a	An issue was discovered in the DNS proxy in Connman through 1.40. The TCP server reply implementation has an infinite loop if no data is received.
CVE-2022-23102	2022-02-09	SINEMA Remote Connect Server	A vulnerability has been identified in SINEMA Remote Connect Server (All versions < V2.0). Affected products contain an open redirect vulnerability. An attacker could trick a valid authenticated user to the device into clicking a malicious link there by leading to phishing attacks.
CVE-2022-23105	2022-01-12	Jenkins Active Directory Plugin	Jenkins Active Directory Plugin 2.25 and earlier does not encrypt the transmission of data between the Jenkins controller and Active Directory servers in most configurations.
CVE-2022-23106	2022-01-12	Jenkins Configuration as Code Plugin	Jenkins Configuration as Code Plugin 1.55 and earlier used a non-constant time comparison function when validating an authentication token allowing attackers to use statistical methods to obtain a valid authentication token.
CVE-2022-23107	2022-01-12	Jenkins Warnings Next Generation Plugin	Jenkins Warnings Next Generation Plugin 9.10.2 and earlier does not restrict the name of a file when configuring custom ID, allowing attackers with Item/Configure permission to write and read specific files with a hard-coded suffix on the Jenkins controller file system.
CVE-2022-23108	2022-01-12	Jenkins Badge Plugin	Jenkins Badge Plugin 1.9 and earlier does not escape the description and does not check for allowed protocols when creating a badge, resulting in a stored cross-site scripting (XSS) vulnerability exploitable by attackers with Item/Configure permission.
CVE-2022-23109	2022-01-12	Jenkins HashiCorp Vault Plugin	Jenkins HashiCorp Vault Plugin 3.7.0 and earlier does not mask Vault credentials in Pipeline build logs or in Pipeline step descriptions when Pipeline: Groovy Plugin 2.85 or later is installed.
CVE-2022-23110	2022-01-12	Jenkins Publish Over SSH Plugin	Jenkins Publish Over SSH Plugin 1.22 and earlier does not escape the SSH server name, resulting in a stored cross-site scripting (XSS) vulnerability exploitable by attackers with Overall/Administer permission.
CVE-2022-23111	2022-01-12	Jenkins Publish Over SSH Plugin	A cross-site request forgery (CSRF) vulnerability in Jenkins Publish Over SSH Plugin 1.22 and earlier allows attackers to connect to an attacker-specified SSH server using attacker-specified credentials.
CVE-2022-23112	2022-01-12	Jenkins Publish Over SSH Plugin	A missing permission check in Jenkins Publish Over SSH Plugin 1.22 and earlier allows attackers with Overall/Read access to connect to an attacker-specified SSH server using attacker-specified credentials.
CVE-2022-23113	2022-01-12	Jenkins Publish Over SSH Plugin	Jenkins Publish Over SSH Plugin 1.22 and earlier performs a validation of the file name specifying whether it is present or not, resulting in a path traversal vulnerability allowing attackers with Item/Configure permission to discover the name of the Jenkins controller files.
CVE-2022-23114	2022-01-12	Jenkins Publish Over SSH Plugin	Jenkins Publish Over SSH Plugin 1.22 and earlier stores password unencrypted in its global configuration file on the Jenkins controller where it can be viewed by users with access to the Jenkins controller file system.
CVE-2022-23115	2022-01-12	Jenkins batch task Plugin	Cross-site request forgery (CSRF) vulnerabilities in Jenkins batch task Plugin 1.19 and earlier allows attackers with Overall/Read access to retrieve logs, build or delete a batch task.
CVE-2022-23116	2022-01-12	Jenkins Conjur Secrets Plugin	Jenkins Conjur Secrets Plugin 1.0.9 and earlier implements functionality that allows attackers able to control agent processes to decrypt secrets stored in Jenkins obtained through another method.
CVE-2022-23117	2022-01-12	Jenkins Conjur Secrets Plugin	Jenkins Conjur Secrets Plugin 1.0.9 and earlier implements functionality that allows attackers able to control agent processes to retrieve all username/password credentials stored on the Jenkins controller.
CVE-2022-23118	2022-01-12	Jenkins Debian Package Builder Plugin	Jenkins Debian Package Builder Plugin 1.6.11 and earlier implements functionality that allows agents to invoke command-line `git` at an attacker-specified path on the controller, allowing attackers able to control agent processes to invoke arbitrary OS commands on the controller.
CVE-2022-23119	2022-01-20	Trend Micro Deep Security Agent for Linux	A directory traversal vulnerability in Trend Micro Deep Security and Cloud One - Workload Security Agent for Linux version 20 and below could allow an attacker to read arbitrary files from the file system. Please note: an attacker must first obtain compromised access to the target Deep Security Manager (DSM) or the target agent must be not yet activated or configured in order to exploit this vulnerability.
CVE-2022-23120	2022-01-20	Trend Micro Deep Security Agent for Linux	A code injection vulnerability in Trend Micro Deep Security and Cloud One - Workload Security Agent for Linux version 20 and below could allow an attacker to escalate privileges and run arbitrary code in the context of root. Please note: an attacker must first obtain access to the target agent in an un-activated and unconfigured state in order to exploit this vulnerability.
CVE-2022-23126	2022-01-24	n/a	TeslaMate before 1.25.1 (when using the default Docker configuration) allows attackers to open doors of Tesla vehicles, start Keyless Driving, and interfere with vehicle operation en route. This occurs because an attacker can leverage Grafana login access to obtain a token for Tesla API calls.
CVE-2022-23127	2022-01-21	Mitsubishi Electric MC Works64; ICONICS MobileHMI	Cross-site Scripting vulnerability in Mitsubishi Electric MC Works64 versions 4.04E (10.95.210.01) and prior and ICONICS MobileHMI versions 10.96.2 and prior allows a remote unauthenticated attacker to gain authentication information of an MC Works64 or MobileHMI and perform any operation using the acquired authentication information, by injecting a malicious script in the URL of a monitoring screen delivered from the MC Works64 server or MobileHMI server to an application for mobile devices and leading a legitimate user to access this URL.
CVE-2022-23128	2022-01-21	Mitsubishi Electric MC Works64; ICONICS GENESIS64; ICONICS Hyper Historian; ICONICS AnalytiX; ICONICS MobileHMI	Incomplete List of Disallowed Inputs vulnerability in Mitsubishi Electric MC Works64 versions 4.00A (10.95.201.23) to 4.04E (10.95.210.01), ICONICS GENESIS64 versions 10.95.3 to 10.97, ICONICS Hyper Historian versions 10.95.3 to 10.97, ICONICS AnalytiX versions 10.95.3 to 10.97 and ICONICS MobileHMI versions 10.95.3 to 10.97 allows a remote unauthenticated attacker to bypass the authentication of MC Works64, GENESIS64, Hyper Historian, AnalytiX and MobileHMI, and gain unauthorized access to the products, by sending specially crafted WebSocket packets to FrameWorX server, one of the functions of the products.
CVE-2022-23129	2022-01-21	Mitsubishi Electric MC Works64; ICONICS GENESIS64	Plaintext Storage of a Password vulnerability in Mitsubishi Electric MC Works64 versions 4.04E (10.95.210.01) and prior and ICONICS GENESIS64 versions 10.90 to 10.97 allows a local authenticated attacker to gain authentication information and to access the database illegally. This is because when configuration information of GridWorX, a database linkage function of GENESIS64 and MC Works64, is exported to a CSV file, the authentication information is saved in plaintext, and an attacker who can access this CSV file can gain the authentication information.
CVE-2022-23130	2022-01-21	Mitsubishi Electric MC Works64; ICONICS GENESIS64; ICONICS Hyper Historian	Buffer Over-read vulnerability in Mitsubishi Electric MC Works64 versions 4.00A (10.95.201.23) to 4.04E (10.95.210.01), ICONICS GENESIS64 versions 10.97 and prior and ICONICS Hyper Historian versions 10.97 and prior allows an attacker to cause a DoS condition in the database server by getting a legitimate user to import a configuration file containing specially crafted stored procedures into GENESIS64 or MC Works64 and execute commands against the database from GENESIS64 or MC Works64.
CVE-2022-23131	2022-01-13	Frontend	In the case of instances where the SAML SSO authentication is enabled (non-default), session data can be modified by a malicious actor, because a user login stored in the session was not verified. Malicious unauthenticated actor may exploit this issue to escalate privileges and gain admin access to Zabbix Frontend. To perform the attack, SAML authentication is required to be enabled and the actor has to know the username of Zabbix user (or use the guest account, which is disabled by default).
CVE-2022-23132	2022-01-13	Proxy, Server	During Zabbix installation from RPM, DAC_OVERRIDE SELinux capability is in use to access PID files in [/var/run/zabbix] folder. In this case, Zabbix Proxy or Server processes can bypass file read, write and execute permissions check on the file system level
CVE-2022-23133	2022-01-13	Frontend	An authenticated user can create a hosts group from the configuration with XSS payload, which will be available for other users. When XSS is stored by an authenticated malicious actor and other users try to search for groups during new host creation, the XSS payload will fire and the actor can steal session cookies and perform session hijacking to impersonate users or take over their accounts.
CVE-2022-23134	2022-01-13	Frontend	After the initial setup process, some steps of setup.php file are reachable not only by super-administrators, but by unauthenticated users as well. Malicious actor can pass step checks and potentially change the configuration of Zabbix Frontend.
CVE-2022-23178	2022-01-15	n/a	An issue was discovered on Crestron HD-MD4X2-4K-E 1.0.0.2159 devices. When the administrative web interface of the HDMI switcher is accessed unauthenticated, user credentials are disclosed that are valid to authenticate to the web interface. Specifically, aj.html sends a JSON document with uname and upassword fields.
CVE-2022-23181	2022-01-27	Apache Tomcat	The fix for bug CVE-2020-9484 introduced a time of check, time of use vulnerability into Apache Tomcat 10.1.0-M1 to 10.1.0-M8, 10.0.0-M5 to 10.0.14, 9.0.35 to 9.0.56 and 8.5.55 to 8.5.73 that allowed a local attacker to perform actions with the privileges of the user that the Tomcat process is using. This issue is only exploitable when Tomcat is configured to persist sessions using the FileStore.
CVE-2022-23184	2022-02-06	Octopus Server	In affected Octopus Server versions when the server HTTP and HTTPS bindings are configured to localhost, Octopus Server will allow open redirects.
CVE-2022-23186	2022-02-16	Illustrator	Adobe Illustrator versions 25.4.3 (and earlier) and 26.0.2 (and earlier) are affected by an out-of-bounds write vulnerability that could result in arbitrary code execution in the context of the current user. Exploitation of this issue requires user interaction in that a victim must open a malicious file.
CVE-2022-23188	2022-02-16	Illustrator	Adobe Illustrator versions 25.4.3 (and earlier) and 26.0.2 (and earlier) are affected by a buffer overflow vulnerability due to insecure handling of a crafted malicious file, potentially resulting in arbitrary code execution in the context of the current user. Exploitation requires user interaction in that a victim must open a crafted malicious file in Illustrator.
CVE-2022-23189	2022-02-16	Illustrator	Adobe Illustrator versions 25.4.3 (and earlier) and 26.0.2 (and earlier) are affected by a Null pointer dereference vulnerability. An unauthenticated attacker could leverage this vulnerability to achieve an application denial-of-service in the context of the current user. Exploitation of this issue requires user interaction in that a victim must open a malicious file.
CVE-2022-23190	2022-02-16	Illustrator	Adobe Illustrator versions 25.4.3 (and earlier) and 26.0.2 (and earlier) are affected by an out-of-bounds read vulnerability that could lead to disclosure of sensitive memory. An attacker could leverage this vulnerability to bypass mitigations such as ASLR. Exploitation of this issue requires user interaction in that a victim must open a malicious file.
CVE-2022-23191	2022-02-16	Illustrator	Adobe Illustrator versions 25.4.3 (and earlier) and 26.0.2 (and earlier) are affected by an out-of-bounds read vulnerability that could lead to disclosure of sensitive memory. An attacker could leverage this vulnerability to bypass mitigations such as ASLR. Exploitation of this issue requires user interaction in that a victim must open a malicious file.
CVE-2022-23192	2022-02-16	Illustrator	Adobe Illustrator versions 25.4.3 (and earlier) and 26.0.2 (and earlier) are affected by an out-of-bounds read vulnerability that could lead to disclosure of sensitive memory. An attacker could leverage this vulnerability to bypass mitigations such as ASLR. Exploitation of this issue requires user interaction in that a victim must open a malicious file.
CVE-2022-23193	2022-02-16	Illustrator	Adobe Illustrator versions 25.4.3 (and earlier) and 26.0.2 (and earlier) are affected by an out-of-bounds read vulnerability that could lead to disclosure of sensitive memory. An attacker could leverage this vulnerability to bypass mitigations such as ASLR. Exploitation of this issue requires user interaction in that a victim must open a malicious file.
CVE-2022-23194	2022-02-16	Illustrator	Adobe Illustrator versions 25.4.3 (and earlier) and 26.0.2 (and earlier) are affected by an out-of-bounds read vulnerability that could lead to disclosure of sensitive memory. An attacker could leverage this vulnerability to bypass mitigations such as ASLR. Exploitation of this issue requires user interaction in that a victim must open a malicious file.
CVE-2022-23195	2022-02-16	Illustrator	Adobe Illustrator versions 25.4.3 (and earlier) and 26.0.2 (and earlier) are affected by an out-of-bounds read vulnerability that could lead to disclosure of sensitive memory. An attacker could leverage this vulnerability to bypass mitigations such as ASLR. Exploitation of this issue requires user interaction in that a victim must open a malicious file.
CVE-2022-23196	2022-02-16	Illustrator	Adobe Illustrator versions 25.4.3 (and earlier) and 26.0.2 (and earlier) are affected by an out-of-bounds read vulnerability that could lead to disclosure of sensitive memory. An attacker could leverage this vulnerability to bypass mitigations such as ASLR. Exploitation of this issue requires user interaction in that a victim must open a malicious file.
CVE-2022-23197	2022-02-16	Illustrator	Adobe Illustrator versions 25.4.3 (and earlier) and 26.0.2 (and earlier) are affected by an out-of-bounds read vulnerability that could lead to disclosure of sensitive memory. An attacker could leverage this vulnerability to bypass mitigations such as ASLR. Exploitation of this issue requires user interaction in that a victim must open a malicious file.
CVE-2022-23198	2022-02-16	Illustrator	Adobe Illustrator versions 25.4.3 (and earlier) and 26.0.2 (and earlier) are affected by a Null pointer dereference vulnerability. An unauthenticated attacker could leverage this vulnerability to achieve an application denial-of-service in the context of the current user. Exploitation of this issue requires user interaction in that a victim must open a malicious file.
CVE-2022-23199	2022-02-16	Illustrator	Adobe Illustrator versions 25.4.3 (and earlier) and 26.0.2 (and earlier) are affected by a Null pointer dereference vulnerability. An unauthenticated attacker could leverage this vulnerability to achieve an application denial-of-service in the context of the current user. Exploitation of this issue requires user interaction in that a victim must open a malicious file.
CVE-2022-23200	2022-02-16	After Effects	Adobe After Effects versions 22.1.1 (and earlier) and 18.4.3 (and earlier) are affected by an out-of-bounds write vulnerability that could result in arbitrary code execution in the context of the current user. Exploitation of this issue requires user interaction in that a victim must open a malicious file.
CVE-2022-23202	2022-02-16	Creative Cloud (desktop component)	Adobe Creative Cloud Desktop version 2.7.0.13 (and earlier) is affected by an Uncontrolled Search Path Element vulnerability that could result in arbitrary code execution in the context of the current user. Exploitation of this issue requires user interaction in that a victim must download a malicious DLL file. The attacker has to deliver the DLL on the same folder as the installer which makes it as a high complexity attack vector.
CVE-2022-23203	2022-02-16	Photoshop	Adobe Photoshop versions 22.5.4 (and earlier) and 23.1 (and earlier) are affected by a buffer overflow vulnerability due to insecure handling of a crafted file, potentially resulting in arbitrary code execution in the context of the current user. Exploitation requires user interaction in that a victim must open a crafted file in Photoshop.
CVE-2022-23204	2022-02-16	Premiere Rush	Adobe Premiere Rush versions 2.0 and earlier are affected by an out-of-bounds read vulnerability that could lead to disclosure of sensitive memory. An attacker could leverage this vulnerability to bypass mitigations such as ASLR. Exploitation of this issue requires user interaction in that a victim must open a malicious file.
CVE-2022-23206	2022-02-06	Apache Traffic Control	In Apache Traffic Control Traffic Ops prior to 6.1.0 or 5.1.6, an unprivileged user who can reach Traffic Ops over HTTPS can send a specially-crafted POST request to /user/login/oauth to scan a port of a server that Traffic Ops can reach.
CVE-2022-23218	2022-01-14	n/a	The deprecated compatibility function svcunix_create in the sunrpc module of the GNU C Library (aka glibc) through 2.34 copies its path argument on the stack without validating its length, which may result in a buffer overflow, potentially resulting in a denial of service or (if an application is not built with a stack protector enabled) arbitrary code execution.
CVE-2022-23219	2022-01-14	n/a	The deprecated compatibility function clnt_create in the sunrpc module of the GNU C Library (aka glibc) through 2.34 copies its hostname argument on the stack without validating its length, which may result in a buffer overflow, potentially resulting in a denial of service or (if an application is not built with a stack protector enabled) arbitrary code execution.
CVE-2022-23220	2022-01-21	n/a	USBView 2.1 before 2.2 allows some local users (e.g., ones logged in via SSH) to execute arbitrary code as root because certain Polkit settings (e.g., allow_any=yes) for pkexec disable the authentication requirement. Code execution can, for example, use the --gtk-module option. This affects Ubuntu, Debian, and Gentoo.
CVE-2022-23221	2022-01-19	n/a	H2 Console before 2.1.210 allows remote attackers to execute arbitrary code via a jdbc:h2:mem JDBC URL containing the IGNORE_UNKNOWN_SETTINGS=TRUE;FORBID_CREATION=FALSE;INIT=RUNSCRIPT substring, a different vulnerability than CVE-2021-42392.
CVE-2022-23222	2022-01-14	n/a	kernel/bpf/verifier.c in the Linux kernel through 5.15.14 allows local users to gain privileges because of the availability of pointer arithmetic via certain *_OR_NULL pointer types.
CVE-2022-23223	2022-01-25	Apache ShenYu (incubating) 	The HTTP response will disclose the user password. This issue affected Apache ShenYu 2.4.0 and 2.4.1.
