CVE-2023-0012	2023-01-09	Host Agent (Windows)	In SAP Host Agent (Windows) - versions 7.21, 7.22, an attacker who gains local membership to SAP_LocalAdmin could be able to replace executables with a malicious file that will be started under a privileged account. Note that by default all user members of SAP_LocaAdmin are denied the ability to logon locally by security policy so that this can only occur if the system has already been compromised.
CVE-2023-0013	2023-01-09	NetWeaver AS for ABAP and ABAP Platform	The ABAP Keyword Documentation of SAP NetWeaver Application Server - versions 702, 731, 740, 750, 751, 752, 753, 754, 755, 756, 757, for ABAP and ABAP Platform does not sufficiently encode user-controlled inputs, resulting in Cross-Site Scripting (XSS) vulnerability. On successful exploitation an attacker can cause limited impact on confidentiality and integrity of the application.
CVE-2023-0014	2023-01-09	NetWeaver ABAP Server and ABAP Platform	SAP NetWeaver ABAP Server and ABAP Platform - versions SAP_BASIS 700, 701, 702, 710, 711, 730, 731, 740, 750, 751, 752, 753, 754, 755, 756, 757, KERNEL 7.22, 7.53, 7.77, 7.81, 7.85, 7.89, KRNL64UC 7.22, 7.22EXT, 7.53, KRNL64NUC 7.22, 7.22EXT, creates information about system identity in an ambiguous format. This could lead to capture-replay vulnerability and may be exploited by malicious users to obtain illegitimate access to the system.
CVE-2023-0015	2023-01-09	SAP BusinessObjects Business Intelligence Platform	In SAP BusinessObjects Business Intelligence Platform (Web Intelligence user interface) - version 420, some calls return json with wrong content type in the header of the response. As a result, a custom application that calls directly the jsp of Web Intelligence DHTML may be vulnerable to XSS attacks. On successful exploitation an attacker can cause limited impact on confidentiality and integrity of the application.
CVE-2023-0016	2023-01-09	SAP BPC MS 10.0	SAP BPC MS 10.0 - version 810, allows an unauthorized attacker to execute crafted database queries. The exploitation of this issue could lead to SQL injection vulnerability and could allow an attacker to access, modify, and/or delete data from the backend database.
CVE-2023-0017	2023-01-09	NetWeaver AS for Java	An unauthenticated attacker in SAP NetWeaver AS for Java - version 7.50, due to improper access control, can attach to an open interface and make use of an open naming and directory API to access services which can be used to perform unauthorized operations affecting users and data on the current system. This could allow the attacker to have full read access to user data, make modifications to user data, and make services within the system unavailable.
CVE-2023-0018	2023-01-09	BusinessObjects Business Intelligence Platform (Central management console)	Due to improper input sanitization of user-controlled input in SAP BusinessObjects Business Intelligence Platform CMC application - versions 420, and 430, an attacker with basic user-level privileges can modify/upload crystal reports containing a malicious payload. Once these reports are viewable, anyone who opens those reports would be susceptible to stored XSS attacks. As a result of the attack, information maintained in the victim's web browser can be read, modified, and sent to the attacker.
CVE-2023-0022	2023-01-09	BusinessObjects Business Intelligence platform (Analysis edition for OLAP)	SAP BusinessObjects Business Intelligence Analysis edition for OLAP allows an authenticated attacker to inject malicious code that can be executed by the application over the network. On successful exploitation, an attacker can perform operations that may completely compromise the application causing a high impact on the confidentiality, integrity, and availability of the application.
CVE-2023-0023	2023-01-09	Bank Account Management (Manage Banks)	In SAP Bank Account Management (Manage Banks) application, when a user clicks a smart link to navigate to another app, personal data is shown directly in the URL. They might get captured in log files, bookmarks, and so on disclosing sensitive data of the application.
CVE-2023-0028	2022-12-31	linagora/twake	Cross-site Scripting (XSS) - Stored in GitHub repository linagora/twake prior to 2023.Q1.1200+.
CVE-2023-0029	2023-01-01	RE708	A vulnerability was found in Multilaser RE708 RE1200R4GC-2T2R-V3_v3411b_MUL029B. It has been rated as problematic. This issue affects some unknown processing of the component Telnet Service. The manipulation leads to denial of service. The attack may be initiated remotely. The identifier VDB-217169 was assigned to this vulnerability.
CVE-2023-0029	2023-01-01	RE708	Eine Schwachstelle wurde in Multilaser RE708 RE1200R4GC-2T2R-V3_v3411b_MUL029B ausgemacht. Sie wurde als problematisch eingestuft. Hierbei geht es um eine nicht exakt ausgemachte Funktion der Komponente Telnet Service. Durch das Manipulieren mit unbekannten Daten kann eine denial of service-Schwachstelle ausgenutzt werden. Umgesetzt werden kann der Angriff über das Netzwerk.
CVE-2023-0035	2023-01-08	OpenHarmony	softbus_client_stub in communication subsystem within OpenHarmony-v3.0.5 and prior versions has an authentication bypass vulnerability which allows an "SA relay attack".Local attackers can bypass authentication and attack other SAs with high privilege.
CVE-2023-0036	2023-01-08	OpenHarmony	platform_callback_stub in misc subsystem within OpenHarmony-v3.0.5 and prior versions has an authentication bypass vulnerability which allows an "SA relay attack".Local attackers can bypass authentication and attack other SAs with high privilege.
CVE-2023-0038	2023-01-03	Survey Maker – Best WordPress Survey Plugin	The "Survey Maker – Best WordPress Survey Plugin" plugin for WordPress is vulnerable to Stored Cross-Site Scripting via survey answers in versions up to, and including, 3.1.3 due to insufficient input sanitization and output escaping. This makes it possible for unauthenticated attackers to inject arbitrary web scripts when submitting quizzes that will execute whenever a user accesses the submissions page.
CVE-2023-0039	2023-01-03	User Post Gallery – UPG	The User Post Gallery - UPG plugin for WordPress is vulnerable to authorization bypass which leads to remote command execution due to the use of a nopriv AJAX action and user supplied function calls and parameters in versions up to, and including 2.19. This makes it possible for unauthenticated attackers to call arbitrary PHP functions and perform actions like adding new files that can be webshells and updating the site's options to allow anyone to register as an administrator.
CVE-2023-0042	2023-01-11	GitLab	An issue has been discovered in GitLab CE/EE affecting all versions starting from 11.4 prior to 15.5.7, 15.6 prior to 15.6.4, and 15.7 prior to 15.7.2. GitLab Pages allows redirection to arbitrary protocols.
CVE-2023-0046	2023-01-04	lirantal/daloradius	Improper Restriction of Names for Files and Other Resources in GitHub repository lirantal/daloradius prior to master-branch.
CVE-2023-0048	2023-01-04	lirantal/daloradius	Code Injection in GitHub repository lirantal/daloradius prior to master-branch.
CVE-2023-0049	2023-01-04	vim/vim	Out-of-bounds Read in GitHub repository vim/vim prior to 9.0.1143.
CVE-2023-0051	2023-01-04	vim/vim	Heap-based Buffer Overflow in GitHub repository vim/vim prior to 9.0.1144.
CVE-2023-0054	2023-01-04	vim/vim	Out-of-bounds Write in GitHub repository vim/vim prior to 9.0.1145.
CVE-2023-0055	2023-01-04	pyload/pyload	Sensitive Cookie in HTTPS Session Without 'Secure' Attribute in GitHub repository pyload/pyload prior to 0.5.0b3.dev32.
CVE-2023-0057	2023-01-04	pyload/pyload	Improper Restriction of Rendered UI Layers or Frames in GitHub repository pyload/pyload prior to 0.5.0b3.dev33.
CVE-2023-0077	2023-01-05	Synology Router Manager (SRM)	Integer overflow or wraparound vulnerability in CGI component in Synology Router Manager (SRM) before 1.2.5-8227-6 and 1.3.1-9346-3 allows remote attackers to overflow buffers via unspecified vectors.
CVE-2023-0086	2023-01-05	JetWidgets For Elementor	The JetWidgets for Elementor plugin for WordPress is vulnerable to Cross-Site Request Forgery in versions up to, and including, 1.0.12. This is due to missing nonce validation on the save() function. This makes it possible for unauthenticated attackers to to modify the plugin's settings via a forged request granted they can trick a site administrator into performing an action such as clicking on a link. This can be used to enable SVG uploads that could make Cross-Site Scripting possible.
CVE-2023-0087	2023-01-05	Swifty Page Manager	The Swifty Page Manager plugin for WordPress is vulnerable to Stored Cross-Site Scripting via the ‘spm_plugin_options_page_tree_max_width’ parameter in versions up to, and including, 3.0.1 due to insufficient input sanitization and output escaping. This makes it possible for authenticated attackers, with administrator-level permissions and above, to inject arbitrary web scripts in pages that will execute whenever a user accesses an injected page. This only affects multi-site installations and installations where unfiltered_html has been disabled.
CVE-2023-0088	2023-01-05	Swifty Page Manager	The Swifty Page Manager plugin for WordPress is vulnerable to Cross-Site Request Forgery in versions up to, and including, 3.0.1. This is due to missing or incorrect nonce validation on several AJAX actions handling page creation and deletion among other things. This makes it possible for unauthenticated attackers to invoke those functions, via forged request granted they can trick a site administrator into performing an action such as clicking on a link.
CVE-2023-0106	2023-01-06	usememos/memos	Cross-site Scripting (XSS) - Stored in GitHub repository usememos/memos prior to 0.10.0.
CVE-2023-0107	2023-01-06	usememos/memos	Cross-site Scripting (XSS) - Stored in GitHub repository usememos/memos prior to 0.10.0.
CVE-2023-0108	2023-01-06	usememos/memos	Cross-site Scripting (XSS) - Stored in GitHub repository usememos/memos prior to 0.10.0.
CVE-2023-0110	2023-01-06	usememos/memos	Cross-site Scripting (XSS) - Stored in GitHub repository usememos/memos prior to 0.10.0.
CVE-2023-0111	2023-01-06	usememos/memos	Cross-site Scripting (XSS) - Stored in GitHub repository usememos/memos prior to 0.10.0.
CVE-2023-0112	2023-01-06	usememos/memos	Cross-site Scripting (XSS) - Stored in GitHub repository usememos/memos prior to 0.10.0.
CVE-2023-0113	2023-01-07	Netcore Router	A vulnerability was found in Netis Netcore Router. It has been declared as problematic. Affected by this vulnerability is an unknown functionality of the file param.file.tgz of the component Backup Handler. The manipulation leads to information disclosure. The attack can be launched remotely. The associated identifier of this vulnerability is VDB-217591.
CVE-2023-0113	2023-01-07	Netcore Router	In Netis Netcore Router wurde eine problematische Schwachstelle ausgemacht. Das betrifft eine unbekannte Funktionalität der Datei param.file.tgz der Komponente Backup Handler. Dank der Manipulation mit unbekannten Daten kann eine information disclosure-Schwachstelle ausgenutzt werden. Der Angriff kann über das Netzwerk angegangen werden.
CVE-2023-0114	2023-01-07	Netcore Router	A vulnerability was found in Netis Netcore Router. It has been rated as problematic. Affected by this issue is some unknown functionality of the file param.file.tgz of the component Backup Handler. The manipulation leads to cleartext storage in a file or on disk. Local access is required to approach this attack. The identifier of this vulnerability is VDB-217592.
CVE-2023-0114	2023-01-07	Netcore Router	Eine problematische Schwachstelle wurde in Netis Netcore Router ausgemacht. Dies betrifft einen unbekannten Teil der Datei param.file.tgz der Komponente Backup Handler. Dank Manipulation mit unbekannten Daten kann eine cleartext storage in a file or on disk-Schwachstelle ausgenutzt werden. Der Angriff muss lokal passieren.
CVE-2023-0125	2023-01-09	Panel	A vulnerability was found in Control iD Panel. It has been declared as problematic. Affected by this vulnerability is an unknown functionality of the component Web Interface. The manipulation of the argument Nome leads to cross site scripting. The attack can be launched remotely. The exploit has been disclosed to the public and may be used. The identifier VDB-217717 was assigned to this vulnerability.
CVE-2023-0125	2023-01-09	Panel	In Control iD Panel wurde eine problematische Schwachstelle ausgemacht. Betroffen ist eine unbekannte Verarbeitung der Komponente Web Interface. Mittels dem Manipulieren des Arguments Nome mit unbekannten Daten kann eine cross site scripting-Schwachstelle ausgenutzt werden. Der Angriff kann über das Netzwerk passieren. Der Exploit steht zur öffentlichen Verfügung.
CVE-2023-0128	2023-01-10	Chrome	Use after free in Overview Mode in Google Chrome on Chrome OS prior to 109.0.5414.74 allowed a remote attacker who convinced a user to engage in specific UI interactions to potentially exploit heap corruption via a crafted HTML page. (Chromium security severity: High)
CVE-2023-0129	2023-01-10	Chrome	Heap buffer overflow in Network Service in Google Chrome prior to 109.0.5414.74 allowed an attacker who convinced a user to install a malicious extension to potentially exploit heap corruption via a crafted HTML page and specific interactions. (Chromium security severity: High)
CVE-2023-0130	2023-01-10	Chrome	Inappropriate implementation in in Fullscreen API in Google Chrome on Android prior to 109.0.5414.74 allowed a remote attacker to spoof the contents of the Omnibox (URL bar) via a crafted HTML page. (Chromium security severity: Medium)
CVE-2023-0131	2023-01-10	Chrome	Inappropriate implementation in in iframe Sandbox in Google Chrome prior to 109.0.5414.74 allowed a remote attacker to bypass file download restrictions via a crafted HTML page. (Chromium security severity: Medium)
CVE-2023-0132	2023-01-10	Chrome	Inappropriate implementation in in Permission prompts in Google Chrome on Windows prior to 109.0.5414.74 allowed a remote attacker to force acceptance of a permission prompt via a crafted HTML page. (Chromium security severity: Medium)
CVE-2023-0133	2023-01-10	Chrome	Inappropriate implementation in in Permission prompts in Google Chrome on Android prior to 109.0.5414.74 allowed a remote attacker to bypass main origin permission delegation via a crafted HTML page. (Chromium security severity: Medium)
CVE-2023-0134	2023-01-10	Chrome	Use after free in Cart in Google Chrome prior to 109.0.5414.74 allowed an attacker who convinced a user to install a malicious extension to potentially exploit heap corruption via database corruption and a crafted HTML page. (Chromium security severity: Medium)
CVE-2023-0135	2023-01-10	Chrome	Use after free in Cart in Google Chrome prior to 109.0.5414.74 allowed an attacker who convinced a user to install a malicious extension to potentially exploit heap corruption via database corruption and a crafted HTML page. (Chromium security severity: Medium)
CVE-2023-0136	2023-01-10	Chrome	Inappropriate implementation in in Fullscreen API in Google Chrome on Android prior to 109.0.5414.74 allowed a remote attacker to execute incorrect security UI via a crafted HTML page. (Chromium security severity: Medium)
CVE-2023-0137	2023-01-10	Chrome	Heap buffer overflow in Platform Apps in Google Chrome on Chrome OS prior to 109.0.5414.74 allowed an attacker who convinced a user to install a malicious extension to potentially exploit heap corruption via a crafted HTML page. (Chromium security severity: Medium)
CVE-2023-0138	2023-01-10	Chrome	Heap buffer overflow in libphonenumber in Google Chrome prior to 109.0.5414.74 allowed a remote attacker to potentially exploit heap corruption via a crafted HTML page. (Chromium security severity: Low)
CVE-2023-0139	2023-01-10	Chrome	Insufficient validation of untrusted input in Downloads in Google Chrome on Windows prior to 109.0.5414.74 allowed a remote attacker to bypass download restrictions via a crafted HTML page. (Chromium security severity: Low)
CVE-2023-0140	2023-01-10	Chrome	Inappropriate implementation in in File System API in Google Chrome on Windows prior to 109.0.5414.74 allowed a remote attacker to bypass file system restrictions via a crafted HTML page. (Chromium security severity: Low)
CVE-2023-0141	2023-01-10	Chrome	Insufficient policy enforcement in CORS in Google Chrome prior to 109.0.5414.74 allowed a remote attacker to leak cross-origin data via a crafted HTML page. (Chromium security severity: Low)
CVE-2023-0162	2023-01-10	CPO Companion	The CPO Companion plugin for WordPress is vulnerable to Stored Cross-Site Scripting via several of its content type settings parameters in versions up to, and including, 1.0.4 due to insufficient input sanitization and output escaping. This makes it possible for authenticated attackers, with administrator-level permissions and above, to inject arbitrary web scripts in pages that will execute whenever a user accesses an injected page.
CVE-2023-0227	2023-01-11	pyload/pyload	Insufficient Session Expiration in GitHub repository pyload/pyload prior to 0.5.0b3.dev36.
CVE-2023-0243	2023-01-12	TuziCMS	A vulnerability classified as critical has been found in TuziCMS 2.0.6. This affects the function index of the file App\Manage\Controller\ArticleController.class.php of the component Article Module. The manipulation of the argument id leads to sql injection. It is possible to initiate the attack remotely. The exploit has been disclosed to the public and may be used. The associated identifier of this vulnerability is VDB-218151.
CVE-2023-0243	2023-01-12	TuziCMS	Es wurde eine Schwachstelle in TuziCMS 2.0.6 entdeckt. Sie wurde als kritisch eingestuft. Hiervon betroffen ist die Funktion index der Datei App\Manage\Controller\ArticleController.class.php der Komponente Article Module. Durch Beeinflussen des Arguments id mit unbekannten Daten kann eine sql injection-Schwachstelle ausgenutzt werden. Der Angriff kann über das Netzwerk angegangen werden. Der Exploit steht zur öffentlichen Verfügung.
CVE-2023-0244	2023-01-12	TuziCMS	A vulnerability classified as critical was found in TuziCMS 2.0.6. This vulnerability affects the function delall of the file \App\Manage\Controller\KefuController.class.php. The manipulation of the argument id leads to sql injection. The attack can be initiated remotely. The exploit has been disclosed to the public and may be used. The identifier of this vulnerability is VDB-218152.
CVE-2023-0244	2023-01-12	TuziCMS	In TuziCMS 2.0.6 wurde eine Schwachstelle entdeckt. Sie wurde als kritisch eingestuft. Betroffen ist die Funktion delall der Datei \App\Manage\Controller\KefuController.class.php. Dank der Manipulation des Arguments id mit unbekannten Daten kann eine sql injection-Schwachstelle ausgenutzt werden. Der Angriff kann über das Netzwerk passieren. Der Exploit steht zur öffentlichen Verfügung.
CVE-2023-0245	2023-01-12	Online Flight Booking Management System	A vulnerability, which was classified as critical, has been found in SourceCodester Online Flight Booking Management System. This issue affects some unknown processing of the file add_contestant.php. The manipulation of the argument add_contestant leads to sql injection. The attack may be initiated remotely. The exploit has been disclosed to the public and may be used. The identifier VDB-218153 was assigned to this vulnerability.
CVE-2023-0245	2023-01-12	Online Flight Booking Management System	Eine Schwachstelle wurde in SourceCodester Online Flight Booking Management System entdeckt. Sie wurde als kritisch eingestuft. Betroffen davon ist ein unbekannter Prozess der Datei add_contestant.php. Dank Manipulation des Arguments add_contestant mit unbekannten Daten kann eine sql injection-Schwachstelle ausgenutzt werden. Die Umsetzung des Angriffs kann dabei über das Netzwerk erfolgen. Der Exploit steht zur öffentlichen Verfügung.
CVE-2023-0246	2023-01-12	ESPCMS	A vulnerability, which was classified as problematic, was found in earclink ESPCMS P8.21120101. Affected is an unknown function of the component Content Handler. The manipulation leads to cross site scripting. It is possible to launch the attack remotely. The exploit has been disclosed to the public and may be used. VDB-218154 is the identifier assigned to this vulnerability.
CVE-2023-0246	2023-01-12	ESPCMS	Es wurde eine Schwachstelle in earclink ESPCMS P8.21120101 gefunden. Sie wurde als problematisch eingestuft. Betroffen hiervon ist ein unbekannter Ablauf der Komponente Content Handler. Mit der Manipulation mit unbekannten Daten kann eine cross site scripting-Schwachstelle ausgenutzt werden. Umgesetzt werden kann der Angriff über das Netzwerk. Der Exploit steht zur öffentlichen Verfügung.
CVE-2023-0247	2023-01-12	bits-and-blooms/bloom	Uncontrolled Search Path Element in GitHub repository bits-and-blooms/bloom prior to 3.3.1.
CVE-2023-0254	2023-01-12	Simple Membership WP user Import	The Simple Membership WP user Import plugin for WordPress is vulnerable to SQL Injection via the ‘orderby’ parameter in versions up to, and including, 1.7 due to insufficient escaping on the user supplied parameter. This makes it possible for authenticated attackers with administrative privileges to append additional SQL queries into already existing queries that can be used to extract sensitive information from the database.
CVE-2023-20522	2023-01-10	2nd Gen EPYC : 3rd Gen EPYC	Insufficient input validation in ASP may allow an attacker with a malicious BIOS to potentially cause a denial of service.
CVE-2023-20523	2023-01-10	2nd Gen EPYC : 3rd Gen EPYC	TOCTOU in the ASP may allow a physical attacker to write beyond the buffer bounds, potentially leading to a loss of integrity or denial of service.
CVE-2023-20525	2023-01-10	2nd Gen EPYC : 3rd Gen EPYC	Insufficient syscall input validation in the ASP Bootloader may allow a privileged attacker to read memory outside the bounds of a mapped register potentially leading to a denial of service.
CVE-2023-20527	2023-01-10	1st Gen EPYC : 3rd Gen EPYC : 2nd Gen EPYC	Improper syscall input validation in the ASP Bootloader may allow a privileged attacker to read memory out-of-bounds, potentially leading to a denial-of-service.
CVE-2023-20528	2023-01-10	2nd Gen EPYC : 3rd Gen EPYC	Insufficient input validation in the SMU may allow a physical attacker to exfiltrate SMU memory contents over the I2C bus potentially leading to a loss of confidentiality.
CVE-2023-20529	2023-01-10	2nd Gen EPYC : 3rd Gen EPYC	Insufficient bound checks in the SMU may allow an attacker to update the from/to address space to an invalid value potentially resulting in a denial of service.
CVE-2023-20530	2023-01-10	3rd Gen EPYC	Insufficient input validation of BIOS mailbox messages in SMU may result in out-of-bounds memory reads potentially resulting in a denial of service.
CVE-2023-20531	2023-01-10	2nd Gen EPYC : 3rd Gen EPYC	Insufficient bound checks in the SMU may allow an attacker to update the SRAM from/to address space to an invalid value potentially resulting in a denial of service.
CVE-2023-20532	2023-01-10	2nd Gen EPYC : 3rd Gen EPYC	Insufficient input validation in the SMU may allow an attacker to improperly lock resources, potentially resulting in a denial of service.
CVE-2023-21524	2023-01-10	Windows : Windows Server : Windows Server 2019 (Server Core installation) : Windows Server 2022 : Windows Server 2022 (Server Core installation) : Windows 10 Version 20H2 for x64-based Systems : Windows 10 Version 20H2 for 32-bit Systems : Windows 10 Version 20H2 for ARM64-based Systems : Windows 11 version 21H2 for x64-based Systems : Windows 11 version 21H2 for ARM64-based Systems : Windows 10 Version 21H2 for 32-bit Systems : Windows 10 Version 21H2 for ARM64-based Systems : Windows 10 Version 21H2 for x64-based Systems : Windows 11 Version 22H2 for ARM64-based Systems : Windows 11 Version 22H2 for x64-based Systems : Windows 10 Version 22H2 for x64-based Systems : Windows 10 Version 22H2 for ARM64-based Systems : Windows 10 Version 22H2 for 32-bit Systems : Windows Server 2016 (Server Core installation)	Windows Local Security Authority (LSA) Elevation of Privilege Vulnerability.
CVE-2023-21525	2023-01-10	Windows : Windows Server : Windows Server 2019 (Server Core installation) : Windows Server 2022 : Windows Server 2022 (Server Core installation) : Windows 10 Version 20H2 for x64-based Systems : Windows 10 Version 20H2 for 32-bit Systems : Windows 10 Version 20H2 for ARM64-based Systems : Windows 11 version 21H2 for x64-based Systems : Windows 11 version 21H2 for ARM64-based Systems : Windows 10 Version 21H2 for 32-bit Systems : Windows 10 Version 21H2 for ARM64-based Systems : Windows 10 Version 21H2 for x64-based Systems : Windows 11 Version 22H2 for ARM64-based Systems : Windows 11 Version 22H2 for x64-based Systems : Windows 10 Version 22H2 for x64-based Systems : Windows 10 Version 22H2 for ARM64-based Systems : Windows 10 Version 22H2 for 32-bit Systems : Windows Server 2016 (Server Core installation)	Remote Procedure Call Runtime Denial of Service Vulnerability.
